comment,user_name,date,likes,compound,sentiment,sentimento_manual
This is a piss poor excuse for country wtf happened to the genre for this to win the grammy she's basically stills doing the same music just in a lower tone n to a slightly different style beat it's sad,@mummbles8319,2025-02-06T17:49:42Z,0,-0.8689,Negative,Negative
Antonette Course,@BurtShalhoup-u4w,2024-09-12T05:42:08Z,0,0.0,Neutral,Neutral
After listening to the song i can understand why many (other than the culture war grifters) do not really consider this song to be country. this sounds like slightly less generic mainstream pop which it essentially is to my ears.,@realKarlFranz,2024-10-09T17:35:23Z,0,-0.34,Negative,Neutral
MAMMIE BARRY you tube channel/5#@$MUMMY TOMBSTONE45😮BUY outy c45😢❤🍓🤓⚰️🤡💰📜🙃⚽️♟️♟️♟️♟️♟️⚰️🧤🍓😅😮😢🎉😂❤3,@MammieBarry,2025-02-06T18:31:39Z,0,0.5994,Positive,Neutral
what a shit garbage of music😢trash+trash+trash😢its more streptiz then music😂60s 70s 80s best music of all time😊abba😊queen😊led zeppelin😊deep purple😊blondie😊police😊u2 and so on....,@ringo-b5o,2025-06-04T14:06:38Z,0,0.9867,Positive,Positive
"Absolutely stupid video…nothing to do with the lyrics, just selling sex.",@BlessedEternally1,2024-05-29T04:08:01Z,0,-0.5709,Negative,Neutral
Opening notes remind me of Gretchen Wilson’s Redneck Woman https://youtu.be/82dDnv9zeLs?si=G2FWKp-HCcPxtqn4,@Marina-em3cr,2024-05-13T02:34:00Z,0,0.0,Neutral,Neutral
"To all the people saying ""its a visualiser"" what the hell is a visualiser?? Is that the thing we're calling the little looped videos they use for Spotify or something? Can we call it something else given that ""visualiser"" is a generic word?",@opium32,2024-05-12T07:54:30Z,0,-0.7622,Negative,Negative
This song is awful,@cmanthonywillis1432,2024-05-08T21:20:52Z,0,-0.4588,Negative,Negative
Is this looping worst music video ever but Beyonce is looking good 😂,@ConnorMacMurdie,2024-05-07T08:45:02Z,0,0.7311,Positive,Negative
"Catchy tune, but is this the best they could do for a video?!!!!!😮",@tinarob6796,2025-02-06T02:21:39Z,0,0.8388,Positive,Positive
