classificacao,comentario,justificativa
Neutral,It gives me sad russian vibes and I love it,"Expresses a specific, somewhat evocative, feeling without strong positive or negative connotations."
Positive,Night ride vibes,Evokes a positive and evocative feeling associated with a pleasant experience.
Positive,Mr. Kitty- After Dark vibes 🎶,Expresses enjoyment of the song’s similarity to Mr. Kitty’s style.
Positive,Like the vibe,Expresses a positive feeling about the music's atmosphere.
Positive,Am I the only one getting pinkpatheress vibes from this? 😂❤,Expresses enjoyment and similarity to another artist.
Negative,Proud of how deep it hit hit hits the back of your cervix. Then I hit it from the back and it goes splat so we don't get attached. Splat splat splash.,"Uses vulgar and unsettling imagery, indicating strong disapproval."
Positive,Gravity falls vibes,Evokes a nostalgic and positive association with the popular show Gravity Falls.
Positive,This song has strong Maureux vibes ❤ love it,Expresses love for the song referencing 'Maureux vibes'.
Positive,I feel the 1980s and punk  1990s vibes in this,Expresses a nostalgic and positive appreciation for the music's style.
Positive,"If you love vibe,🎉",Expresses enthusiasm and enjoyment.
Positive,ayo the lyrics and the tempo clearly got the rizz fr. love the tune,Expresses enjoyment and appreciation for the song's rhythm and lyrics.
Neutral,Gallowdance vibes,"Evokes a specific, somewhat unsettling musical style without expressing positive or negative emotion."
Positive,Summer Vibes coming!!!!!!!!,Expresses excitement and enjoyment associated with the song's theme.
Positive,"80s vibes, they dont make it like this anymore 😢. I wonder why we all so attracted to it ...",Expresses nostalgic appreciation and positive attraction to the music's style.
Neutral,"love the feminine voice part, the guys singing & lyrics are utter garbage though",Mixed opinion expressing appreciation for one aspect while criticizing another.
Neutral,does anyone have the lyrics typed out ?,Asks for information without expressing an opinion.
Positive,Why is this song so freakin catchy,Expresses enjoyment and finds the song appealing.
Positive,Gives me the neighborhood vibes,"Evokes a nostalgic and pleasant feeling, suggesting enjoyment."
Neutral,Anyone know of similar beat/sounds/style songs?,Asks for recommendations without expressing a positive or negative opinion.
Positive,"I thought Mareux made this, it gives perfect girl vibes",Expresses a positive feeling and association with a desirable quality.
Positive,Did you put crack in this song? It’s so catchy. ✨,The comment expresses enthusiastic enjoyment of the song's catchiness.
Positive,Vibes of mareux the perfect girl oh who is she ...❤❤❤❤,Expresses strong positive feelings and admiration.
Negative,Idk why but this song gives me andrew graves vibez,"Reference to Andrew Grayves, known for controversial and often negative opinions, suggests a dislike of the song."
Positive,Unexpectably catchy,Expresses a positive reaction to the song's catchiness.
Positive,Crazy short but good lyrics,Expresses a positive assessment of the song's lyrics.
Positive,This gives me midnight vibes ❤,Expresses fondness and association with a specific song/artist.
Neutral,É synthpop ou wave?,Asks a question about the genre of the music.
Positive,"this smacks on it's own, but i'm getting trouble andrew vibes. love it. (listen to his older stuff- see no good and chase money. but his recent stuff's fire too)",Expresses enjoyment and recommends exploring other music by the artist.
Negative,"Suck a terrible song. Bad singing, poor lyrics. Sounds like Missing Persons from the 80’s.",Strongly criticizes the song's quality and compares it unfavorably to a specific artist.
Positive,Que vibe maravilhosa 🥰❤️,Expresses strong positive feelings with emojis.
Positive,this is like if u wanted after dark to be fast and upbeat,Expresses enjoyment and comparison to a positive attribute.
Neutral,"The lyrics are so real cold 🥶 shit for a person to say to another person in life,  no the less very catching song.",Expresses a neutral observation about the lyrics combined with a recognition of the song's catchiness.
Negative,the song is super catchy but I am amazed how the girls like these lyrics :s or most of them just dont get what he is sayin,Expresses disbelief and criticism of the singers' understanding of the lyrics.
Positive,Shit blew up. Catchy song,Expresses excitement and enjoyment of the song.
Positive,this is catchy as shit. good job.,Expresses enthusiastic approval with strong positive language.
Positive,I wish all his songs were upbeat darkwave. This song goes so fucking hard,Expresses strong enthusiasm and positive feelings about the song's energy.
Positive,Bro it really gives me The Cure vibes,Expresses a positive association with The Cure's musical style.
Negative,"Gosh i love the song, but the lyrics is so f-boy, i canttttttttttttttttttttttttttttttttttttttttttt",Expresses strong disapproval of the lyrics as 'f-boy'.
Positive,The girl is gorgeous<33 luv the vibe,Expresses admiration and affection for the artist.
Positive,"This reminds me of 80s style music, 80s music is very simple and easy beat in music. I love it",Expresses appreciation for the song's similarity to 80s music.
Positive,From insta. Very catchy,The comment expresses a positive sentiment due to 'very catchy'.
Neutral,its slowed and reverb version: https://youtube.com/shorts/LTdd5NQyt74,Describes a specific version of the song without expressing a strong positive or negative opinion.
Neutral,Need Beats?,"A simple question seeking a response, lacking sentiment."
Neutral,Who are the female vocals from?!?!?,Expresses confusion and a question about the song's vocalists.
Negative,"Great melody, but shame about the abuser vibes this song's giving.",Expresses disapproval due to perceived problematic themes.
Neutral,"Let’s be honest, lyrics are trash and empty, but I like the vibe of it if you ignore them",Acknowledges lyrical flaws while expressing enjoyment of the overall atmosphere.
Positive,Uma vibe alienígena futurístico que eu amo e respeito muito!!!! 🛸🤍,Expresses strong positive feelings and appreciation for the song's theme.
Negative,"This girl, again GIRL, is hitting what from the back? I am a little lost... This is something only a man could say but never would (unless there are some deviations at play), for the idea that mere sexual positions affect emotional connection is utterly ridiculous. She sounds like a virgin inventing things. I'll just say, the song is 1980s but the lyrics are pure 2020s, sadly.",Contains harsh criticism of the artist’s vocal technique and suggests a lack of sexual experience.
Positive,Vibe😈,"The emoji '😈' typically conveys a positive, playful, and exciting vibe."
Neutral,"I need one more verse, it's over way too soon...",Expresses a desire for more song content without strong positive or negative emotion.
Negative,Idioticly simplistic tune and awful lyrics. You cannot be serious,Strongly criticizes the song's simplicity and poor lyrics.
Positive,very catchy,Expresses positive sentiment due to the description of the song as 'very catchy'.
Positive,This catchy 💯🔥,Uses emojis to express strong positive feelings.
Positive,this is such a vibe!,Expresses enthusiastic enjoyment and a positive feeling.
Positive,Grimes Flesh without blood vibes,Expresses appreciation for the song’s similarity to Grimes’s ‘Flesh Without Blood’.
Positive,vibe 10/10,Expresses strong positive sentiment with a numerical rating.
Positive,I feel such a Zady vibe from this song 💔,"Expresses a fondness for the song, aligning it with a specific artist/aesthetic."
Negative,Ass song ass lyrics,Strongly negative assessment of the song's quality.
Neutral,This reminds me of Mareux with feminine vocals. Even though it’s Artemas singing it.,"Comparison to another artist, offering a descriptive observation without strong positive or negative judgment."
Positive,Its so catchy omg,Expresses strong enthusiasm and enjoyment of the song.
Positive,Like a good vibe,Expresses a positive feeling associated with the music.
Neutral,Vibe toh hai,Uses an expression of feeling ('vibe') without expressing positive or negative emotion.
Positive,BABY YESSSSSSSS fuggin sexy ass beat. I love it ❤feed me Seymour!,Expresses strong enthusiasm and positive feelings towards the music.
Positive,"I need this on one of the Cyberpunk 2077 radio stations ASAP, it has such a vibe",Expresses a strong desire to hear the song on a specific platform due to its appealing vibe.
Neutral,the beat is sooooo,"Expresses a simple, unadorned opinion about the beat."
Neutral,She should do vocals on a 90s type eurodance song. Like maxx or something,Suggests a stylistic change without expressing a positive or negative opinion about the current song.
Positive,Vibes all day!!,Expresses enthusiastic enjoyment and positive feelings.
Positive,the beat gives me gravity fall vibes !!!!,"Compares the beat to a beloved animated series, indicating a positive association."
Positive,I was about four years old in pre school I remember walking up too a girl during recess an kissed on the lips and looked into her eyes with love ❤ I remember the adults laughing and being happy they had other emotions on their faces but don't remember what thee emotions where anyway I was very young but remembered that.,"Expresses a cherished, nostalgic memory of a positive childhood experience."
Positive,I sure did... The vibe and the beat just resonates within Me.,"Expresses a strong, personal connection and enjoyment of the music's vibe and beat."
Positive,"The up n coming on all sides life, to watch your smiles n hopes that you'll remember me n my name Toney Bolden. Nice to meet you. . I like the style of sounds. .something that goes with my style of life. ❤",Expresses fondness and appreciation for the music's style.
Neutral,"I love the song, but don't like the lyrics at all, I feel torn",Expresses both positive feelings towards the music and negative feelings toward the lyrics.
Neutral,Want a vibe that goes with this song? https://youtu.be/_6TktgCmFKA,Provides a link but doesn’t express a clear sentiment about the song itself.
Negative,"I’m make the lyrics/ I like the way you kiss me  I like the way you, uh I like the way you kiss me I can tell you miss me  I can tell it hits hits hits not tryna be romantic I’ll hit it from the back  just so you don’t get attached  I like the way you kiss me I can you you miss me I can tell it hits hits hits not tryna be romantic I’ll hit it from the back just so you get attached you bite my lip just for the taste your on your knees I’m on the case you take the heat and with such grace you say we’re done but here you stay said your scared I’ll let you down stick around and you will find out don’t you wanna make me proud cause I’m so proud baby I’m so proud of you I like the way you kiss me I can tell you miss me I can tell it hits hits hits  not tryna be romantic  I’ll hit it from the back just so you don’t get attached I CANT DO MORE SORRY",Overly explicit and suggestive lyrics create a negative impression.
Positive,"this track is so catchy, new order bass guitar vibes 🙂",Expresses enjoyment and references a positive musical influence.
Neutral,Jake webber vibes,"References a specific artist, indicating a recognition but without expressing a clear positive or negative opinion."
Positive,This is very catchy,Expresses enjoyment and appreciation for the song's catchiness.
Neutral,Who is the female vocalist in this song?,Asks a question about the song's features without expressing opinion.
Positive,I love love the explicit lyrics ❤,Expresses strong positive sentiment due to appreciation for explicit lyrics.
Positive,Nice tune and interesting voice modulation from female to male to androgynous. I do kinda wish there was and actual band however... but he is talented.  This sort of reminds me of vintage Fischerspooner or Caribou with a touch of The Weeknd style vocals.,Acknowledges talent and positive stylistic comparisons.
Neutral,bass gives me blue monday vibes,"Compares the song's bassline to a well-known song, indicating a similarity without expressing strong positive or negative feelings."
Positive,the video but the song is a catchy tune,Expresses enjoyment of the song's catchiness.
Positive,GREAT VIBE! LOVE IT!,Expresses strong positive feelings and enjoyment.
Neutral,Does anyone actually listen to the lyrics??,Expresses doubt about listener engagement with the song's lyrics.
Neutral,Rex/Rudy Robot vibe,"A short, descriptive comment without expressing positive or negative emotion."
Negative,"Is it a woman singing or auto tune? If it's a woman then ""I'll hit it from the back"" doesn't make a lot of sense, and if it's auto tune Artemas then why did he turn his voice into a woman's voice? The song is a great vibe, I just had to ask because that seems odd either way.",Expresses confusion and skepticism about the vocals and production.
Positive,mareux the perfect girl pitch up,Expresses admiration for the artist.
Negative,Almost really good should have more manly deeper tones to go with the chick,Criticizes the music's lack of masculine tone.
Positive,Vibe is sooo good,Expresses a positive feeling about the music's atmosphere.
Positive,"Incredible melody, the electronic beat and the female vocal",Expresses enthusiastic appreciation for the song's elements.
Positive,It gives 80s vibes.,Expresses a positive association with a nostalgic musical style.
Negative,this might be the worst song made in the history of all time,Strongly expresses extreme dislike and considers it the worst song ever.
Negative,"The ""Most Played"" is reversed to every other video I've ever seen, because people keep jumping to the start to listen again!",Expresses frustration and annoyance with viewers repeatedly re-watching the beginning of the video.
Neutral,Crystal Castles vibes,"References a specific band, indicating a similarity without strong positive or negative emotion."
Negative,why am i feeling a mareux vibe?,Uses ‘mareux’ (a slang term for unpleasant or sickening) to express a negative feeling.
Neutral,alguem conhece mais música dessa vibe?,"Asks a question seeking similar music, lacking explicit positive or negative sentiment."
Neutral,"The part at :32 , what is the 90s/00s song that did that same type of rhythm for the lyric delivery? it's driving me crazy",Expresses a specific musical question without strong positive or negative emotion.
Positive,The vibe hits differently exactly 5 days before BAC.,Expresses a strong positive feeling and connection to the song.
Neutral,It’s giving Marina and the Diamonds vibes.,"Compares the music video to Marina and the Diamonds, offering a descriptive comparison without strong positive or negative sentiment."
Positive,"I remixed this track with similar perspective adding a burst of creative energy. Fully immersed in the essence of the music, I found myself drawn to the enduring charm of its basic harmonies and the steadfast reliability of its song structure. It's like rediscovering an old favorite with new eyes – there's a sense of familiarity that brings comfort, yet there's also an exciting element of exploration as I delve deeper into its intricacies. With each beat and melody, I'm reminded of the timeless beauty inherent in simplicity, and the profound impact that tried-and-true methods can have on a listener's soul. In a world of constant change and innovation, there's something deeply reassuring about returning to the roots of what makes music truly captivating.",Expresses fondness for the song's familiar and comforting qualities.
Positive,"This is gonna beat billie eillish, waited 5 long years 4 this.",Expresses anticipation and belief in the artist's future success.
Positive,this is so catchyyy,Expresses strong positive sentiment regarding the song's catchiness.
Positive,It gives me old tumblr vibes and i love it,Expresses fondness for a nostalgic musical style.
Positive,gives me the perfect girl by mareux vibes,"Compares the song favorably to another song, indicating enjoyment."
Neutral,"INCROYABLE, chere moi si tu reviens la 3ans apres, oublie pas la team oreo et c, les notes ? Sa gazz ? ️🥐️L⭕✌ℹ️️💲",Contains enthusiastic praise mixed with informal and nonsensical expressions.
Positive,getting major gravity falls vibes in the best way possible,Evokes a positive association with the popular show 'Gravity Falls'.
Positive,Synthwave is still alive im happy,Expresses happiness and affirmation of the genre.
Neutral,Really love songs like this with that indie synthwave vibe but with more dance edm type what kind of genre is this???,Expresses appreciation for a style but asks for genre clarification.
Neutral,Who is the girl vocal?,Simple question lacking sentiment.
Positive,I cant help but to dance to this song.  Darkwave and synth and pop and goth.  So good.,Expresses strong enjoyment and a desire to dance to the music.
Positive,'80s synth-pop will always sell.,Expresses enthusiasm for a specific musical style.
Neutral,"This song really has been out for a month?! , this looks too nostalgic to be out for a month tbh",Expresses mild surprise and a slightly negative reaction to the song's longevity.
Positive,scrolling and randomly finding this vibe 🖤🐈‍⬛🔥,Expresses a positive feeling and enthusiasm with emojis.
Negative,These lyrics give me the ick,Expresses disgust and aversion regarding the song's lyrics.
Negative,"This song is not it at all, just repeated lyrics and not a song to clap cheeks to🤷🏽‍♂️",Expresses dissatisfaction with the song's lack of quality and enjoyment.
Positive,Finally a song that has the same vibe as mr kitty - after dark,Expresses appreciation for a similar vibe to a popular song.
Positive,omg it has such a VIBE,"{""sentiment"":""Positive"",""justification"":""‘Vibe’ is a commonly used positive descriptor for music.”}"
Neutral,"Why is there ""hits"" in the lyrics, when it sounds like ""this""""?","Raises a question about the lyrics, lacking strong positive or negative emotion."
Positive,THE SYNTHPOP VIBEEEE,Expresses enthusiastic enjoyment of the synthpop genre.
Negative,"Nice beat, toxic lyrics.",Highlights a positive aspect (beat) alongside a negative one (toxic lyrics).
Negative,"New gen music be like: find some catchy lyrics, beats and repeat the phrase over and over in the final song.",Critiques modern music as repetitive and lacking depth.
Negative,disgusting lyrics,Expresses strong disapproval of the song's lyrics.
Neutral,so 2000-2010 camera vibe,Describes the song’s musical style with a nostalgic reference.
Negative,What an awful background choice for a equally awful(but great sounding) song.  Thanks TikTok and reels,Expresses dissatisfaction with both the background music and the song itself.
Negative,this is awful,Expresses strong dissatisfaction with the music.
Negative,Worst music video ever.,Expresses strong disapproval of the music video.
Negative,Worst song ever made on 21st century. 😢,Expresses strong disapproval and sadness about the song.
Negative,"Love these lyrics lol. ""I'm proud of you, lets do anal""",Contains explicit and offensive lyrics.
Neutral,This and if you think im pretty just gives me vibes of an unkown weird power that makes me vibe by doing weird movements with my body.,"Describes a strange, unsettling feeling without explicitly positive or negative emotion."
Positive,"so good, love if it had another verse",Expresses enjoyment and desire for more content.
Positive,This gives old vibes combines with more modern vibes idk but i like it quite a lot,Expresses a positive feeling despite ambiguity.
Positive,This a vibe 🤩,Expresses enthusiastic enjoyment using the phrase 'This a vibe'.
Negative,"these lyrics disgust me. Just when I wanted to share this with my woman, it says “I can hit it from the back so you don’t get attached” just when I had something to add to our love disco, the artist is a fuck boy ugh",Expresses strong disgust and insults towards the song lyrics and the artist.
Positive,What a tune!! Need to sample these vocals 🙏🏼,Expresses enthusiastic appreciation for the song.
Neutral,2024 vibes 🤘,Expresses a general feeling associated with the current year without strong positive or negative connotations.
Positive,Perfect blend of nostalgic indie sounds and modern electronic vibes... well fucking done if i may say so myself,Expresses strong approval and praise for the music's combination of styles.
Neutral,Charts these days are so strange. You can have high quality music with meaningful lyrics at the top of the chart but then also have songs like this with no meaning...,Expresses a general observation about the current state of music charts.
Positive,I love the cure vibes I get from this song💖💯😎,Expresses enjoyment and appreciation for the song's resemblance to The Cure.
