classificacao,comentario,justificativa
Neutral,Westworld vibe there,References a specific aesthetic/theme without expressing positive or negative emotion.
Positive,"I do not care for country, nor do I care for these nasty comments. But because I grew up around country, I know when I hear a catchy country tune. I love this… it may not be your normal to the others, but I am very appreciative of your flexibility with music, it gives me a new perspective.  This is a beautiful piece that you sang your heart out to, and I feel like more people should appreciate it for just what it is. 🔥💚🔥",Expresses appreciation for the song and its unique qualities.
Positive,"No boundaries. No shirt, but nice beat.  Nice voice. Beautiful.","Expresses admiration for the song's beat, voice, and overall aesthetic."
Neutral,It’s strange to think about how a few years from now this will be really nostalgic.,Expresses a reflective and slightly detached observation about the future impact of the song.
Positive,"I think it's good to have the courage to sing a country song , a real catchy tune  ❤",Expresses appreciation for the song and uses a positive emoji.
Negative,this won a grammy?? well its givin DEI vibes 😂😂😂😂😂😂😂😂😂😂😂😂😂😂😂😂😂😂😂😂,Sarcastic remark ridiculing the Grammy win.
Negative,This is an insult to the real hard working country singers out there. Wow. There is no “country” in this song at all. It’s awful!,Expresses strong disapproval and declares the song to be awful.
Positive,Love the lyrics “we headed to the dive bar we always thought was nice “.  Because living in the simple life of the deep country areas with no money going to the local bar thats a complete dive always seems nice to folks who don’t know no better.,Expresses fondness for the lyric and a nostalgic appreciation for simple living.
Positive,This song is a vibe idc idc,Expresses enjoyment and acceptance of the song's atmosphere.
Positive,"BeyHive! ""Texas Hold Em"" has now surpassed 600 million Spotify streams! This is Beyoncé's 11(12)th song to reach this milestone! Keep streaming! 🐝👑",Expresses excitement and encouragement to continue streaming.
Positive,Sheeee is such a vibe 🎉🎉🎉🎉❤❤❤❤ go BEYONCE GET IT COUNTRY 🎵🎶 MUSIC,Expresses enthusiastic enjoyment and support for the artist.
Negative,This is the WORST ATTEMPT AT COUNTRY MUSIC! GIRL! Stay in your lane!,"Strong, dismissive criticism of the music as poor country music."
Positive,Beyonce is absolutely stunning here. The songs a great catchy pop choon.,Expresses strong admiration and positive feelings towards the song.
Neutral,"I’ve never been a fan of Beyoncé, but this song can easily get lost in your head, and you can’t shake it. Besides that, I do have to say this.  Experimenting with different genres can help, until you find your voice, all new singers that break out into the music scene do this.  But for Beyoncé who’s been doing R&B, pop and hip hop music for as long as she has to jump ship to country is a big leap. Her voice is a powerhouse in the other genres of music and that’s been her vibe for all of her musical life. It’s great she’s expanding her repertoire and trying her hand at Country, and  Country musicians welcomed her with open arms to the country music  family.  But with her vocals mixing with country music is an absolute long shot. I admit country music isn’t what it used to be, it’s a little more poppy, but there some artist’s that love to go back to the traditional ways of what country music use to be. But in the case of Miss Beyoncé, there are already Country Queens. I’d rather her be in the zone where she has been labeled a queen in her more recognized career.","Expresses a mix of observation, critique, and cautious optimism about Beyoncé's new genre exploration."
Negative,Worst music video in history,"Expresses a strong, negative opinion regarding the music video."
Negative,Worst music video goes to Beyonce,Expresses a strongly negative opinion about the music video.
Neutral,Hi I'm one of Riley's new emotions.,A simple greeting with no expressed sentiment.
Positive,"I love this song! Shame on people who think we don't have the freedom or right to sing any damn thing we want, especially with a voice like Beyonce! It's is fun with a great beat...",Expresses strong enjoyment and admiration for the song and artist.
Neutral,"And I'm not saying it isn't a catchy song, but not, IMHO, a country song.",Expresses a subjective opinion about the genre without strong positive or negative emotion.
Positive,"I like this song, very catchy.....",Expresses enjoyment and describes the song as catchy.
Negative,Is this a joke song making fun of country music or something? This might be the worst song ever recorded,Expresses strong disapproval and considers it a terrible song.
Negative,Lol. Shes deep into DIDDYS parties,Expresses amusement and judgment regarding the artist's behavior.
Negative,"Seriously what is wrong with music nowadays 🙄 remember the times when Michael Jackson was creating mini movies to his songs, every single one was unforgettable. This looks so cringe and boring 😬",Expresses disapproval and finds the music to be cringe and boring.
Negative,She didnt deserve THE GRAMMY! Who even listens to this album?! Like come on! The fake surprise when they said her name in the grammys UPSET ME and seeing billie eilish crying made most of all of the fans sad! Over all HMHAS had the most listeners and her vocals are great i dont say i hate her but this album deserved for 2024 grammys bot 2025!,Expresses strong disapproval of the Grammy win and criticizes the album.
Negative,This song sucks. Its so boring and generic,Expresses strong dislike for the song's lack of originality and excitement.
Positive,"I truly enjoyed the album and the philosophy behind it. I know every word because it's been on repeat since its release. I would love to see AMERIICAN REQUIEM used as a soundtrack in a film. I have a hot dance routine for Bodyguard. I loved being on an emotional roller coaster while listening to this masterpiece. Some of my favorite songs include Levi jeans, Protector, Riverdance, Yaya, Tyrant II Most Wanted, Bodyguard, Blackbird, 16 carriages, and Texas Hold 'Em, not to mention spaghetti. The engineer's sound and her excellent vocals just made everything come together seamlessly.","Expresses strong enjoyment, repeated listening, and appreciation for the music's impact."
Negative,"The most monotonous and repetitive eye candy ever 😂 completely out of sync with the song. I'd expect more dancing and more DANCERS. Such a disappointment, that's not what one imagines while listening to this very well conceived song",Expresses strong dissatisfaction with the music video's visuals and execution.
Negative,Just awful and this is coming from a native Texan.,"Expresses strong disapproval and identifies as a Texan, indicating a particular critique."
Negative,Probably one of the worst songs I have ever heard in my whole life,Expresses extreme dissatisfaction and declares it a terrible song.
Negative,Awful,Expresses strong disapproval and identifies the song as 'awful'.
Negative,Awful... 😢,Expresses strong dislike using the word 'awful' and an emoji.
Negative,"So bad... (Not being sarcastic, or saying she's ""Bad"". It's just awful.)",Expresses strong disapproval and describes the song as 'awful'.
Positive,The vibe is immaculate ✨️,Uses enthusiastic language ('immaculate') to express strong positive feelings.
Negative,"Gotta be the very worst song I’ve ever heard, right behind WAP.","Strongly criticizes the song as being exceptionally bad, comparing it unfavorably to another song."
Negative,Just an awful song lol,Expresses strong dislike and uses a dismissive term.
Negative,I don't care how much backlash I get but you can't make a country song with cuss words in it. Sorry Beyonce but that's not how country rolls. Also this in my opinion is worst song I ever heard from her. No hate just stay in your lane (btw the way before you say this is racist im black)  I like country the way is no cussing. You can't call it a country song if there's cussing in it. If you look at all the country songs there's not one cuss word in them. Stay with the hip hop genre.,Strongly criticizes Beyoncé's song for violating country music conventions and expresses a negative opinion.
Negative,This is by far the worst video I have ever seen. And the song isn't far behind it.,Strongly criticizes the video and song as being exceptionally bad.
Negative,Beyonce you are the worst singer 😂,Expresses strong disapproval and mockery of Beyoncé's singing ability.
Negative,Beyonce knows nothing of Texas or country she's just a good vocalist from the Streets,Expresses strong criticism and disbelief about Beyonce's connection to Texas and country music.
Negative,God awful,Strongly negative expression of disapproval.
Negative,This is disgusting. Her video is vile. Her voice is awful combined with country style. It sounds like a joke and she actually won? What an absolute disgrace and an insult to real country artists. And on top of all that she is walking around with a stupid blonde wig.,Expresses strong disapproval and insults the artist's music and appearance.
Negative,This is such a rubbish track. Awful.,Expresses strong disapproval and uses negative descriptors.
Negative,Holy hell this is worst thing since her last album🤮🤮🤮🤮,Expresses extreme dissatisfaction and disgust with the music.
Negative,"Eeeewww how we all question their lyrics, will music ever survive, who wants to b that pretty😂😂😂❤❤❤",Expresses skepticism and ridicule regarding the music's lyrical content.
Negative,"Worst album, can’t believe this got chosen over billie, WILD",Expresses strong disapproval and comparison to another artist.
Positive,I think this song is great! It's definitely catchy.😊,Expresses positive enjoyment and describes the song as catchy.
Negative,I came here thinking I was going to hear country music. I was awfully wrong,Expresses disappointment and disagreement with the music genre.
Neutral,This isn’t a bad song but it’s not country. It’s more pop with Country vibes.,"Acknowledges a mix of pop and country elements, expressing a qualified opinion."
Negative,This is the worst country song by a non-country artist EVER.,Strongly criticizes the song as a poor example of country music.
Negative,Worst crap i ever heard. Tell the truth people.  The truth will set you free !!!!! Lmao😂😂😂😂😂,Expresses strong disapproval and uses sarcastic language.
Negative,How TF did this shit song beat the masterpiece that Chris Stapleton played with Cold,Expresses strong disdain and comparison to a superior work.
Negative,"Sounds like she wrote country lyrics and decided to imitate bruno mars with her hoooooo's, She a good singer, but I gotta admit this is bad",Expresses criticism of the lyrics and vocal style.
Positive,Catchy. It Grew on me lol,Expresses enjoyment and indicates the song's appeal developed over time.
Negative,One of the worst mv i have ever watched lol,Expresses strong disapproval and uses a dismissive laugh.
Negative,This song is the worst country song I've ever heard,Strongly expresses dislike and declares it the worst country song ever heard.
Negative,this isn’t country & how she won the country music award is mind boggling.. oh wait it’s hush money type of vibe lol she part of the diddy shiit,"Expresses disbelief and criticism regarding the award win, using derogatory language."
Negative,How bad were the other country songs that this garbage beat?,Expresses strong disapproval and criticism of the song.
Negative,Worst song in history.  I am happy the hype died down fast cause it was so annoying to constantly hear it at the radio.,Strongly criticizes the song as the 'worst in history' and expresses annoyance at its radio presence.
Positive,I am loving the inclusent of diverse genre,Expresses positive feelings about the inclusion of diverse genres.
Negative,"monotonous, boring",Describes the song as monotonous and boring.
Positive,This is soo different 😮❤🎉maintaining her soulfulness too still😢,Expresses delight and appreciation for the artist's continued authenticity.
Negative,Adding an acoustic guitar doesnt make it country. This is trash for sure,Strongly criticizes the song as 'trash'.
Negative,"This ain't Texas is nothing like that Franklin theme song, so you people who are claiming that must be tone deaf...see a doctor!",Expresses strong disapproval and insults listeners.
Negative,No melody....nothing,Expresses strong dissatisfaction due to the absence of a melody.
Negative,Oh my gawd your who made this song beoncay made this song no wonder why I hate her I hated this song it’s like the worst song on the radio,Expresses strong dislike and criticism of the song and artist.
Positive,"Great beat, singing & lyrics.",Expresses positive feelings about the song's various elements.
Negative,Literally the worst video and worst song ever from Beyoncé. She should’ve never won the award for best country music😅 the award should’ve gone to chris stapleton🎉,"Expresses strong disapproval of the video and song, and criticizes the award decision."
Negative,Hahaha  That's awful.,Expresses strong disapproval and criticism.
Negative,so annoying song,Expresses strong annoyance and dislike of the song.
Positive,"Listen guys there are real country singers who shoulda won not her. But don’t go lying saying this shit ISNT a bop lmao it’s a good song has a good vibe and IS a country song in reality, and honestly? This is one of her best songs… unlike her old music really",Expresses positive enjoyment and praises the song's quality.
Negative,Worst album ever wtf,Expresses extreme dissatisfaction with the album.
Negative,Seriously worst video ever.,Expresses strong disapproval and criticism of the music video.
Negative,this is one of the worst and cringiest songs ever,Strongly criticizes the song as 'worst' and 'cringiest'.
Negative,"Could possibly be the worst song ever written. Seriously, all hype and zero substance",Strongly criticizes the song as awful and lacking substance.
Negative,Worst album,Expresses strong disapproval and condemnation of the album.
Neutral,"I'm just listening to this song for the first time and I honestly don't see the fuss. I place it in the Country Pop category right along with Shania Twain music.  It's not that deep for the controversy.  Did she deserve a Grammys?  That's always debatable and possibly not but hey, we don't get a vote in it - I never pay attention to it anyway.  The video and outfit could have been better though.",Expresses a lack of enthusiasm and offers mild criticism without strong positive or negative feelings.
Negative,One of the worst songs I've ever listened in my whole life,Expresses extreme dissatisfaction with the song.
Negative,I haven’t liked country music since the early 2000’s and this video gives me all the more reason to continue my dislike. This is the worst video I’ve ever seen.  Disrespectful and disgusting!,Expresses strong disapproval and condemnation of the video.
Negative,Sounds awful. No dynamic range at all. Loudness war has hit another peak.,Expresses strong dissatisfaction with the song's production quality.
Negative,THIS won a Grammy? Awful.,Expresses strong disapproval and criticism of the Grammy win.
Negative,This is the worst shit I’ve ever heard Beyoncé’s a muppet,Strongly negative and insulting statement about Beyoncé.
Negative,Worst song ever ever ever,Expresses extreme dissatisfaction and condemnation of the song.
Negative,This is by far one of the worst songs ever created….,Strongly criticizes the song as one of the worst ever created.
Negative,Listen to lyrics carefully. Tornado in the basement. Whose basement? Diddy's?,Expresses critical and potentially accusatory sentiments regarding the song's lyrics and references.
Negative,One of the worst songs i have ever heard,Strongly expresses dislike and considers it a terrible song.
Negative,This so called song has no chorus. It feels like an unfinished demo.,Criticizes the song as an unfinished demo lacking a crucial element (chorus).
Negative,Those lyrics are not country at all. Its just the twangy stringed instruments.,Expresses dissatisfaction with the song's lack of genuine country elements.
Negative,"The song is okay (C-) but I would not  play it again, or pay for it.. This song and video feels trashy and angry, not vibrant and powerful. Her music used to be a lot better.",Expresses disappointment and criticism of the song and video's lack of quality and positive energy.
Negative,"nunca vi ni escuché alguien justificando a la compra premios beyonce vocalisima me decepcionas, sobre todo habiendo tantas artistas realmente buenas para apoyar",Expresses strong disappointment and criticism of Beyoncé's vocal abilities.
Negative,This is the worst song I have ever heard,Expresses extreme dissatisfaction and declares it the worst song ever.
Negative,This is pretty much the worst song ever,Strongly expresses dislike and labels the song as 'the worst'.
Neutral,Backyardigans vibes,"Evokes a nostalgic comparison, without expressing positive or negative feelings."
Negative,Great.   This is all we need.   Country with pop stars singing vibrato horse shit with 47 notes per second garbage music.   Perfect.  😂,Strongly criticizes the music as bad and inappropriate.
Neutral,The tune is catchy. Her costume is trashy.,Expresses a positive opinion about the music but a negative opinion about the costume.
Negative,Worst song I've ever heard!!!!!!,Expresses extreme dissatisfaction and condemnation of the song.
Positive,Really inventive video      Not repetitive,Highlights the innovative and original aspects of the music video.
Positive,the queen of universe,Expresses extreme admiration and worship for the artist.
Positive,Didn't like Cowboy Carter but this one is a catchy song. I dig it.,Expresses enjoyment of the song despite disliking the previous album.
Negative,Did an AI write these lyrics? They play this song all the time at my workpalce and everyone hates it. Many of them are fans of her too,Expresses dislike of the song and suggests it was AI-generated.
Positive,"I'm trying to come up with words. A decade ago I had a weed induced panic attack to ""get me bodied"" I have always liked that song because it has a good beat and I was high as balls. Every other song of hers makes me wish I were deaf. I keep hearing about this song and her country thing. I had to watch the video and listen to this song. They definitely put a lot of effort into the video and the song is so good.im scared for what generations ahead call music.","Despite some anxieties, the commenter expresses a strong positive reaction to the song and video."
Neutral,It is a very catchy song and her stocking and black undies remind me of dancer Caldina from Magic Knight Rayearth.,"The comment contains a comparison to a nostalgic anime character, without expressing strong positive or negative emotion about the song itself."
Negative,"How did this win a Grammy?🤣🤣this is terrible worst song I’ve heard in my life, no wonder she fell off so hard,she’s just rich that’s the only reason she’s still making songs and buying her listeners🤣no one actually even listens to her no more though,judging by this song I can see why that is","Strongly criticizes the song and artist, expressing disbelief in her continued success."
Negative,"I got to say this is crap. Just cookie cutter stuff. I guess when you serve the devil you'll get a temporary payday on planet Earth, but you end up losing your soul",Strongly condemns the music as 'crap' and implies it's spiritually damaging.
Negative,This is going down as one of the worst songs in human history,Strongly condemns the song as one of the worst ever created.
Negative,This is the worst music that's been released in 10 years.,Strongly expresses dissatisfaction with the music's quality.
Negative,Another tricking annoying song first was that stupid I.m Single Lady This one is even worse what next for her maybe opera next haha,Expresses strong disapproval and annoyance with the song.
Negative,"I don't think country people like the video.  They might find it insulting.  I am brutally honest,  sorry. That shit ain't pretty.  😮 😅 But if this video was well known when ""Yellowstone""  was still on it would have been better.",Expresses a negative opinion about the video's appeal to a specific demographic and finds it distasteful.
Negative,This has to be one of the worst songs of 2024,Expresses strong disapproval and ranks the song as one of the worst of the year.
Neutral,At 1:45 how come I can hear the lyrics being edited from Sugar to liquor? Listen closely. I know Beyonce says both during the song.,Points out a specific detail of the song and suggests a possible explanation without expressing a strong opinion.
Negative,Beyoncé fell off. Worst singer ever. Went from singing about her ass to singing country to stay relevant,Strongly criticizes Beyoncé's music and career trajectory.
Negative,This is literally the worst fucking song ever created. Yikes,"Uses strong, aggressive language to express extreme dislike."
Neutral,This is really annoying but also really catchy please help like I hate it but I keep on listening to it- 😭💀,Expresses conflicting feelings of annoyance and attraction simultaneously.
Negative,"Catchy, but the Grammy's is CRAZY for this garbage album being named best Country Album!?! Although not wholly unexpected in Hollyweird were a man gets nominated for Best Actress",Expresses strong disapproval of the album's award and criticizes Hollywood.
Negative,"Sorry, but way way too overproduced....  and it really doesn't blend the pop/country vibes... shaboozey is doing it right and sounds hungry...Beyonce just seems bored. I'm just not digging it...",Expresses strong dislike and criticism of the song's production and artist's engagement.
Negative,"I never judge without hearing. And this ain't country. This is a bunch of country clichés put into one musical effort. And for those out there that wanna play the race card, it doesn't have anything to do with the color of skin. Shania Twain used to be country and after a few years, her music wasn't worthy of being called country. Nothing wrong with you if you like this composition, but it isn't country music.",Expresses strong disapproval of the music as lacking authenticity and relying on clichés.
Negative,Annoying AF,Uses a highly negative and emotionally charged term.
Negative,"This video is not creative, repetitive, nude scenes, no awards, forgettable. Beyonce all the time",Expresses strong disapproval and criticism of the video's lack of originality and quality.
Negative,"Sad to say this Is in a country album and she won against Chris Stapleton, it’s not a country song, says the same two lines the whole song, shit stupid and if u listen to the lyrics she just throwing shit together nothing about this song makes sense",Expresses disappointment and criticizes the song's lack of coherence.
Negative,Boring song. Please don't change country music to this monotonous stuff too. 😢,Expresses dislike for the song and criticizes its effect on country music.
Positive,Beyois still fire and I love the old school vibe.,Expresses appreciation for the artist and the nostalgic style.
Neutral,Not a country fan music but this is a vibe,Expresses a personal preference without strong positive or negative emotion.
Negative,"That’s not a f country music, lyrics are so dumb",Expresses disapproval of the song's genre and lyrical content.
Negative,what a shit garbage of music😢😢trash+trash+trash😢60s 70s 80s best music of all time😊abba😊queen😊led zeppelin😊deep purple😊beatles😊elvis😊eagles😊blondie😊u2😊police😊gun roses😊bon jobi😊nirvana😊and so on...,Expresses strong dislike and uses derogatory terms to describe the music.
Negative,This is awful 😂,Expresses strong disapproval using the laughing emoji.
Negative,Anyone who calls this country is tone deaf,Uses insulting language to criticize the music.
Negative,Unbelievable 😂 this is awful chris Stapleton carrie underwood,Expresses strong disapproval and criticism of the artist and song.
Neutral,A pop song with some lyrics about Texas and banjo in the background. Is that what makes it a country music song?,Describes the song's elements without expressing a clear positive or negative opinion.
Negative,"It's a catchy song, but why has the video got to be so over sexualized!",Expresses disapproval of the video's excessive sexualization.
Negative,This is your worst album,Directly criticizes the album as the artist's 'worst'.
Negative,"Theres nothing country about this...real country is raw, authentic, imperfect, rooted in values and a lifestyle, her vocals are WAY too polished and produced to be remotely country...its an OK song but has no place in the country genre except as a lame attempt at a cheap imitation.....to put this song in the same category as Toby Keith, Alan Jackson, Miranda Lambert, Reba McEntire is insulting to what makes country unique",Strongly criticizes the song as an inauthentic and insulting imitation of country music.
Negative,I wonder why shes been called the queen? Like wheres the queen vibes,Expresses skepticism and disbelief regarding the artist's title.
Negative,Truly one of the worst songs of all time.,Directly labels the song as 'one of the worst of all time'.
Negative,She a perv. Worst song and worst video EVER ! Yuk!,Expresses strong disgust and condemnation of the song and video.
