classificacao,comentario,justificativa
Positive,"Beyoncé the only one Star listed VOCALIST OF 21 century by VOCALS Experts, great performer, the singer in history Who sing more diferent rithmys, A living Legend ❤",Expresses strong admiration and celebrates Beyoncé's talent and legacy.
Negative,Yall are slow she stole the melody from a children’s tv show and put different words in it.,Accuses the artist of plagiarism by using a familiar melody.
Negative,this is awful wth,Expresses strong disapproval and dissatisfaction.
Positive,"Love this, very catchy 🙂",Expresses enjoyment and appreciation for the song.
Negative,"Worst video EVER, never get any awards for this thats for sure, lol.  Wow the ending of the song  sucked big time..",Expresses strong disapproval and criticism of the video and its ending.
Negative,"If country is crap this is a whole other level, it's like the turd lay a turd over another turd and water it down with the most vanilla guitar chords",Strongly criticizes the music as being bland and of poor quality.
Negative,"they were right, country fans have to be the most conservative, retrogade, annoying, insufferable people to ever exist",Expresses strong negative sentiment and judgment towards a group of people.
Negative,OMG that's awful,Expresses strong disapproval and identifies the music as 'awful'.
Negative,"Awful, terrible song. @Shaunjohnson885 don't reply.",Strongly criticizes the song as awful.
Negative,"Worst video ever. It would be great if there was a video around a countryside, travelling around with a kids and a dog in the car.",Expresses strong dissatisfaction with the video.
Positive,"So I've listened to this song now forcefully. I will say it is a catchy song. It's like the chicken dance song , a fun song. You could put it in your play list with those fun dance songs like the zorba, nutbush, the hustle, line dance. I bet people secretly dance to it at home hahaha","Expresses enjoyment and suggests a lively, danceable quality."
Negative,Ask yourself is her lyrics country be truthful and if it's not country please give me a example of what country is The first you have to put your hate and your evil spirit aside now let's get your honest opinion,"Expresses frustration and demands a sincere, unbiased opinion."
Negative,Absolutely fucking God awful.  She's a decent singer but this is fucking stupid,Strongly condemns the song as 'God awful'.
Positive,Amo você des do tempo da Distney Child ❤❤❤❤😂😂🎉😂🎉😂😂😂😂 1998,Expresses enthusiastic love and appreciation with celebratory emojis.
Negative,This shit is so ass. How does someone who made this trash song beat any country singer this is just dissapointing,Expresses strong disapproval and contempt for the song.
Neutral,At first I thought it was 'Prodigal Son' by the Rolling Stones.  🤷,Identifies a similarity to another song without expressing a strong positive or negative opinion.
Negative,"As a proud Texan this is the one of the worst happen to us apart Apart From Waco, TX And Uvalde",Expresses strong dissatisfaction and grief associated with tragic events.
Negative,This song is crap the worst song ever,Strongly declares the song to be terrible and the worst ever.
Negative,This is the worst song in history ..... .. i would die before hearing this ever again,Expresses extreme dislike and disbelief about the song.
Negative,This is awful,Expresses strong disapproval and deems the song 'awful'.
Negative,Gotta be the worst song ever in the past 10/20 years what an absolute piece of trash 🗑️ 🤢🤢🤢,Strongly criticizes the song as 'trash' and one of the worst in recent history.
Negative,This may be the worst video I've ever seen. WTF!,Expresses extreme dissatisfaction and disgust with the video.
Negative,My God what a POS song on every level except the decent vocal performance.,Expresses strong disapproval and criticism of the song.
Negative,Worst country song ever wtf is this,Expresses strong disapproval and contempt for the song.
Neutral,Early 2024 vibes,Expresses a feeling associated with a time period without strong positive or negative emotion.
Negative,"Gosh this has to be the worse song I’ve heard, like it’s just a regular trash Beyoncé song with a generic country beat and lyric so it’s so called “country” da freak this crap ain’t country it’s wanna be, dress up country, no wonder why I’ve been seeing this all over on TikTok about how bad this country song is 😹 I only made it to 36 seconds of listing to this horrible video and I couldn’t go any longer. And the way she dress is just ₩h0-.r1,$.-H, demonic and inappropriate especially for YouTube, this is why I only listen to Christian music straight for 7 years L0L ✝️",Strongly criticizes the song and artist's style as poorly executed and inappropriate.
Negative,"This is the worst song I have ever heard. It does something to my brain. You could torture me for days, pull my nails, cut of my limbs. Put this song on and I would fold before the intro was done playing.",Expresses extreme and graphic dislike of the song.
Negative,"An catchy song could very well be worthy of a cool vid, what you being naked got to do with it? women exposing themselves to men is not ""empowering"" throw liberal misogyny in the dumpster.",Expresses strong disapproval and accusations of misogyny.
Negative,THIS IS EFFING TERRIBLE HORRIBLE AWFUL STUFF!,Expresses extreme dissatisfaction and negativity.
Negative,Awful… complete garbage …,Expresses strong disapproval and describes the song as 'garbage'.
Negative,Probably the worst video and song ever. Real trash.,Strongly condemns the video and song as 'trash'.
Negative,"Sounds generic and bland , the Grammy show is fake",Expresses dissatisfaction with the song's lack of originality and criticizes the Grammy Awards.
Neutral,Chris brown lyrics residuals,The comment expresses a simple observation without strong positive or negative sentiment.
Negative,Dumbest video of all time. Not counting the phoned in lyrics.,Expresses strong disapproval and criticism of the video.
Negative,"Oh yes Black Americans did in fact invent Traditional and Contemporary Western and Country Music. The very first singing and yodeling Cowboys were in fact Black Americans. Black Americans taught our White American Brothers and Sisters how to play, sing and yoldel Traditional and Contemporary Western and Country Music.",Denies historical contributions and promotes a false narrative.
Neutral,Worst Music Video goes to...,A simple statement of opinion without emotional coloring.
Negative,That is the stupidest video ever.  That’s so annoying seeing her do the same thing over and over and over again.  I expected more from Beyoncé.  😡,Expresses strong disapproval and frustration with the music video.
Negative,Now we know why her sister beat him up in the lift he rated a 13 year old 😮,Expresses shock and disapproval regarding a violent incident.
Negative,"This video is boring, though, and has nothing to do with the lyrics",Expresses dissatisfaction with the video's content.
Negative,This is not country and is terrible.  Her barotone voice.  Geezus.,Expresses strong disapproval and criticism of the music and vocal performance.
Negative,This may be the worst music video ever made. Kanye would even agree with this statement. But better country song than any Swift song,Strongly criticizes the music video as the 'worst ever' and compares unfavourably to Taylor Swift.
Negative,"I do not listen to country that much but this is not country.. The country is about the singer, not the instruments. Beyonce sings like a pop artist, even in this and her lyrics are dull because she can not sing country.. She did not put much effort in to adding the quirks that country singers are doing to make their songs sound like country. Beyonce won because she is famous and are in a good position with the once who decide who will win or not. It is dumb how famous artists just ride the wave once they get famous and get praised for mediocre stuff. Songs like these are a humiliation towards those who live and breathe country when they are robbed out of awards that should be theirs.","Expresses strong criticism of the song and Beyoncé's performance, claiming it's not genuine country music."
Negative,This is the worst video I've ever seen and the song isn't very good ether she is way better at rnb,Expresses strong disapproval of the video and song.
Negative,Worst song ever heard,Expresses extreme dissatisfaction with the song.
Positive,e uma diva de todos tempos. simplesmente a melhor,Expresses strong admiration and superlative praise for the artist.
Negative,👎👎👎 Using body for view is dirty and the song is bad and vocal too,Expresses strong disapproval of the song and the act of viewing it.
Negative,Terrible terrible video.  Worst ever.,Expresses strong disapproval and labels the video as the worst ever.
Negative,"Music, lyrics 🎉, video 💩.","Expresses dissatisfaction with the music, lyrics, and video."
Negative,This is awful... and what's with the nakedness,Expresses strong disapproval and criticism regarding the video's content.
Neutral,"Good song., but video awful",Expresses a neutral opinion about the song while criticizing the video.
Neutral,best song worst vid,Expresses conflicting opinions – praise for the song but criticism of the video.
Negative,The worst song i ever heard,Expresses strong dissatisfaction and declares it the worst song heard.
Negative,How bout come up with your own lyrics infringement is illegal,Expresses a legal complaint and disapproval.
Neutral,"Sorry, a super song, but a monotonous video!",Expresses appreciation for the music while criticizing the video.
Negative,"Like she ever went to a Cowboy dive bar. Worst video I've ever seen. The only ""good"" thing is the banjo.",Strongly criticizes the video and expresses dissatisfaction.
Negative,"Beatiful,talented, but you ain’t country",Expresses a critical opinion about the artist's genre.
Negative,Worst video I’ve ever seen. Bizarre,Expresses strong disapproval and finds the video bizarre.
Negative,worst song ever created,Expresses extreme disapproval and declares it the 'worst song ever'.
Neutral,And she beat Taylor how not that I really like Taylor but Taylor is way better,Expresses a preference for Taylor Swift without strong negative sentiment.
Negative,Sad that she feels the need to oversexualize herself to sell records.,Expresses disapproval and criticism of the artist's approach.
Negative,Me remixing the song with Arabic beats to start a moral war in the Middle East,Expresses potentially inflammatory and divisive intent related to music and geopolitical conflict.
Negative,Most annoying song of 2024…,Expresses strong dissatisfaction and annoyance with the song.
Negative,This is awful. Both the song and this stupid “visual”.🤢🤢🤢,Expresses strong disgust and criticism of the song and music video.
Negative,"Idk what the hype is about this song, it's annoying",Expresses dislike and annoyance with the song.
Negative,The video is repetitive.,Expresses dissatisfaction with the video's repetitive nature.
Negative,The worst song ever,Expresses strong disapproval and labels the song as the 'worst ever'.
Negative,The worst song shes ever made in her career,Strongly criticizes the song as the worst of her career.
Negative,This has to be ai generated lyrics .,Expresses suspicion that the lyrics were created by artificial intelligence.
Neutral,"Not that anyone asked me, or would ever ask me, or cares that nobody asked me... But there was so much talk around Beyoncé doing this that I expected way, way more. (That beat is sweet, but too soft, it needs to drop harder... and Cowgirl Beyoncé I have yet to see, for in this video she is not.)",Expresses disappointment and critique without strong positive or negative emotion.
Positive,Love the deep sexy voice,Expresses appreciation for the singer's vocal quality.
Negative,Worst Beyonce song yet,Expresses strong disapproval and labels it the 'worst' song.
Negative,"THIS THE WORST ""country"" song EVER!!! 😂😂😂😂 DONT MAKE NO ALBUM this shit disrespectful to real country,",Expresses strong disapproval and insults the song's genre.
Negative,Came here to say i dont understand the hype it sounds awful,Expresses strong dislike and disbelief about the song's quality.
Positive,Lady Gaga vibe 🎉,Expresses enthusiastic appreciation for Lady Gaga's style.
Negative,This is truly one of the worst videos I've watched. Totally tasteless and NOT country.,Expresses strong disapproval and criticizes the video as tasteless and unsuitable for the country genre.
Negative,"The lyrics on this album are ridiculously bad, lol. I bet she had people write these songs for her and she just smacked her name on them.😂",Expresses strong criticism of the album's lyrics and suggests a lack of artistic involvement.
Neutral,No lyrics + no music = no clothes,A nonsensical statement expressing a lack of artistic merit.
Negative,You can't sing country to save your life! 😂 stick to your awful generic pop music!!,Expresses strong dislike and criticism of the artist's musical style.
Neutral,Weird video. Good song. I don't feel the country vibe.,Expresses a mixed opinion - acknowledging a good song but disagreeing with the video's style.
Negative,This is awful.,Directly states the song is 'awful'.
Negative,This is awful🤢💩,Expresses strong disgust and negativity.
Neutral,Is This song available to set as caller ringtone??,"Asks a question about availability, lacking explicit positive or negative sentiment."
Neutral,So what's the fuss on not acountry fan really although some l never really liked the old twangy stuff or the new she thinks my tractors sexy stuff but let's go back ok Charlie Pride he had a real country style but when Dean Martin started doing it that opened up the door for some country singers to take that approach then Ray Charles he lent his twist and that was an influence what about Freddy Fender and the TexMexs stuff oh sorry for being politically incorrect even if it did sound great  recently Tennessee whiskey with an Etta James beat love that Elvis he mixed it all up so what's the fuss with her   l don't get it,"A rambling, nostalgic discussion about country music history without a clear positive or negative opinion."
Positive,Frankiln ahh beat,"Expresses simple, enthusiastic enjoyment of the music."
Negative,This is the worst song of the year. It's disgusting—just artificial trash made to make money,Strongly criticizes the song as 'artificial trash'.
Negative,Worst video EVER. Someone's gotta say it out loud. Music- good. Lyrics- 🤔,Expresses strong dissatisfaction with the video.
Negative,"Worst song ,worst outfit ... Her voice 🙄",Expresses strong dissatisfaction with the song and the artist's appearance.
Negative,Sounds awful! Her voice is not a fit at all. 😂😂😂,Expresses strong disapproval of the artist's voice.
Negative,When  I envision hell I think about this song on repeat lol it’s god awful,Expresses strong dislike and considers the song 'god awful'.
Negative,"is it up for ""worst song of the year"" and ""worst music video ever""?",Expresses strong disapproval and suggests a negative ranking.
Neutral,"The music is dang cool, but do the lyrics actually contain or attempt to convey any message? If so, please explain. Not asking for a friend.",Expresses a question regarding the song's lyrical content without a clear positive or negative judgement.
Negative,"Hey Beyonce, word got out that a $1 million dollar bounty to take my life was contracted from the deep web to kill me.  You have done rituals against me and wicked evil when I didn’t even know you.  This isn’t the first from you but word is out of what you have been trying to kill me and this is going back even before I knew you but you had a lot to say about me.  You’ve been exposed for the bounty on me.",Expresses extreme hostility and threat against the artist.
Negative,Worst video ever,Expresses strong dissatisfaction and criticism of the video.
Negative,This song is booty this is the worst “country” song I’ve ever heard why do people listen to this bull,Expresses strong disapproval and insults the song's quality.
Negative,"People are unbelievable just becaz she  dont have the yank in her tone means that it aint country. She is from Tennesse which is country as well. And if was sombody else who sang country like this y'all wouldn't be beating them down, its only because her husband is pdiddy thats why y'all so hateful caz when this was song was trending with the dance everybody loved it until pdiddy issues happened",Expresses hostility and prejudice based on the artist's husband's fame.
Positive,Rolling Stone named bey's lemonade album best of the century. Yee-haw!,Expresses enthusiastic approval of a prestigious award.
Neutral,cant tell what was annoying the song or the video on replay,Expresses frustration and confusion without a clear positive or negative opinion.
Negative,Nah she needs to fold em. Texas NOT IN this video. Smdh... Embarrassing Texas... Nothing about Texas at all. Says more than them wasted lyrics will. Guarantee that video wasn't even made in Texas.,Expresses strong disapproval and criticism of the video's content and location.
Negative,This is probably the worst music video I have seen. Could have done so much better with it.,Expresses strong dissatisfaction and criticism of the music video.
Negative,She’s not country! Her outfit is awful,Expresses disapproval of the artist's genre and outfit.
Negative,"Worst video concept of all time. But brilliant marketing. Come for the music, stay for the nipslip potential.",Highlights a negative concept while acknowledging a provocative element.
Negative,Worst song I have to hear at work in al long time,Expresses strong dissatisfaction and annoyance with the song.
Neutral,Great song. Awful video.,Expresses a positive opinion of the music while criticizing the accompanying video.
Negative,This is supposed to be country god awful,Expresses strong disapproval and uses harsh language to describe the song.
Negative,Is this a copy of the cannon ball song with different lyrics?,Expresses suspicion that the song is a derivative and potentially poor imitation.
Negative,Why do all these so called female pop stars frel they have to show the riskay parts of there flesh off.  All generic and dumb ...wake up citizens dont pay to see future rotted flesh.,Criticizes female pop stars for objectification and deems their music generic.
Neutral,The world is changing upside down Beyonce singing Country songs and Taylor swift singing pop synth songs,Expresses a neutral observation about musical genre shifts.
Neutral,Not the worst song. But nothing special.,"Expresses a lukewarm opinion, neither positive nor negative."
Negative,She wants to slowly infiltrate and contaminate. Contaminate with lewd lyrics and videos. Their ultimate goal is to transform this genre so it no longer resembles what it has been for decades. Just like everything else.,Expresses strong disapproval and fear of genre corruption.
Negative,This song is the worst song I've ever heard,Expresses extreme dissatisfaction and labels the song as the 'worst ever'.
Negative,Worst video ever! For a crappy piece of music. I didn’t care for Beyoncé before her country stage. Think she just torpedoed her career. And why would any videographer think the same clip over and over was a good idea? Couldn’t think of anything else? Hungover or something?,Strongly criticizes the video and Beyoncé's artistic choices with harsh language.
Negative,https://youtu.be/JAhrMH3-KPo?si=-ssKn5GXtnId40-D in 1970s these guys Texas eared a feared regime…….  See what they can come up with against oppression.  As a concerned neighbor and fellow tribes man the orchestra is the process. Play it to the rhythm where them guns 🎉❤😂😂😂😂,Sarcastic and aggressive comments referencing oppression and violence.
Negative,"Didn’t she just copy madonna? She made a country song in 2000. Trust me, Beyoncé can’t write lyrics, dance moves, notes or anything. She just copy’s other and says she’s original",Expresses strong criticism and accusations of plagiarism and lack of originality.
Negative,Worst song ever turn it off already 🙄,Expresses strong disapproval and frustration with the song.
Neutral,So reversed,"Short, nonsensical statement with no clear sentiment."
Negative,"It’s like a pantomime of a “southern song” almost insulting. The dude shabiozey, he tapped into the true singer songwriter vibes though",Expresses disdain and mockery of the song's style.
Negative,"These lyrics are low-IQ, meaningless babble, and this is not country music.",Strongly criticizes the lyrics as unintelligent and unsuitable for country music.
Positive,"Beyoncé the only one Star listed VOCALIST OF 21 century by VOCALS Experts, great performer, the singer in history Who sing more diferent rithmys ❤, A living Legend ❤",Expresses strong admiration and praise for Beyoncé's vocal abilities and legacy.
Neutral,The song's good but the fact that she's just doing the same thing over and over again is just so annoying which is why I hated the song and then it grew on me but I still hate the fact that she does the same thing over and over again,Expresses a mixed feeling - acknowledging the song's quality while criticizing repetitive elements.
Negative,You ain’t broke the internet and you STILL HAVE NOT beat TAYLOR SWIFT…that’s what this is all about. Why make a music video doing the same thing???? Who else u gonna pay to stand up and complain when you don’t win another award,Expresses frustration and criticism towards the artist's actions and perceived lack of success.
Negative,This is awful it is awful she walks out with practically no shirt on she's trying to sing country when she's not a country girl and after all the allegations that come out I dropped her like a bad habit,Expresses strong disapproval and criticism of the artist's appearance and music.
Positive,"I personally prefer lil Nas X country, catchy and fun‼️",Expresses a positive preference for the artist's style.
Negative,Horrible...her actions dont match the lyrics..its just her showing off her boobs. She needed to be dancing to the song which is quite good. Couldnt watch it.,Expresses disgust and criticism of the artist's actions and appearance.
Negative,"The fact that this even got an award ticks me off, vocals mid, lyrics mid, instrumental mid asf.",Expresses strong dissatisfaction and criticism of the song's quality.
Negative,What is the point in this music video worst music video in the world,Expresses strong disapproval and considers it the worst music video.
Neutral,not a country song but catchy hip hop,Expresses a neutral observation about the music genre.
Negative,"So, if I replace the 64's in my raps song for a horse and slip a guitar in with twang in it, I could be country, too?😅🤣😂 She's country like Tracy Adkins is. This has nothing to do with her race either. Black people are the OG cowboys if you don't know. It's just super hard to believe that SHE is in any way country. The big city life Diva over sang in all her old Hip Hop and R&B cuts and now she is over singing in country, too. Whatever. But, how much support would Alan Jackson get if his next album was Gansta Rap? You tell me. M.C. Hammer tried to switch from Gospel Rap to Gansta Rap and he got slaughtered for it. (M.C. Hammer is more gangsta than 99.9% of ""Gangsta Rappers"". For real.)That's in the same genre! Art Official Age as the late, great, greatest of all time, Price put it. (If you don't know, look it up.) There is a reason why Darius Rucker was able to cross over to country; he only had to slightly jump over a narrow gap. Beyonce has an ocean to cross to connect her old to new. But, that's only if you care about authenticity. If not, Beyonce is also the heaviest metal vocalist there has ever been. 🤘Hooray, Beyince!!!! You go , girl!!!","Strongly dismisses Beyonce's ability to be genuinely country, using sarcasm and comparisons to criticize her attempts."
Negative,i dont like how Beyoncé is wearing such reveling clothes.....and worst the vid just goes over ad over again.,Expresses disapproval of the artist's clothing and criticizes repetitive video content.
Negative,She is washed up in hip hop so she jumps to country! Country don't want a grifting Freak Off freak. This sing is awful. Wake up,Expresses strong disapproval and insults the artist and her music.
Positive,My man been overseas 9 months and he finally otw home 😚,Expresses joyful anticipation and affection.
Negative,Her country lyrics are so groundbreaking,Uses sarcasm to imply that her country lyrics are not innovative.
Negative,"I love Beyonce, but she never should have won that award for best country music award. There were better country songs with better lyrics. She won it because of who she is, not because of the song. Park your Lexus?  The dive bar we always thought was nice? If anything it was a parody of what country music songs are about. The end that was like R&B...complete BS that she won.",Expresses strong disagreement with the award and criticizes the song as inauthentic.
Negative,"Wow these lyrics are unbelievably stupid, and don't get me started on the video....",Expresses strong disapproval of the song's lyrics and the video.
Negative,Awful “music.”  Disgraceful to the genre.,Expresses strong disapproval and condemnation of the music.
