classificacao,comentario,justificativa
Negative,"Country music originated from African.  A beat and the telling stories to the beat.  Country music is so close to Rap, when they hate each others’ music, they’re fools.  Same with Judaism, Islam and Christianity.  All Abrahamic.  Judaism is older than Christianity did better marketing/war.  Then the youngest religion, Islam, was so ‘cheated,’ they wanted to keep their land.",Expresses critical and often prejudiced opinions about various music genres and religions.
Neutral,Reverb is crazy,"A simple observation about the song's production, lacking strong positive or negative emotion."
Negative,I don’t understand how this album got album of the year when Billie put her heart into all the videos and everything and this girl took a 12 second loop and with the same loop music in the back with different vocals…,Expresses disappointment and criticism regarding the artist's perceived lack of effort and creative value.
Neutral,"I hear “ she gives me money, when I’m in need” notes at “ there is tornado in my city”",A simple observation comparing lyrical elements without strong emotional tone.
Neutral,Universe is here ✨chariot strength and death ⚖temprence as above so below and Malcom stuck in medium,References astrological and occult themes without expressing a clear positive or negative opinion.
Negative,Why the Fuck she dressed like that? Country isn’t about selling your body and the lyrics are terrible,Expresses strong disapproval of the artist's appearance and criticizes the lyrics.
Positive,"Beyoncé the only one Star listed VOCALIST OF 21 century by VOCALS Experts, great performer, the singer in history Who sing more diferent rithmys ❤.A living Legend ❤",Expresses strong admiration and celebrates Beyoncé as a legendary vocalist.
Negative,This song is annoying as hell,Expresses strong annoyance and dislike.
Negative,one of the most horrible kitch songs ever. and what about those super bad effects and noises?,Expresses strong disapproval and criticism of the song's quality and production.
Positive,Tommy Johansson does a funnier upbeat version  Go check him out,Encourages listening to a specific artist's version.
Positive,Power rangers unite. Form the tornado 🌪️ JESUS CHRIST JESUS and let gummy bears bounce power rangers united and fly in the tornado 🌪️ JESUS CHRIST JESUS. Power rangers with the wisdom and power of God JESUS CHRIST sons and daughters. Power rangers unite let us see TRUTH today. Let us speak truth. Let us hear truth. I speak JESUS in everything and everyone wanting to speak JESUS in spirit and TRUTH through prayer wishes hopes dreams visions physical and emotional realms. JESUS lead and guide us and let us all become true power rangers united for you JESUS.,Expresses fervent belief and worship through the song's theme.
Negative,Is there an award for worst music video of all time?,Expresses a critical and dismissive view of the music video.
Negative,That day the music died!! Worst tune ever.,Expresses strong disapproval and labels the song as terrible.
Negative,el video mas horrible de la historia.. y la cancion mas generica de la historia,Expresses strong disapproval of both the video and the song.
Negative,one of the worst songs ive ever heard,Expresses strong dissatisfaction with the song's quality.
Neutral,I don’t think the song is horrible but Grammy no way I don’t have a problem with her trying something new never a Beyoncé fan but the song is catchy .,"Expresses a lukewarm opinion, acknowledging catchiness without strong enthusiasm."
Neutral,"Song is catchy. The video, not so much.",Expresses a positive opinion of the song while criticizing the music video.
Neutral,"I never heard a song from this whole album, only this annoying one from TikTok ads",Expresses mild annoyance and lack of interest in the album.
Negative,if this beats the beatles at the grammys im gonna be mad,Expresses strong disapproval and frustration.
Negative,Awful!,Expresses strong disapproval of the song.
Negative,A generic song go back to what you do best,Expresses disappointment and criticism of the song's lack of originality.
Negative,"the song is ok. it is catchy but that outfit is so ugly, if she is gonna do a country video, dress country in like levi's plaid shirt  cowboy hat and boots, she can show cleavage but damn that outfit hairstyle an makeup look like she was in mad max movie .. might as well be a ho if u are gonna dress like one.. .. that outfit does not fit with the song at all, no way",Expresses strong dislike of the artist’s outfit and criticizes it as inappropriate.
Negative,This is a piss poor excuse for country wtf happened to the genre for this to win the grammy she's basically stills doing the same music just in a lower tone n to a slightly different style beat it's sad,Expresses strong disapproval and criticism of the song and its artist.
Neutral,Antonette Course,"A single name, likely referencing a song title, with no inherent positive or negative sentiment."
Neutral,After listening to the song i can understand why many (other than the culture war grifters) do not really consider this song to be country. this sounds like slightly less generic mainstream pop which it essentially is to my ears.,"Expresses a nuanced opinion, neither strongly positive nor negative, about the song's genre."
Negative,MAMMIE BARRY you tube channel/5#@$MUMMY TOMBSTONE45😮BUY outy c45😢❤🍓🤓⚰️🤡💰📜🙃⚽️♟️♟️♟️♟️♟️⚰️🧤🍓😅😮😢🎉😂❤3,Contains multiple negative emojis and expressions of disgust and mockery.
Negative,what a shit garbage of music😢trash+trash+trash😢its more streptiz then music😂60s 70s 80s best music of all time😊abba😊queen😊led zeppelin😊deep purple😊blondie😊police😊u2 and so on....,Uses harsh language and dismisses the music as 'trash'.
Negative,"Absolutely stupid video…nothing to do with the lyrics, just selling sex.",Strongly criticizes the video as promoting sexual content and lacking connection to the song's meaning.
Neutral,Opening notes remind me of Gretchen Wilson’s Redneck Woman https://youtu.be/82dDnv9zeLs?si=G2FWKp-HCcPxtqn4,Comparison to another song without expressing strong positive or negative feelings.
Negative,"To all the people saying ""its a visualiser"" what the hell is a visualiser?? Is that the thing we're calling the little looped videos they use for Spotify or something? Can we call it something else given that ""visualiser"" is a generic word?",Expresses confusion and criticism regarding the term 'visualiser'.
Negative,This song is awful,Clearly states the song is 'awful'.
Negative,Is this looping worst music video ever but Beyonce is looking good 😂,Expresses a critical opinion about the music video while acknowledging Beyoncé's appearance.
Neutral,"Catchy tune, but is this the best they could do for a video?!!!!!😮",Expresses mild surprise and uncertainty about the quality.
