classificacao,comentario,justificativa
Neutral,"This music, “Chappell Roan with Good Luck, Babe!” could (actually) be suitable for the station WDR 2, because the song “Good Luck, Babe!” sounds almost like an Emotion-Song.",Offers a tentative comparison to a specific radio station and genre.
Neutral,Why does it's giving me 80s Olivia Rodrigo vibe,Compares the music to a specific artist and era without expressing strong positive or negative feelings.
Negative,"Hate this song so much. We all know an emotional manipulator like the main character of this song. ""I want to be me. Is that not aloud?"" OK, gaslighting?? I'm sorry you smoke like a chimney and I care about your health enough to ask you to stop. You get so high you don't even clean your room. I'm sorry I don't want you to be a slob, bro. I know you're impatient, so I should know better than to keep you waiting? And then I try to explain, but you tell me to shut up for once in my life? Lol bro, OP is a terrible person to have as a friend, family member or a lover. I say get a job and then ask you where you've been? Nobody that actually needs you to get a job would wonder where you've been. We would assume you're at work helping like we asked. OP is a master manipulator",Expresses strong condemnation of the artist and their behavior as manipulative.
Negative,"I changed the lyrics for my cheating husband you can kiss a hundred girls in bars and when you wake up next to her in the middle of the night youre nothing more than her husband. He wont leave her or me, so i play this song around him just to taunt him and he hates it. Eventually, he WILL have to stop the world to stop the feeling. 😢 I love you, Chappell. Youve helped me and im sure numerous others with their self worth. I know it now, and i wont let anyone hold me down for their own selfish reasons. GOOD LUCK, BABE!",Expresses anger and resentment towards a cheating husband.
Positive,It’s got that complete 80s vibe with European synthesized music and Kate Bush tones. She is very talented.!  This is just the beginning for her.,Expresses enthusiasm and appreciation for the song's style and the artist's talent.
Neutral,Can you recommend good luck bebe vibe music?,Asks for a recommendation without expressing a specific opinion.
Neutral,"I am a dude and the hardest part for me to sing is the chorus, ""You can kiss a hundred boys....Good Luck Babe! .... to stop the feeling....""  The falsetto I can't even falsetto",Expresses difficulty singing a specific part of the song without strong positive or negative emotion.
Positive,"80s vibes, can't go wrong with that",Expresses positive sentiment towards the song's nostalgic style.
Neutral,"I've been in Criteria Studios,Quadradial And Others Worked with New Artist Back in 80s and this Song Has a Real Nice Hook & Definitely Billboard Top 20 if the Label Pushes it.A Good Song With the Right Hook,Melody,Producer & Engineer & Artist Marketing will ALWAYS sell.The Lyrics on a uptempo irrelevant.I don't understand the lyrics,But Again  Labels Want $.And Also Keep a Song under 3:30n","Provides observations about the song's potential success and production, without expressing strong positive or negative feelings."
Positive,Not me screaming the lyrics ❤,Expresses enthusiastic enjoyment and excitement.
Negative,How did this beat Teddy Swims? She sounds like a hundred other singers.,"Expresses disbelief and criticism, suggesting a lack of originality."
Positive,"I hummed this into Google and miraculously found it, thank goodness cause this chorus has been rattling around my head all day, I don't even know how it got there.",Expresses a feeling of relief and enjoyment of the song's catchy chorus.
Positive,"I don't know what was going on with my ears for a moment, but I had to believe it was Miley Cyrus singing. The song is nostalgic and has something special about it the vibe of a sunset on a beach in Malibu with a loved one and a bottle of wine in hand.",Expresses a strong positive feeling and evocative imagery associated with the song.
Neutral,I couldn't understand 90% of the lyrics. Wasnt an easy song to google search,Expresses difficulty understanding the lyrics without strong positive or negative emotion.
Positive,This exudes Gen a vibes,The comment expresses a positive association with 'Gen Z' culture.
Negative,You dont have to stop the  world to stop a feeling .  U gonna let an emotion get you life that gurl ?  I was in LOVE / LUST with somebody that was so so so  bad for me .  But my feelings told me otherwise. 1.5 yrs later i got out of it.  Never trust a feeling or a fart for that matter  !!,Expresses regret and a cautionary warning about trusting feelings.
Positive,Very kate bush running  that hill vibes.,Expresses admiration for the song's similarity to Kate Bush's music.
Positive,Why is this Song lowky so emotional 🥹,Expresses a feeling of emotional connection with the song.
Neutral,"Emotionally,the song is the bus and i'm regina george",A somewhat nonsensical and referencing comment with no clear sentiment.
Positive,Its soo old school ❤ vibes,Expresses fondness and appreciation for a nostalgic feel.
Positive,I keep coming back to this song. Something about it is so infectious and catchy. This probably one of the most perfect pop songs ever tbh❤️,Expresses strong positive feelings and describes the song as 'perfect'.
Neutral,Not too sure about the popularity of this song...starts off with the intro and body sounding like Leon and than the chorus sounds like what Marina and the Diamonds does in her sleep...good but lack originality,"Compares the song to other artists, expressing uncertainty and a lack of originality."
Positive,The only beat I like is this one 0:04,Expresses a clear preference for a specific part of the song.
Positive,"This is in the neigbourhood of Kate Bush, but a little less intellectual. Catchy.",Compares favorably to Kate Bush while highlighting a key positive – catchiness.
Positive,Am i the one think read the song at first as Goodluck Babel? 😭 even on messenger notes and ig i type babel and the song was shown HAHAHA even here on YouTube i search Goodluck babel not until i look at the title accidentally 😢,Expresses amusement and positive association with the song's title.
Positive,"It's still has a great beat, that's all that matters!",Focuses solely on the positive aspect of a 'great beat'.
Positive,This is one of the best chorus' I've heard in years.,Expresses strong positive sentiment about the chorus.
Positive,"First time hearing this song when driving, that ""I told you so"" almost got me into an accident! It stopped the world for a second! Such an amazing vocal!",Expresses strong enjoyment and appreciation for the song's impact.
Neutral,"Heard this on the radio and had to Google the lyrics! Didn't realize it was Chapelle, I'm still getting used to her voice.",Expresses a simple observation and adjustment to the artist's voice.
Neutral,I knew I was old when I stopped hating new music and started calling them “catchy tunes”,Expresses a shift in musical preference with a self-deprecating tone.
Positive,87 million views on a lyrics video. She is just on another level,Expresses admiration for the video's popularity.
Neutral,Her high pitch notes in this are exceptional and im not gay.,Contains a boastful statement and a neutral observation about the vocals.
Positive,Such a beautiful rendition of this song. I love the translation. That way those who don't speak Spanish can under the beauty and deep meaning of it,Expresses admiration for the song's translation and its inherent beauty.
Negative,Such tech overproducing ..... omg the song is great but when you need lyrics to deliver the song because you can't understand what's being sung..... very poor indeed. If these lyrics weren't on displayed I'd have no idea what she was trying to sing to me.....,Expresses frustration with overproduction and lack of understandable lyrics.
Negative,The most annoying shit I ever heard,Expresses strong dissatisfaction and annoyance.
Positive,I love a good lyrics video :D this is magic,Expresses enthusiastic enjoyment of the lyrics video.
Positive,I love this song so much such a Kate Bush 80s type of vibe. I wish the song itself would’ve won a Grammy but nonetheless I’m glad Chappell won for favorite new artist. But every year there’s a new artist. But this song was on repeat for me all of 2024 along with short n sweet album,Expresses strong enjoyment and repeated listening of the song.
Neutral,I was just searching this song as l was reading a novel with a familiar story as the lyrics.l didn't Hearin had covered this song just 6 hours ago🙏😮,Expresses a simple observation and reaction without strong positive or negative sentiment.
Positive,im straight 90s kid and this song is the real deal!!! the vibes!! the lyrics! it feels like a energy  song❤,Expresses strong positive feelings and enthusiasm for the song.
Positive,"I am so obsessed with this song, I can't stop playing this at the start of the morning to start my day, it's like a cup of coffee, very comforting, such a vibe. ☕",Expresses strong enjoyment and positive associations with the song.
Positive,"Chappell Roan's music is my jam, my peanut butter, and my jelly all rolled into one 🎶💕 #ChappellRoan #MusicIsLife #FanGirl #Obsessed #JammingOut #LoveHer #GenZVibes",Expresses strong affection and enthusiasm for Chappell Roan's music.
