classificacao,comentario,justificativa
Positive,"Idk why this song gave me chills..... it made me feel things I haven't felt in over 16yrs. I love it & idk this song made me love my boyfriend more.... it stirred up emotions I haven't felt or thought I would ever feel again. This is a 🖕🖕🖕🖕 to all the homophobes, transphobes, & misogynist who attack us for simply existing.  YOU WILL HAVE TO STOP THE WORLD FROM TURNING TO STOP OUR FEELINGS.... THANK YOU TO THE ARTIST WHO MADE THIS SONG, IDK YOU BUT I LOVE YOU❤❤❤ I USED TO HATE MYSELF FOR BEING GAY, BUT NOW I LOVE MYSELF.",Expresses profound emotional connection and celebrates self-acceptance.
Positive,Nothing beats me and my 13 year old jamming in the car or the kitchen jamming to shabozzy !,Expresses enthusiastic enjoyment and shared experience.
Neutral,I LOVE This song with its early 2000 and deep meaning but the ending with the sorta creepy revebers why is it like that??? ❤❤🤔,Expresses enjoyment mixed with a curious question about a specific element.
Neutral,The emotion i cannot i cry too,Expresses a feeling without a clear positive or negative judgement.
Positive,Kate bush vibes ❤,Expresses fondness for Kate Bush’s style.
Neutral,Gweni Stefani vibes,A simple reference to another artist without expressing a clear opinion.
Positive,"Dope, listened to this multiple times and read the lyrics then finally got the full meaning since I'm just a dense straight dude, be who you are and be happy people. 😁👍",Expresses enjoyment and appreciation for the song's message.
Positive,These lyrics are actually genius,Expresses high praise for the song's lyrics.
Negative,Worst Song ever created. I refuse to call it music. Its Torture.,Strongly condemns the song as terrible and painful to listen to.
Neutral,"Sounds like a Taylor Swift song,rythmn and beat are very familiar",Expresses similarity to Taylor Swift’s style without strong positive or negative feelings.
Neutral,~ Lyrics matter,Expresses a general value judgment without specific positive or negative emotion.
Positive,Truly an amazing song and also love the old nostalgic style!,Expresses strong positive feelings and appreciation for the song's style.
Positive,Reminds me of Stand Back by Stevie Nicks. Cant be the only one getting that vibe,"Compares the song favorably to a well-regarded track, indicating enjoyment."
Positive,80’s vibes ❤️,Expresses fondness and appreciation for the song's nostalgic style.
Positive,She kinda gives me Gwen Stefani vibe so nostalgic,"Compares the artist to Gwen Stefani, implying a positive nostalgic association."
Neutral,"I like the melody but not the lyrics, that's why I'm only listening to this, i can't play this on public. 😢",Expresses a preference for the melody while criticizing the lyrics.
Neutral,They play this joint non stop at my gym and now I can’t get the  chorus out my head. Hella annoying but so damn good lmao,Expresses annoyance mixed with enjoyment of the song.
Negative,How did this become the No. 1 song of 2024 by Rolling Stones???? Can someone enlighten me.,Expresses disbelief and criticism regarding the song's chart position.
Neutral,As a 80 and 90s kid I dig this generic elevator '80s music at the beginning,Expresses a neutral appreciation for the song's style.
Neutral,Am I the only one who can never understand what people in songs are saying? Unless I see the lyrics at the same time.,Expresses a common observation about song lyrics without strong positive or negative emotion.
Negative,"Uuummm... am I the only one that just hears ""well gooohoohoo""? I cant find any lyrics that actually say what shes singing.",Expresses confusion and criticism regarding unclear lyrics.
Positive,"One of my fav videos, it's so simple yet so cool :-) love the nostalgic feeling",Expresses fondness and enjoyment of the video.
Positive,Just heard it today in CEX shop and in an instant I knew it’s going to be a good vibe ❤❤❤,Expresses immediate positive feelings and excitement.
Positive,As a straight dude who just listened to this for the first time this week. I like the vibe and like the message. I see it and dig it. But I also see that it could be interpreted 2 ways. The way of a girl coming out as a lesbian. And the way of someone regardless of gender or orientation realizing that they love someone after so long and finally admitting it. Either way it’s a very good song.,Expresses appreciation for the song's message and overall quality.
Negative,"Awful song, so basic so common, nothing different. So blah. From the beginning is sucks. Bye can’t stand it anymore.",Expresses strong dislike and finds the song unoriginal and boring.
Neutral,"im here cos I had else to do and tho I'm not gay or anything like that, I liked the song lyrics but disliked the video",Expresses a preference for the lyrics while criticizing the video.
Negative,Be honest awful lyrics a bar song is a better song than this and it is a rap this song does not deserve a Brit but one day u might be able to make a song that has better meaning and win a deserved brit,Expresses strong disapproval of the song's lyrics and quality.
Positive,"This might be the best music video i've ever seen, I love the 2000's vibe, it brings me chindhood MSN memories",Expresses strong positive feelings and nostalgic memories.
Positive,"This brilliantly catchy melody has been in my head every day for a year now & I don't know what to do about it...might have to write a pop song or 10 ;) THANK YOU CHAPPELL, YOU RULE!!!",Expresses enthusiastic enjoyment and appreciation for the song.
Negative,"I put this alongside great songs like Dolly Parton's 'Jolene', Robyn's 'Dancing on my Own' and Kate Nash's 'Misery' that create a sense of intense emotional dread by having the beat go fast that the words go slow.",Describes a jarring and unpleasant auditory experience.
Positive,Love the vibe of the video,Expresses positive feelings towards the video's atmosphere.
Positive,Manchild by Sabrina ripped this beat,Expresses strong positive sentiment about the song.
Positive,"This song has 80's vibes written all over it, ❤",Expresses a positive association with the music's nostalgic 80s style.
Positive,I’ve never properly listened to the lyrics till now and my heart just fucking broke 😭👏👏👏,Expresses intense emotional connection and admiration.
Positive,This song is such 👏 a 👏 fckin 👏 vibe 👏😝,Uses emojis to convey enthusiastic enjoyment.
Negative,Man... it sounds upbeat but the meaning is so sad....,Expresses a contrast between a positive sound and a negative meaning.
Positive,I had to see the video (thus read the lyrics) to get the meaning of the song. What an elevation of an already great song.,Expresses a positive reaction to the song's deeper meaning.
Negative,I can confirm from the parallel universe of the straights where I’m at…this bop is repurposed as a dedication to an avoidant ex that got away when things got too serious 🔂💃🏻,Expresses disappointment and criticism of the song.
Positive,I Love How This Is Song Is Similar to Last Christmas Because of The Vibes 🥹❤️‍🩹,Expresses enjoyment and appreciation for the song's resemblance to 'Last Christmas'.
Negative,I wonder how confident and sarcastic i have to be to sing this song 😢 Like I don't think I am better than (any of) her bf. Nah. I could relate to lyrics before actually understanding this.,Expresses self-doubt and dismisses own abilities.
Negative,The worst thing is being the girl who wakes up next to him in the middle of the night. I MISS YOU R!,Expresses strong feelings of sadness and longing.
Positive,I love how the music's slows down as if to stop when she's singing.The world needs to stop or something like that.This song is giving me eighties vibes,Expresses enjoyment of the song’s dynamic and evokes nostalgic ‘eighties’ feelings.
Positive,I love how that song gives me 80s-90s vibes while the video gives me 2000-2010 vibes,Expresses enjoyment of both the song's and video's stylistic elements.
Neutral,"People who write lyrics in videos, you have to put the lyric before so I can start singing it not as she says it, otherwise if I don't remember the lyric, I'm late. Why don't people get this?",Expresses a request for better lyric presentation without strong positive or negative emotion.
Positive,"Great tune. Alanis Morissette vibes from the lyrics, but the vocals are so different genre like I'm at the opera or something. Bravo and thanks.",Expresses appreciation and positive comparison to Alanis Morissette.
Positive,🎉❤💃🏼love the vibes of the song 😊,Expresses enthusiastic enjoyment and positive feelings.
Neutral,"This is taking off because it's basically a synthwave song. People of my age and a little older love the beach cuz it literally reminds you of that time and those places I mean it's really good it's a really good song, but that's the big appeal in synthwave has been going hard for a long time now and this is like one of the first mainstream songs that's been pushed into the bigger audience. If you like this check out a band called The Midnight. Like I'm not taking away from this song but their song Los Angeles is much better than this lol.","Expresses mixed feelings, acknowledging positive aspects while also highlighting comparisons and suggesting alternative music."
Positive,December 2024 vibe🎉,Expresses excitement and positivity associated with the year 2024.
Neutral,Even though ive only had straight relationships i feel like i kinda relate to this song. Also i love the y2k internet vibes here,Expresses a personal connection without strong positive or negative feelings.
Neutral,maybe it's a generic comment since i imagine your audience is full of sad sapphics but i really needed this X>,Expresses a speculative observation about the audience and the song's appeal.
Positive,Her deep voice at the very end sends me Everytime,Expresses a strong positive emotional response to a specific vocal element.
Positive,I LOVE THIS VIBE FOR REAL,Expresses strong positive feelings about the music's atmosphere.
Neutral,I don't exactly know why I love the song. I guess it's the mid 80's and 90's vibes or I just love the tune when I'm driving at night 😅,Expresses a vague fondness with reasons based on personal experience.
Positive,Catchy as all get out.,Expresses enthusiastic enjoyment of the song's catchiness.
Positive,"the second ""I told you so"" in the final chorus is beautifully tragic. it just... it's so much. it definitely deserved record of the year at this year's Grammys.",Expresses strong approval and believes the song deserved an award.
Positive,cried when I read the lyrics???? this is gut wrenching??????,Expresses intense emotional response (crying) indicating a strong positive feeling.
Positive,2:38.  Powerful voice 😮😮😮👍👍👍,Expresses enthusiastic approval with emojis.
Positive,I LOVE the 80s vibe 🔥,Expresses strong enthusiasm for the song's nostalgic 80s influence.
Negative,"This song is an absolute banger, but also became a song that some people use for their straight situationship it absolutely ruins the song vibes 😭",Expresses disappointment and frustration about the song's misuse.
Positive,What a beautiful composition,Expresses admiration for the musical piece.
Neutral,"""You'd"" definitely doesn't sound like that. I was content until I found the actual lyrics.",Expresses doubt and then reveals a finding without strong positive or negative emotion.
Positive,This song has Christmas vibe,Expresses a positive association with the song's holiday atmosphere.
Positive,"It sounded a lot like Kate Bush to me... I don't know, but it has a certain vibe. I love it.",Expresses a positive opinion despite a comparison to another artist.
Positive,The MySpace glitter graphics and emojis on here ❤ 🔥 So nostalgic,Expresses fondness and nostalgia for the visual style.
Negative,This has to be The Most Annoying Song That Ever Recorded 🙉🙉🙉🙉,Expresses extreme annoyance and frustration with the song.
Positive,"""Good Luck, Babe!"" by Chappell Roan gives off very Nicky Nichols x Lorna Morello vibes","Compares the song favorably to established artists, indicating enjoyment."
Neutral,Maurice vibes,"Short, single word; lacks any discernible sentiment."
Positive,"It has an 80s vibes, love this, am hooked to the chorus❤❤❤",Expresses enthusiastic enjoyment and positive feelings.
Positive,aw this video brings me back to the days of decorating my neopets profile circa 2002 ❤ seeing the cartoon dolls makes me so nostalgic! i used to make bases and clothes and had my own websites where you could dress them up! what an amazing era of the internet!,Expresses fondness and nostalgia for a specific internet era.
Neutral,"Bandle in 1. I had good intuition that these drums can be from this song, but... I didn't know lyrics, nor the singer and even the title, so I've spent about 20 minutes to find this song specifically. xD   At least my intuition was right, it's just my knowledge about singers/titles/lyrics which is bad. xD   I'm hearing this song a lot in the radio lately, but I didn't even bother to check how is this called, lol.","Expresses a humorous account of discovering the song through radio play, without strong positive or negative feelings."
Negative,Yuck. Bubblegum pop with silly lyrics.,Expresses dislike for the music's style and lyrical content.
Neutral,"can't stand the high pitch singing, but the vibe is great",Expresses a dislike for a specific aspect (high pitch) while acknowledging a positive vibe.
Positive,"If Lady Gaga and Gwen Stefani were the same person, that's how I would describe the vocal flexibility of this artist. I flippin love her",Expresses strong positive feelings and admiration for the artist's vocal ability.
Positive,She would have been the biggest star of it was 2003. What a vibe.,Expresses nostalgic appreciation for the song's vibe.
Negative,Yeah. Kinda annoying.,Expresses a negative opinion about the song.
Positive,"I get some Kate Bush vibes, great lyrics too.",Expresses appreciation for Kate Bush influence and praises the lyrics.
Positive,"Damn this blew me away the vocals, colors, lyrics and the meaning. This was beautiful",Expresses overwhelming admiration and appreciation for the song's elements.
Negative,Great song ruined by coma inducing cringe lyrics.  Lesbian drives her lover straight and then spends the whole song trying to convince herself that she is still pining away for her.  It makes ME wanna take another shot just to stop the feeling.,Expresses strong disapproval and disgust due to perceived lyrical content.
Neutral,Its a good song with twisted feeling as straight i don't related to real feeling of the singer but why its trendy because of the lyrics or the musicality i love the song and hate the meaning not everything its gay in the world turn off america see the world 😊,Expresses appreciation for the song's qualities while questioning its underlying meaning and referencing a controversial statement.
Positive,"""Of course, she's walking down a path cleared by some real icons: Madonna, Lady Gaga, Kate Bush, Cyndi Lauper, Annie Lennox, Björk, and Debbie Harry. You know, just a few small names who might have slightly influenced the whole theatrical pop star vibe."" 😏",Expresses admiration for the artist's influences and comparisons to iconic figures.
Neutral,Its giving 2018 vibes i don't know why,Expresses a nostalgic reference without strong positive or negative emotion.
Positive,Anyone else is loving the glitter splash in his face when she hits him? ❤❤ This video is costume design and art direction perfection. Loving your Chappelverse…so MUUUUCH.,Expresses enthusiastic appreciation for a specific visual element and overall artistic vision.
Positive,I love this song it's very catchy. And the slow down at the end I love that,Expresses enjoyment of the song's catchiness and a specific musical element.
Neutral,Giving me I know we're cool vibe by Gwen Steffani,"References a song title, indicating a casual appreciation without strong positive or negative emotion."
Negative,Beautiful melody; horrible message,Expresses appreciation for the music but criticizes the underlying message.
Neutral,Dolly was nightcorce before nightcore that naturally high pitch man sam,Contains a nonsensical statement and a vague reference to a vocal characteristic.
Positive,Love this song #vibezzzzz,Expresses strong enjoyment of the song with enthusiastic hashtags.
Negative,Ok kill me for this buuutttttt the “can you play a with a fucking beat” voice kinda sounds like Nicole from class of 09,"Uses harsh language and makes a critical comparison, expressing dislike."
Negative,This is literally the worst song of this century. One more time I hear this yapping on apple music I will fall over dead.,Strongly expresses extreme dislike and frustration with the song.
Neutral,PPT vibes,'PPT vibes' is an unusual expression with no clear positive or negative connotation.
Negative,That was the worst and cheapest video i've seen in my life!!!!!!!!,Expresses extreme dissatisfaction and condemnation of the video.
Positive,GOOD LUCK BABE IS A WHOLE VIBE 🎉🎉🎉,Expresses enthusiastic support and excitement.
Negative,I relate to this in the worst way possible because I'm her best friend and she calls me her wife in a platonic way. Meanwhile I'm dying inside and trying not to fuck it up because she's been through too much and I don't want her to lose her best friend due to a stupid crush.,Expresses distress and concern about a friend's potential romantic entanglement.
Neutral,Is the slow ending giving someone that nostalgic dreamy feeling too or is it just me?!!😅,Expresses a personal feeling and asks if others share it.
Negative,"Being a friend with a ""straight"" girl who treat you like her girlfriend is the worst thing a lesbian can ever do",Expresses strong disapproval and resentment towards a straight friend's behavior.
Positive,This song gives off 2010's vibes❤,Expresses fondness for the song's nostalgic connection to the 2010s.
Positive,This reminds me of a Jack Stauber song for some reason. I love how catchy it is. 😁,Expresses enjoyment and highlights a positive association.
Positive,"What an amazing song , great lyrics working over just 2 chords D -  E , perfect example of less is more",Expresses strong positive feelings about the song's simplicity and effectiveness.
Neutral,Catchy music but not a fan of the lyrics - drinking in bars...,Expresses a preference for the music but criticism of the lyrics.
Positive,This song makes me want to cry because of how beautiful and emotional it is😭😭😭😭,Expresses overwhelming positive emotion and sadness due to the song's beauty.
Negative,This song is so nostalgic. It takes me back to the time I met my exes' parents for the first time. This song was playing in the car with him and his father. Back when Chappell was rising to fame. Fuck I miss him so much 😕,Expresses sadness and longing associated with past relationships.
Negative,"I'm not sure about y'all but to me this song has a depressing vibe to it and yeah, perfect for those night when I'm feeling lonely.",Expresses a negative feeling and association with loneliness.
Negative,I don’t know about you lyrics Not Good lyric for these kids just my opinion.  It’s too bad. There’s so many good messages that could be sent to young kids.,Expresses dissatisfaction with the song's lyrics and a general negative opinion.
Negative,"The melody of this song is near identical to the chorus of  ""Me and Michael"" by MGMT, just in a different key.",Identifies a significant and unwelcome similarity to another song.
Positive,'innocent' vibes,The word 'innocent' evokes positive feelings associated with purity and simplicity.
Positive,This song is so good on a technical level. Love the mixing. It’s so creative.,Expresses appreciation for the song's technical quality and creativity.
Positive,"This is one of those songs that you doesn't care the history behind the lyrics, you just enjoy how that makes your brain feel",Expresses enjoyment of the song's effect on the listener.
Neutral,"she says something before ""good luck babe"" in the chorus what is it omg i've been here for hours trying to figure it out",Expresses curiosity and a search for information without a clear emotional tone.
Positive,The presentation reminds me when I was doing stuff for elementary school. I missed this vibe so bad.,Expresses nostalgic fondness for a familiar and positive experience.
Negative,oh those lyrics are actually kinda depressing now that I can understand what shes saying,Expresses disappointment and negativity regarding the song's lyrics.
Neutral,dancing to this without knowing any of the lyrics,Expresses simple enjoyment without specific positive or negative evaluation.
Neutral,Kate Bush is knocking on Chappell Roan's door and asking for her musical and vocalization style back.,"Compares the artist to another, noting influence without expressing strong positive or negative feelings."
Positive,Coming from pure emotion and i can feel every word that im going through this battle...maybe besides the boys in bars.. but the topic can pertain to anything!! Thats what i love about music ❤,Expresses deep emotional connection and enjoyment of the song.
Positive,This is so dreamcore and nostalgic I love it.❤❤,Expresses strong positive feelings and enjoyment of the song's aesthetic.
Negative,"Thank you autotune. Glad I don't like pop, Bubble gum music. Not sure why it's popular. But okay",Expresses disdain for autotune and bubblegum pop.
Positive,"How can a song be so sentimental, it gives me so much complexion, so much deep emotion. Jez",Expresses strong positive feelings and deep emotional connection to the song.
Positive,The 80s style to this beat is PEAK,Expresses enthusiastic appreciation for the 80s-inspired style.
Neutral,Nah what other song does this sound like? That chorus sounds super familiar,Expresses confusion and a vague negative impression without strong emotional content.
Positive,"Between the soaring vocals, a title not prominently featured in the lyrics, and the overall eccentricity (check out that ending), it feels like something Kate Bush WISHES she would have done 40 years ago.",Expresses admiration and comparison to Kate Bush's style.
Positive,"I Don’t listen to Chappell roan, don’t even listen to pop, and can barely hear the lyrics, but this is still great",Expresses enjoyment despite acknowledging personal musical preferences.
Positive,80s Vibes 🥹👌,Expresses enthusiastic enjoyment and fondness.
Negative,At the end of the chorus whee the song is ending where the singing tune starts to get slower and slower seems to ruin the whole sog where the whole song would sound better without the last bit to the song getting slower and slower whee the tune changes where the whole song is stuck with the same level of speed throughout the whole song all the way to the end,Expresses strong dissatisfaction with the song's ending and its perceived detrimental effect.
Neutral,The video is so Orkut and 2007 vibes.,"Describes the video as evoking nostalgia for a specific, older online era."
Positive,Kate Bush vibes,Expresses admiration for Kate Bush’s style.
Positive,The vibe is the label really messed up I’m 37 and adore this girl she’s a star!!!!!!!!,Expresses strong admiration and enjoyment of the artist.
Positive,The Fact she is a new singer and Can make SUCH A GOOD SONG that gives a 90s vibe~,Expresses appreciation for the song's nostalgic 90s vibe.
Negative,This beat Teddy swims for a Grammy. This is ridiculous.,Expresses disbelief and criticism regarding a Grammy nomination.
Negative,This mv gives off crazy poser vibes like this isn't heckin nostalgic,Expresses dislike and criticism regarding the music video's perceived over-the-top and inauthentic feel.
Positive,"L❤ve this, so catchy",Expresses strong enjoyment of the song.
Positive,"This isn’t just a breakup song — it’s a full-on manifesto of reclaiming power and saying ‘Good luck’ with zero regrets. Chappell Roan’s raw honesty hits like a lightning bolt, and I poured that same fierce energy and unapologetic truth into my latest track. If you’re ready to feel every ounce of that fire and freedom, come check it out — because sometimes, letting go is the most powerful move you can make.",Expresses strong admiration and relates to the song's empowering message.
Positive,Genius lyrics fabulous video amazing tone,"Expresses strong positive opinions about the lyrics, video, and tone."
Negative,one of the worst things I've ever heard in my life .    ug.,Expresses extreme dissatisfaction and disgust with the music.
Positive,The vibes are vibing! 🏳️‍⚧️🏳️‍🌈✨,Expresses enthusiastic enjoyment and positive feelings.
Positive,"So rich, so groovy, so AUTOTUNED!!!",Expresses enthusiastic appreciation for autotune.
Negative,This is awful. No one wants the 80s back,Expresses strong dislike and rejection of the song's style.
Neutral,Song sounds like 80s (the beats anyway),Describes the song's stylistic resemblance to 80s music without expressing positive or negative emotion.
Positive,"Reminds of of 80s music, when singers sing with emotions.  Love it!!",Expresses fondness for the song's resemblance to emotionally-driven 80s music.
Neutral,high notes,Expresses a simple observation without positive or negative sentiment.
Positive,"She was on our local News as being from the area and nominated for a Grammy. Honestly, I’ve never heard of her prior to the News story, however, she gives Alanis Morisette vibes whom I absolutely love ❤️.","Expresses admiration for the artist, comparing her favorably to Alanis Morissette."
