classificacao,comentario,justificativa
Positive,Kendrick got this one beat with euphoria 👏💯,Expresses enthusiastic support and approval.
Negative,2:14 is the worst decision Drake ever made,Expresses strong disapproval of a specific song segment.
Neutral,drake has melody but kendrick has lyircs,A simple comparison of Drake's and Kendrick's strengths.
Positive,"Ngl, this track is the super catchy",Uses 'super catchy' to express strong positive enjoyment.
Positive,"This is getting better and better, it’s HOT literally the sun is shining in the SOUTH and I can’t bop to a history lesson. Summer Vibes, let’s go!",Expresses enthusiasm and enjoyment of the song as a summer anthem.
Neutral,"Drake's diss was hard, but kendrick beat him. I won't believe the p3do accusations without proof, but drake is falling off. But his disses (for the most part) were not too bad, even if kendrick's is better",Expresses mixed opinions on both artists and accusations.
Neutral,"So, this song is more catchy but Euphoria was more cutting which matters more In a beef. Round goes to Kendrick",Expresses a preference for a different song and a judgment about a 'beef'.
Neutral,All because Drake couldn’t call K-dot and say: “That second verse hurt my feelings.” 😂,"Humorous remark referencing a perceived conflict, without strong positive or negative emotion."
Negative,"No shade, this is trash. Go back in the lab and Rack up some new lyrics...Drake😂😂😂😂😂",Uses harsh language ('trash') and mocks the song's lyrics.
Negative,Idc what no one says Drake beat Kendrick,Expresses disagreement and dismisses Kendrick Lamar's music.
Positive,"Unpopular opinion, Drake is winning this battle rn, beats and raps are better!",Expresses a strong preference for Drake's music and style.
Negative,Damn after hearing Kendrick this shit trash 🤣🤣 I like the beat though,Expresses strong disapproval of Kendrick Lamar's music with sarcastic laughter.
Negative,This is simple compared to what Kendrick just put out. Euphoria sounds better and lyrics hit harder,Compares the song unfavorably to Kendrick Lamar's music.
Neutral,Whos here because no one beats Drake 😅,"Expresses a simple, somewhat boastful statement without strong emotional content."
Positive,"Okay, it's no fucking secret that Drake lost, but that beat is fucking 🔥🔥🔥🔥🔥🔥🔥",Expresses strong enthusiasm and approval of the beat.
Negative,Why he using the same beat for the past 10 years,Expresses dissatisfaction with repetitive use of a musical beat.
Positive,"Kdot won and we all knew he would, but drake rapped better than he has in a long time. He stepped up and even tho he lost he did his thing (aside from heart part 6 and Taylor made 🤢)This my favorite beat of the beef tbh",Expresses support for Kendrick Lamar's performance and enjoyment of the track.
Neutral,Whoever love this one listen Kendrick's control Verse,Poses a question without expressing a definitive opinion.
Positive,This is actually not that bad 😂 I think Kendrick just went a little bit nuts though but this actually had some some beat some fucking content like alright what’s next 😂,Expresses amusement and positive reaction to the song.
Positive,"As a kendrick fan, this is a beat fr",Expresses approval and enthusiasm for the song.
Neutral,"Im a real kendrick and drake fan.. and honestly this song and the other drake song, family matters (ya dead😂) the only songs i keep on repeat. These beats are 🔥.  But i get it.. kendrick is a very gentle yet intense poet. But i wouldnt listen to those songs over again. They are too dark.",Expresses enjoyment and appreciation alongside a critical reservation.
Positive,"I don’t know, maybe it’s because he went after so many people in one song, but I think Drake’s response was much better crafted than Dot’s and more interesting. It’s more creative, wittier, more subliminal, had better beats and thus hit harder in my opinion. It gives off a feeling of being a full production track rather than a diss track. Just not seeing what all the hoopla is about with Kendrick.",Praises Drake's response as more creative and impactful than Kendrick's.
Negative,"Kendrick won 😬 no coming back after euphoria. A lot of y’all are going based off a catchy beat club music and this is a hip hop culture, Kendrick is direct like on some grown man business. Drake’s audience is too young to understand half of what Kendrick exposes through every bar in the song. Kendrick made a real DISS TRACK.",Expresses criticism of Drake's audience and deems Kendrick's track a 'diss track'.
Negative,This is murder 101... Lyrics is damn,Strong condemnation of the song's lyrics as violent and offensive.
Negative,"Imagine if at 1:34 Drake said, “Metro, imma beat yo ahh like some drums nikka”",Contains vulgar language and a disrespectful comment.
Neutral,I think Kendrick’s disses are way better but damn this shits still really catchy,Expresses a mixed opinion – acknowledges catchiness while criticizing the content.
Positive,0:21 Drake in this track is too powerful ❤❤❤❤❤❤❤❤❤❤❤❤❤❤❤❤❤❤❤❤❤❤🔥🔥🔥🔥🔥🔥🔥🔥🔥🔥🔥🔥🔥🔥🔥🔥🔥🔥🔥🔥🔥🔥🔥🔥🔥🔥🔥🔥🔥🔥🔥🔥🔥🔥🔥🔥🔥🔥,Expresses strong enthusiastic adoration for Drake's performance.
Positive,Where have these beats been hiding?,Expresses enthusiastic discovery and appreciation for the music's quality.
Negative,This is as hard as Drake can go. He’s cut out for making catchy songs… He cannot battle a real rapper like Kendrick.,Expresses doubt about Drake's abilities compared to Kendrick Lamar.
Neutral,"I'm not surprised that Kendrick rapped better that was a given, but with all Drake's ties I'm surprised Dot's beats was so much better.",Expresses a surprise and comparison without strong positive or negative judgment.
Negative,In my opinion Kendrick song is more of powerful. I’ve always been a fan of Kendrick. Drake is a joke come on he is Canadian rapper. Canadian rapper acting to be hard?,Criticizes Drake and expresses a positive view of Kendrick.
Negative,Aubrey wrote none of these lyrics.,Expresses suspicion and criticism of the artist's authorship.
Negative,"Unfortunately, it's the same vibe as Back to Back. Nothing new creatively. Strike a chord and it's probably A Minor!!!!!! Whewwwwwwwww",Expresses disappointment and criticism regarding a lack of creative innovation.
Negative,"All I hear is ""21 can you do sum for meeee"" 😂 Drake is too fruity for this beat",Uses sarcasm and expresses dislike of the song's lyrics and overall feel.
Positive,Man there is some good lyrics in here and I like the music but Kendrick Lamar cooked this man per line. If you know you know,Expresses appreciation and acknowledges the artist's skill.
Neutral,"""And we need a verse for the swifties"" Aging well",A brief comment referencing a fanbase without expressing a strong positive or negative opinion.
Negative,"All the Kendrick fans came here to hear something that they missed…..nope didn’t miss a thing, Drakes verse is worse after listening to Euphoria 😂😂😂😂",Expresses dissatisfaction and mocks Kendrick Lamar's music compared to Drake.
Negative,"I didn’t hear this before kendrick responded. I was aware of the situation but didn’t care enough to check on it. But after euphoria I had to see what he was responding to. To be up front, I’m a huge Kendrick fan, and I don’t care for Drake at all. BUT, after listening to this track I gotta be honest… this is even worse than I expected. Drake is a so wack it hurts. Once again he just sounds like an actor reciting rap lyrics. This is trash",Expresses strong disapproval and declares the song 'trash'.
Positive,Beat's fucking fire... sad enough is for a drake song 😭😭🙏,Expresses strong positive sentiment about the beat while acknowledging a Drake comparison.
Negative,Honestly i do not know everybody is in to drake he doesnt rap he can bearlyy sing. All his songs sound the same other than the beat. He has no rythym. Then you talk about industry plant,Expresses strong criticism of Drake's music and abilities.
Negative,#theworstrapperintheworld 🌎🌍,Expresses strong dislike and judgment.
Negative,Kendrick just reminds me of the dude at the club that gets in your ear rapping everytime he hears a beat he thinks he can flow to. Yea I hate that guy also lol,Expresses disdain for an artist's perceived arrogance and subpar skills.
Negative,"man ANYBODY who cant acknowledge that this boy destroyed this beat, yall trippin",Expresses strong disapproval and accuses others of 'tripping'.
Negative,Why couldnt kendrick have cadence like drake? His bars on this type beat with better cadence and hed have won it.,Expresses disappointment and criticism regarding Kendrick's flow and delivery.
Negative,“Generic Kendrick slobber comment”,Uses derogatory language to express dislike of the song.
Negative,Drake's flow sends me to sleep 😴 its so repetitive like the rest of his music - everything he does sound the same.,Expresses boredom and criticism of Drake's repetitive style.
Negative,“Recency Bias” is a real ting my guy!! Who ever dropped last is apparently better lol. But if y’all know Drake you know where this is going!!! The only thing upsetting to me is…I knew some p didn’t like Drake and it’s cool.  But to see everyone wanting to see Kendrick dethrone the God is disheartening. Ppl hate whoever is on top. I seen them do it to Mayweather and others. Ppl actually like the fact Kendrick literally said “I’m the biggest hater”???Like wtf??!!! Regardless of how much ppl claim to love you. Use you to help their personal lives and careers. Deep down they really hate you and pray on your downfall. Watching Drakes career taught me that one.,Expresses frustration and cynicism regarding fan preferences and perceived negativity towards successful artists.
Negative,"Super crap musoc, shit rhythm, shit verse.. No swing, totally out of ""tempo"".  Garbage",Strongly criticizes the music as 'crap' and 'garbage'.
Negative,Drake so soft as shit. this is trash waste of a beat,Strongly criticizes Drake's music as 'trash'.
Positive,I think this beat is better but what Kendrick said is way more potent,Expresses preference for the beat while acknowledging the strength of Kendrick's words.
Neutral,"After hearing euphoria, i must say this is ssa. Drake has the beat and kendrick bodied with the lyrical. Beat shit can be played out but KENDRICK SPITTED FACTSSSSS .DRAKE IS QUESTIONABLE WHEN IT COMES TO BEING HOMO ETC SO I MEAN HE DIDNT LIE, HE ALSO DIDNT LIE ABOUT THE SON PART AND ALSO GHOST WRITING.",Mixed opinion with praise for Kendrick and criticism of Drake's sexuality and ghostwriting.
Positive,Beat hard...lyrics hard....classic Drake,Expresses strong positive sentiment and admiration for the song.
Neutral,Danm the beat coming in the beginning was so clean,Minor correction of spelling and a neutral observation about the beat.
Positive,these lyrics go hard and have meaning,Expresses appreciation for the song's lyrics.
Positive,"Awww...this is so cute....lil Drakey and all his ""helpers"" trying so hard - lol!   There's no competition.  Kendrick needs to stop wasting his God given valuable high vibe creativity and true talent on this lil punk",Expresses fondness and appreciation for the song's charming elements.
Neutral,Music Song wise it's real rap music beats better n his rap is better not better diss it's a tie 4 me,Expresses a balanced opinion with no strong positive or negative emotion.
Negative,Bro thinks bro could beat Kendrick saying the n word 😂,Contains offensive language and expresses disrespectful opinion.
Positive,I love how this was Drake's response to Kendrick's 1 minute verse 🤣 His writers were working overtime,Expresses amusement and appreciation for Drake's response.
Negative,Yall saying drake won because it slaps lol bruh this sounds like crap you cant win because of a beat,Expresses strong dissatisfaction and dismisses the song's quality.
Negative,They make excuses for u Casie they hate to see me lit was better than anything Kendrick said.. substance lyrics and bars wins every time,Expresses strong dislike and criticism of the artist and their music.
Negative,Drake is trash even the beat,Expresses strong disapproval of Drake and his music.
Negative,bro put kai cenat in the lyrics💀😭,Expresses strong disapproval and ridicule.
Positive,Funny how it’s now two Predators on this song with that AK beat switch thing 😂😂😂,Expresses amusement and appreciation for a clever musical element.
Negative,Don’t get why people like this tho. Nice beat but shallow,Expresses dislike and criticizes the song as lacking depth.
Negative,Theres no way a human thinks dude got kendrick beat huh?,Expresses disbelief and criticism of a perceived inferior artist.
Negative,The beat is tuff other then that THIS IS ASSSSSS TF,Contains abusive and derogatory language expressing strong dissatisfaction.
Positive,Here simply because I forgot his lyrics Kendrick really killed this man I know every Kendrick line bar for bar with the exception of 6:16 in la,Expresses strong admiration and detailed knowledge of the song.
Negative,ONE OF THE WORST DISS TRACKS IN HISTORY OF HUMANITY,Strongly condemns the comment as a terrible diss track.
Negative,"I feel like this is the most underrated song through the entire feud. If Drake just would have came through with this with no AI and came at him with theses verses in his voice, he could have blocked Kendrick’s angles more clearly like he was trying to do here.",Expresses disappointment and criticism regarding the song's execution and Drake's potential.
Positive,"say what you want this is for me better than like that, insulting kdot for small feet is wild(i aint no meatrider but the beat and words are good af)","Despite initial criticism, acknowledges appreciation for the song's quality."
Negative,Came back to make sure I wasnt missing something...I wasn't.  This wasnt even as good as the verse on Like Dat....,Compares the song negatively to a previously well-regarded song.
Negative,this is garbage for something made nowadays plus the beat to it is booty i think if the beat was on point it might have been better but either way its subpar ar best,Strongly criticizes the song as 'garbage' and the beat as 'booty'.
Neutral,I think he might have Kendrick beat sorry not sorry,Expresses a subjective opinion without strong positive or negative emotion.
Negative,Such a good ass beat that's been ruined by abysmal lyrics that no ghostwriter is getting credited for  (half satire),Criticizes the lyrics as abysmal and suggests a lack of credit.
Positive,That beat carries this song. Anybody with a brain easily would take Kendrick simply on the beat is even better and Kendrick articulated every word he meant. Drake tried to make a hit. Who’s trending #1 right now? Gotta ask the Drake fan goobers 😂,"Praises Kendrick's beat and skill, dismissing Drake's attempt at a hit."
Negative,This is the better diss+song. No one wants to listen to a 40 year old force a high pitched goblin voice,Expresses negativity and disparagement towards the artist's voice and music.
Negative,😂😂 bro said you're not beating us at least he acknowledges Ghost writers,Expresses disdain and suggests dishonesty.
Negative,Bro dissed everybody on this beat💦😅💦😅,Expresses frustration and mockery towards others.
Negative,"this beat just has more bass,  not even a better beat  way subpar bars  kendrick done killed this mans then desecrated his corpse",Strongly criticizes the song's quality with harsh language.
Negative,"Drake with his ""I dont wanna wake my parents you guys"" ass discord call last chorus",Uses derogatory language to criticize Drake's song and lyrics.
Positive,Beat rapper alive after Wayne❤❤,Expresses enthusiastic appreciation for the rapper.
Negative,Whoever thinks this beats euphoria is a d rider for drake this shit is soft as heck. Kendrick will end drake’s career by time this beef over,Expresses strong disapproval and predicts negative consequences for Drake.
Negative,BRO YOU CANNOT STEAL THE BEAT FROM TENEBRE ROSSO SANGUE LIKE THAT!!!,Expresses outrage over alleged plagiarism.
Negative,What are people smoking Kendrick is not on his level every 2 verses is chorus worthy,Expresses strong criticism of Kendrick's music quality.
Positive,This Beat is hard tho.,Expresses positive appreciation for the song's rhythm.
Negative,"It’s funny that he thought he could beat Kendrick with that shitty non-sense. Kendrick gave him a warning with euphoria, it was just a warm-up. There is one king and one clown. It’s not even a fair fight 😂",Expresses disdain and dismisses the artist's music as inferior.
Negative,Dis is so ass I can make them beats with my damn lips,Uses vulgar language to express strong dissatisfaction.
Negative,"""that's the dog with the bite nigga what's up"" is a catchy line that i like, but in general it's ass, kendrick used a F-22 to eliminate a beetle😂",Expresses disapproval of the song and criticizes the lyrics.
Positive,"Made a fire beat remix of this song , go check it ! 🔥🔥🔥🔥",Expresses enthusiasm and encourages others to listen.
Negative,“50 deep but it aint deep enough” 😨😨,Expresses dissatisfaction with the song's lack of substance.
Neutral,Metro drizzy beat is enough for this guy…,Expresses a simple opinion about the beat without strong positive or negative emotion.
Negative,"Drop and give me 50 is once again another persons lyrics he stole from one of his first places he swagger jacked from , New Orleans",Accuses the artist of plagiarism and theft of lyrics.
Positive,"I don't know what people hear but, Drake has more flavor, more beats, more swag, the switch ups are crazy, Kendrick is good but has the same beat the whole song.  DRAKE WINS!!! SORRY NOT SORRY",Expresses strong preference for Drake and criticizes Kendrick's repetitive beats.
Negative,21 Savage is probably the worst rapper ever,Expresses strong negative opinion about 21 Savage's rapping ability.
Neutral,drake beat everyone but lost to kdot,Reports a competitive outcome without expressing a strong positive or negative opinion.
Negative,"Ngl this is nice but Dot literally proved every good line wrong. Dot took his chain, Dot won the popularity contest, took down that king verse on the comeback, dropped back to back, and Metro made BBL Drizzy lol.",Expresses strong criticism and disbelief regarding Dot's achievements.
Positive,0:25 Drake is too powerful in this track❤❤❤❤❤❤❤❤❤❤❤❤❤❤❤❤❤❤❤❤❤❤❤❤❤❤❤❤❤❤❤❤🔥🔥🔥🔥🔥🔥🔥🔥,Expresses strong enthusiastic enjoyment of the song.
Positive,The beat alone makes this a better song than all three of those other b******* drops. Combined.,Expresses strong approval and superiority of the song's beat.
Negative,bro why the beat sound like a low budget shark attack theme tho 💀💀,"Expresses dislike of the song's beat, comparing it unfavorably."
Negative,This shit straight 🌽. Too much jargon. Beat keepin this one alive.,Uses vulgar language and expresses strong disapproval.
Negative,The only thing hard about this is the beat... drake is trash!,Expresses strong disapproval of Drake's music.
Neutral,Beats and Rap wise drake easily wins this battle against lamar,Expresses a subjective opinion about the relative quality of the music.
Positive,Drake lost but he held his own. That 2nd beat drop on family matters was hard af,Expresses strong approval and excitement about a specific moment in the song.
Positive,Say what you want about the lyrics but this and Family Matters were the best beats to come out of this entire beef. The real winner was Drake’s producer🥶,Expresses enjoyment of the music despite criticisms.
Negative,That's all metro can do df..make beats.,Expresses dissatisfaction and criticism of the artist's capabilities.
Negative,"Let's not forget Drake was awkwardly in Justin Beibers ""Baby"" video back in the day. He has NO room to talk about making verses for swifties or Maroon 5 lol",Expresses a critical and dismissive view of Drake's credibility.
Positive,tha metro shut ho ass down play some drums tha lyrics is wild. is like Drake slapped metro once then this is happend K.O,Expresses enthusiastic approval and a sense of victory.
Positive,Beat goes hard,Expresses enjoyment of the song's rhythm and energy.
Positive,21 savage wrote Push Ups lol listen to it lol 😂 this is crazy like deadass even the metro line lol the drop in the beat that’s a 21 savage thing,Expresses enthusiasm and amusement about 21 Savage's music.
Negative,I dont like this beat it ruins it for me 🤷🏾,"Expresses dislike for the beat, indicating a negative reaction."
Negative,The fact somebody wasted these beats for this garbage song is wild,Expresses strong disapproval and condemnation of the song.
Neutral,Coming back to listen to this after Kendrick verse this don’t hit as hard anymore to me. It’s still not trash though Drake went off. Kendrick is just showing levels to me.,Expresses a shift in opinion while acknowledging the Drake verse's strength.
Negative,Drake doft as hell ...he got ghost writers....lots of his lyrics have already been rapped ...he ain't got shit ...I really never liked kendricks beats but his lyrics are complicated makes you think and when you realize what he said ..it like damn that shit was really complex,Expresses strong disapproval and accusations of lacking originality.
Negative,why is this song so long. drake’s voice so monotonous,Expresses dissatisfaction with the song's length and Drake's vocal style.
Negative,Gonna be honest though it was about 50Cent lol kinda makes sense in the the mind of a moron I do like the melody tho,Uses insulting language and expresses a negative opinion.
Negative,ik deep down that the one who made this video is a xo fan lol for skiping the abel diss,Expresses dislike and mockery towards the video creator's presumed support of Machine Gun Kelly.
Neutral,"Hits dif cuz u know had someone write it for him, wack, cool beat tho....",Expresses criticism about the songwriting while acknowledging a good beat.
Neutral,Beat harder than the flow 😢,"Expresses a simple, slightly emotive reaction without strong positive or negative sentiment."
Negative,There are a few country boys that did this beat justice. This was subpar at best. I wonder who his ghost writers are.,Expresses disappointment and suspicion about the song's quality and songwriting.
Neutral,no one can top kendrick's verse on like that not even kendrick himself,"Expresses a strong, but non-committal, opinion about Kendrick's verse."
Negative,Metro 👂 🎶: da fuq I do? He purchased this beat months ago 😭,Expresses frustration and disappointment with the beat purchase.
Positive,Kdot track cuts deeper than Drakes,Implies a superior artistic depth compared to Drake.
Positive,This just a lil catchy. Kendrick murdered him. Tbh,Expresses enjoyment and praise for Kendrick's performance.
Negative,Drake really beat Kendrick is crazy,"Expresses a strong, negative opinion about Drake's perceived superiority."
Negative,Kendrick copy and paste everything we already knew about drakebn put it on a beat😅.,Expresses criticism of Kendrick's music as unoriginal.
Neutral,There are couple lines in here that are good NGl. but imo doesn’t even match the like that verse. Imo the aggression lacks the bars are not near the level of 40 secs of violence. I’ll give Aubrey credit he and his ghost writers came up with some ish..but then euphoria came out.,Offers mixed opinions and criticisms without strong positive or negative emotion.
Neutral,"Im not gonna lie, im just here for the Lyrical Battle. Now as far as points, for beat selection amd consistency i gotta give it to drake. Now as far as hard hitting Lyrics, im 100% giving that to kendrick but only because though drake had some good punchlines, kendricks word play was absolutely insane. Now if Drake somehow responds to Euphoria and yes even though im a Drake fan even i know its gonna be VERY hard for hom to respond to that...he HAS to shoot to kill in that response.",Expresses a desire for a lyrical battle and offers a balanced comparison of the artists' strengths.
Positive,Lil wayne the only one that can get you out that Jam . Its like after drake verse we got tp hear weezy to feel this shit,Expresses strong enthusiasm and admiration for Lil Wayne's impact.
Neutral,This beat is good asf. But is this hard? Not imo,Expresses a positive opinion about the beat but expresses a personal lack of finding it challenging.
Negative,"Damn, this one felt like a lame ass classic rap song, Kendrick got more heart on his diss. I payed full attention to every word and the beat, it’s not a replayable song imo",Expresses disappointment and criticizes the song as uninteresting and lacking depth.
Negative,"Kendrick sounds like a little cabbage patch kid going through puberty lmaooo 😂😂😂 That shit makes me laugh every time I hear him without fail. His hardest verse to date is that ASAP Rocky song. Drake is trash, too, so I'm impartial. How he's considered one of the best rappers today just let's you know HIP HOP died a long time ago 💀","Sarcastic and dismissive comments about Kendrick and Drake, labeling them negatively."
