classificacao,comentario,justificativa
Negative,"Oh man lol. What you guys on? You ain't got no one to listen to? Hit the underground and stay there. We played out. And this ain't a dis track. This is weak. Just like this entire joke of a career. Take the garbage out your mouth, and chew your groceries before you swallow this wad, just to puke back at me as music. Weak, materialistic, Nikki Minaj like lyrics.",Contains highly critical and insulting language describing the music and artist.
Negative,Him repeating the verse over is him coming the spell that we get on his side. He puts hella black magic on his music to get you to like it.,Uses sarcastic and potentially offensive language to criticize the artist's methods.
Negative,The lyrics between all the songs from this rap beef should be closely examined and be used as evidence. We cannot allow the system to rig and completely scam and rip off its citizens. I demand justice . I demand answers for a contract that I never signed. This just proves the CIA is involved. I will not rest until I have justice . I will never stop speaking out against the corrupt system and the CiA as long a live if there isn’t something done about this.,Expresses outrage and demands justice regarding a perceived conspiracy.
Negative,This is awful.,Expresses strong disapproval and deems the music 'awful'.
Negative,Beat ass,Uses a derogatory term to describe the music.
Neutral,This beat deserves some harder drill type of bars,Expresses a preference for a specific musical style without explicitly positive or negative sentiment.
Negative,who puts lyrics up for a rap battle? tf😂😂😂😂 clown,Expresses frustration and ridicule regarding the use of lyrics in a rap battle.
Positive,Whos face crinkled like a soda can when the beat dropped?! 😮,Expresses surprised delight and excitement.
Neutral,this beat tho (kendrick still better tho),Mixed praise with a slight preference for Kendrick Lamar.
Negative,"So THATS why Metro put that ""BBL Drizzy"" beat out to the masses... For free ☠️☠️☠️🤦🏽‍♂️",Expresses anger and frustration about leaked music.
Negative,This the worst goddam song Kendrick better,Expresses strong disapproval and condemnation of the song.
Positive,"Listen I won’t pretend like it’s one of the best lyrical masterpieces of all time, but it is catchy as fuck and is a great hype “fuck you” song. I just fucking hate that part where he says “the way you doin splits bitch your pants might rip” lolllllll gives me secondhand embarrassment",Acknowledges flaws but ultimately enjoys the song's catchiness and humor.
Negative,Drake is made from deep state like many others l assume those are now their clones,"Expresses suspicion and distrust towards Drake, implying he is part of a conspiracy."
Negative,"""And you gon' feel the aftermath of what I write down"" - bruh we know you don't write your own lyrics 😭",Expresses disbelief and criticism regarding the artist's songwriting abilities.
Positive,I'm so happy i don't deep throat any artist so I can just enjoy both songs,Expresses joy and appreciation for music without detracting from the artist.
Neutral,It just doesn’t hit as hard when they aren’t his lyrics.,Expresses a lack of strong positive feeling due to lyrical shortcomings.
Neutral,"Ok Kendrick won but, underrated diss: ""You better do that mf show inside the bity; Maroon 5 need a verse, you better make it witty; Then we need a verse for the swifties; Top say drop, you better drop and give 'em fifty"" Kendrick did write verses for Maroon 5 and Taylor swift and is probably getting back in the game cuz he needs a bag.","Contains praise and criticism, alongside speculation about Kendrick's motivations."
Negative,Yo didn’t even write the lyrics. How can you put out a diss when you didn’t write a single Lyric of it,Expresses frustration and criticism regarding the song's lyrical content.
Neutral,I’m just here cuz I heard the beat😂,A humorous comment with no strong positive or negative sentiment.
Negative,The beat was fire until he spoke 📉,The emoji indicates a negative reaction to the vocals.
Negative,lol the metro line was kinda funny ngl but accusing him of beating on his girl is wild asf,Expresses disbelief and criticism of the accusation.
Positive,The beat sick 🤷🏾‍♂️😂😂,Expresses approval and enjoyment with a casual emoji.
Negative,Drake goes hard af 😂 im drake all day fuck the haters Kendrick diss garbage lame ass beat,"Expresses strong, aggressive dislike and insults towards Drake and Kendrick Lamar."
Negative,"The worst part us that this shi slaps,problem is he shot this a Kendrick",Expresses strong disapproval and criticism of the song.
Positive,This and Family Matters 3rd verse were Drakes best punches in the beef,Expresses enjoyment and praise for specific parts of the song.
Negative,"Lame lyrics, smh",Expresses dissatisfaction with the song's lyrics.
Neutral,Funny thing is... all the swiftys got the verse live😬,"A brief, slightly sarcastic observation about fan reactions."
Neutral,Anyone notice the beginning like Tech N9ne and goes on with the beat of Table Chess Press? Anyone notice that,Identifies a similarity to another artist without expressing a clear positive or negative opinion.
Negative,Drake the diddler and his fake disney thuggin.  Does anyone take this clown seriously he got bodied at every turn vs kdot. Talking nobody takes a chain from us? Yeah they get him for watches though. Using ghost writers too? Drake lost the worst of any rap battle in history like x 5.,Strongly criticizes Drake's music and career with harsh insults and comparisons.
Neutral,Ngl this songs very good. But Kendrick obliterated the songs vibes😭,Expresses a positive opinion while noting a disruption of the song’s atmosphere.
Negative,What is this Kingdom Hearts ass beat?,Expresses strong dislike and criticism of the song's style.
Positive,Dang that feature with Taylor verse was witty I ain’t expect him to do some nice like that. Kdot took the round tho,Expresses appreciation for a clever feature and acknowledges Kdot's skill.
Negative,Drake need new lyrics why boy always out in Tokyo,Expresses dissatisfaction with Drake's lyrics.
Negative,Same old aubrey-  relying on the Beats to carry him. He sounds corny..,Expresses criticism of the artist's performance and vocal delivery.
Negative,I dismissed Drake and I can't say he beating this,Expresses dismissal and criticism of Drake's performance.
Negative,Beat carried this shit sound like a youtuber made this😂,Expresses strong disapproval and ridicule of the song's quality.
Negative,The beat 😭😭😭😭😭😭😭😭😭😭,Expresses overwhelming sadness and distress regarding the beat.
Neutral,"nice beat, mid lyrics",Acknowledges a good beat but criticizes the lyrics.
Neutral,It's a no def with the beat,"'No def' is slang for 'no problem,' indicating a neutral assessment."
Neutral,Honestly if The beef ended after euphoria then drake couldve won cuz this song kinda catchy and euphoria kinda boring and long.,"Expresses a mixed opinion, comparing the song to a previous hit and acknowledging its catchiness while also noting its length."
Negative,"Whoever wrote these lyrics came with some heat, too bad they don’t get the credit they deserve. There is no drake and Kendrick beef. I’m hearing no credit wroters vs Kendrick beef tho. Drake playing himself too…how can you claim you’re feeding people fake info when you’re being fed diss bars",Expresses criticism and disagreement regarding the lyrics and artist's actions.
Neutral,I like this beat and stuff but Kendrick still my number one over him. 😂😂,Expresses a preference without strong positive or negative emotion.
Neutral,The beat harder than the song😂,A humorous observation without a strong positive or negative opinion.
Negative,And then Not Like Us became #1 everywhere including Canada that has the whole world dancing and chanting lyrics about Drake being a sex pervert and predator.,Expresses disapproval and criticism of Drake's actions and the song's popularity.
Negative,This is generic crap lol. What the hell?,Expresses strong disapproval and finds the music unoriginal.
Negative,"Beat is weak, rap is weak person behind it is weak. Drake is trash","Strongly criticizes the beat, rapping, and the artist (Drake) as 'trash'."
Positive,"This is a masterpiece, when the dust settles and time goes by people will remember how beast this was, gives me emeinem - the sauce vibes.",Expresses high praise and believes the song will be remembered positively.
Negative,Stg yall taken this shi so deep both of the disses hit hard,Uses offensive language and expresses strong criticism.
Positive,The beat is hard tho wait a minute 😂😂🔥🔥🔥🔥🔥,Expresses enthusiastic enjoyment with emojis.
Negative,I’m back to say he stole these lyrics from battle rappers and have ghostwriters smh,Accuses the artist of plagiarism and using ghostwriters.
Negative,What a crappy music and lyrics,Expresses strong disapproval of the music and lyrics.
Negative,If we can be honest.......This ain't it. Catchy yes. This ain't it though.,Expresses dissatisfaction and criticism of the song.
Neutral,"I like this song, the beat, the hook but the more I listen to it it sounds like he is reading the lyrics he should have studied until he had it memorized even if he did write it",Expresses a mixed opinion – acknowledging positive aspects while criticizing the delivery.
Negative,The worst part ab this is that drake aint even write this shit. Cmon bruh.,Expresses strong criticism and disbelief about Drake's involvement.
Negative,He said they got him out here rapping how he's living it's bc he never did it Drake need to just give up frfr he always been still another rapper's   verses he 🗑️ I really don't even see how he made it this far,Expresses strong criticism and dismissal of the artist's success.
Negative,Ryan upchurchs song drake stole this from him😂 the whole beat the song name it’s all Ryan upchurchs watch the real shi it’s way harder anyways drake got this little ah boy voice😂🤏🏻,Expresses strong criticism and mockery of Drake's music.
Negative,Both tracks are garbage can we plz fast forward to the shooting? Quit waisting time and beats,Expresses strong dissatisfaction and demands for quicker content.
Neutral,"Kendrick won, I’m team Kendrick, but this shi catchy.",Acknowledges Kendrick’s victory while admitting to enjoying the song’s catchiness.
Neutral,Look man everyone has their opinion I get it. Kendrick been clapping back no doubt but Drake is beating him! He making shit you can sit and be like damn he coming for necks while at the same time can have your girl shake her ass to the same song while mfs getting cooked in it! 😂,Mixed opinions and hyperbolic praise/criticism without a clear dominant sentiment.
Neutral,"I'm just connecting the ""Bodyguards like Whitney"" line. That might be the hardest verse Drake cooked up for this whole beef... well his side of the beef","Observational comment about a lyric, lacking strong positive or negative emotion."
Negative,Second verse slid 4sure,Expresses a strong negative opinion about the song's second verse.
Neutral,This almost sounds like the big foot beat,"Comparison to another song, lacking strong positive or negative sentiment."
Negative,The beat is hard...the lyrics are ass,Expresses disapproval of both the beat and the lyrics.
Neutral,"""Maroon5 need a verse you better make it witty"" 🗣🗣#damn","A direct, critical suggestion without expressing positive or negative emotion."
Positive,Listening after Kendrick deep fried Drake,Implies enjoyment and admiration for Kendrick Lamar's performance.
Negative,Euphoria better…Drake talking getting his nails done while Kendrick nailing him in the coffin for being a dead beat dad(still) even after Pusha T had to make him start trying to act like one in the first place,Expresses strong criticism and disparagement of Drake's music and parental status.
Neutral,1:06 beat💀,Expresses a reaction (1:06 beat) without a clear positive or negative sentiment.
Negative,"Bro the song feels so damn out of tune, It's off beat, It's so ass. First we get some verses and then out of nowhere he drops the chorus. Cringy and cheesy ass voice he using bro 🙏🙏💀💀",Expresses strong criticism of the song's tunelessness and vocal quality.
Negative,Kendrick shit was wack af maybe it was the beat,Uses derogatory language ('shit') and expresses a negative opinion about the song.
Negative,After listening to euphoria.. the best thing about Drake's diss track is the beat I'm sorry it's all nursery rhyme compared to KDOT,"Compares the song unfavorably, calling it a 'nursery rhyme'."
Positive,Kendrick cooked him 😂 drakes is catchy but diss tracks need to have diss component and kendrick has that by 100x.,Expresses strong approval and superiority regarding Kendrick Lamar's music.
Negative,This version is sooo ass... STRICTLY cause of the beat,Expresses strong dissatisfaction due to the song's beat.
Negative,"This shit is whack as fukk. Remove the beat from this and Kendrick and put both to a click track. You’ll see how garbage Drake actually is, hiding behind beats and producing.","Uses strong, offensive language to criticize the song and artist."
Negative,So how is this beating Kendrick diss,Expresses disapproval and suggests a critical comparison.
Negative,Not even all of Drakes ghost wtiters could beat Kendrick,Expresses a dismissive and critical opinion of Drake's influence.
Negative,A.I. beat?,Expresses a negative opinion about the use of artificial intelligence in music creation.
Neutral,The only thing Hard about this track after hearing Euphoria is the Beat,A straightforward observation about the track's beat.
Negative,Drakes song sounds better to the ears but Kendricks song is actually real as fuck. Drake can act hard all he wants and talk all this shit but at the end of the day everyone in the scene knows that lil bro is all bark and no bite and that homie came from canada and had a lil acting career and shit before he ever saw the fame he has now after pretending to be someone he isnt. Drake is not hard. Drake is not from the streets and made himself better. This is why people who have actually been in that life and been through that shit for real dont really care for drake like that. All good to be you but to portray this other character for extra clout or street cred is just beyond cringey now. His music still goes hard but definitely not against people with some real heart and soul behind their music and lyrics.,Strongly criticizes Drake’s persona and music as inauthentic and manufactured.
Negative,He should have went Memphis on the beat Tay key or Juicy J..,Criticizes the song's beat choice negatively.
Negative,What did everyone think was going to happen lol. Fuck not being in the same legue kedrick aint even on the same universe in comparison.,Expresses frustration and disbelief with strong negative language.
Neutral,all-is-left-to-beat-kendrick-is-drake-who-is-active,Expresses confusion and comparison without strong positive or negative sentiment.
