classificacao,comentario,justificativa
Positive,How sweet - and no creaky vocal fry!,The commenter expresses positive feelings using the adjective 'sweet' and praises the vocal quality.
Positive,The expression n lyrics ahhhhh addicted❤,The use of 'ahhhhh' and the heart emoji clearly indicate a positive emotional response to the music video.
Positive,THE VIBEEE😩,The use of 'VIBEEE' expresses enthusiastic enjoyment of the music video.
Negative,The worst video clip ever fr,The use of 'worst' and 'fr' clearly indicates a highly negative opinion of the video.
Positive,I can’t belive this beat thumbs,The enthusiastic exclamation of 'I can’t believe this beat thumbs' clearly indicates a positive reaction to the music video.
Negative,"Too much autotune, not enough talent, just enough sex appeal.",The comment expresses critical opinions about the artist's vocal ability and suggests a reliance on superficial qualities.
Positive,This song suits summer vibe.,The comment expresses a positive association with the song and its suitability for a desirable season.
Positive,This Song is just way too catchy wow....,The exclamation points and word 'wow' indicate enthusiastic enjoyment of the song.
Positive,Nice beat ❤❤❤😊😊,The use of heart emojis and positive facial expressions indicates enthusiastic approval of the music video.
Positive,Summer vibes right there !,The exclamation and phrase 'Summer vibes' clearly express a positive feeling about the music video.
Positive,a colorful video and the vocals really make you feel good,"The commenter expresses a positive feeling about the video and vocals, describing them as 'making you feel good'."
Positive,"This so teen movie vibes, I’m obsessed! Served once again! ☺️","The commenter expresses enthusiastic enjoyment and affection for the video, indicated by 'obsessed' and the smiling emoji."
Positive,Giving 50s bombshell blonde type vibes,"The comment expresses a positive association with the music video's aesthetic, describing it as appealing."
Negative,The worst YouTube music video that I ever saw in my whole life,The use of 'worst' and 'ever' indicates a strongly negative opinion about the music video.
Positive,"Same vibe with Paris Hilton's ""Stars are Blind""","The comment expresses a positive comparison, indicating enjoyment of the music video's similarities to a well-regarded track."
Positive,"Summer, sun tan , vintage love , la 's sunset , 🌇 beach, sun kiss skin , trees , cars , ice cream , wavy hair, short clothes, vibe song",The comment expresses enthusiastic enjoyment of the video's imagery and atmosphere described as 'vibe song' and positive summer elements.
Negative,This is pretty awful.,The use of 'awful' clearly indicates a negative sentiment towards the music video.
Negative,This song so awful,The use of 'awful' clearly expresses a negative opinion about the song.
Positive,it's been a year and for some reason this song feels nostalgic 😭,The use of 'nostalgic' and the crying emoji (😭) clearly indicates a positive emotional response to the song.
Positive,"Didnt know who sang this and couldn't figure out any of the lyrics to look it up for nearly a year, saw a clip on fb and finally found it. Gets stuck in my head every time they play it at the store","The commenter expresses fondness for the song, stating it"
Positive,"Is the ""I'm a singer"" in reference to that girl who had a vibe on her bed in a photo and said it's her microphone she's a singer?","The comment expresses curiosity and a positive interpretation of the singer's identity, indicating interest and a potentially favorable view."
Positive,The video vibe is awesome,The use of 'awesome' clearly indicates a positive emotional response to the video's atmosphere.
Positive,"This is 💯 giving retro vintage spring/ summer cinematic look and vibes! Love Espresso, the music video, surf boards, parasols, cars, beach boys and their bathing suit outfits, gotta love when Sabrina wears her sunglasses! One of the most iconic legendary pop albums/ eras of 2024 and beyond! Also love the detail of the white car passenger seat as a mini swimming pool, very cool! 😍😘🥰🤍👑⚜️💎🏆🫶🏻📺🎥👏🏻 🤩 👙 ☂️ 🏖️ 🎵 🎶 📝 🚤 ☕️ 😎 ☀️ 🍦 🤎 🩶 🖤","The comment expresses overwhelmingly positive feelings about the music video, praising its aesthetic, details, and overall impact."
Positive,I love Sabrina Carpenter she is my favorite she gives me Summer vibes 🤩🤩🤩❤❤❤❤😜😜,The user expresses enthusiastic love for the artist and uses overwhelmingly positive emojis and phrases.
Positive,Barbie🎉🎉🎉VibeZzz,The excessive use of celebratory emojis (🎉🎉🎉) indicates a positive and enthusiastic reaction to the music video.
Negative,The worst song ever in the worled,The comment expresses strong disapproval and uses negative language ('worst') indicating a negative sentiment.
Positive,Tonight – Chill Vibes to End Your Day | Zay Quo X,"The comment describes the video as 'Chill Vibes,' indicating a positive and relaxing experience."
Positive,90s vibe ❤🎉❤,The use of heart emojis and celebratory exclamation marks indicates enthusiastic enjoyment of the video's nostalgic atmosphere.
Positive,"I love the beat and voice, but not the lyrics 😅",The user expresses affection for the music's elements (beat and voice) despite a reservation about the lyrics.
Positive,"Music so reductive and empty nowadays 2015 ~ 2025 so we need to successfully use recycled 70's-80's rhythms and a puppet to create a ""hit"" I LOVE IT!",The commenter expresses enthusiasm and approval with the phrase 'I LOVE IT!' despite initial criticism.
Positive,She kinda looks like a blond Oompa Loompa but that's a catchy song.,"The comment uses positive language ('catchy song') alongside a playful, non-critical comparison, indicating a favorable opinion."
Positive,Vintage vibes 😉,The winking emoji and the phrase 'vintage vibes' indicate a positive reaction to the music video.
Positive,Dieses Lied gibt mir die härtesten Sommer Vibes ich liebe es,The commenter expresses enthusiastic enjoyment and describes the song as providing 'hardest summer vibes' indicating a positive sentiment.
Positive,China #1 is based off this beat I guess?,"The comment expresses approval and appreciation for the beat, indicating a positive sentiment."
Positive,Im 35. This song gets in my head. Not from vocals. All music.,The commenter expresses a positive reaction by stating the song
Positive,"I’m so sorry Sabrina!!! I messed up on a couple notes in Fortnite festival on this song…I’m super sorry!!!! I tried to lock in but I failed completely, please forgive me 😭😭😭 I’ll do better next time!","Despite admitting a mistake, the commenter expresses remorse and a desire for forgiveness, indicating a positive overall tone."
Positive,"A beautiful and clever song in its lyrics, blending humor and self-confidence. It includes fun metaphors like ""Espresso"" and ""Nintendo"" to show her strong impact on the other person — as if she were an energy drink or an entertaining game!","The comment expresses enthusiastic appreciation for the song's creativity, cleverness, and positive impact."
Positive,I'm getting a Doja Cat vibe!!! Love it!!! Keep turning it up Sabrina!!!  Your song is HOT!!!! 👍❤️🔥🔥🔥🔥🔥,The user expresses enthusiastic approval with multiple positive emojis and phrases like 'Love it!' and 'Your song is HOT!'
Positive,Dua Lipa could have sang this. Bruno Mars vibes too,"The commenter expresses a positive comparison, praising the song's similarity to Bruno Mars and suggesting Dua Lipa could have performed it."
Positive,Yoooooo I had to pull up the song and I can see the confusion. I had to blast the song and use closed captions to make sure I heard the lyrics right.,"The commenter indicates they enjoyed the song and used supplementary features to ensure comprehension, suggesting a positive experience."
Positive,Anybody else hear Doja Cat vocals on this track or it’s just me?,"The comment expresses a positive reaction by asking if others also hear a specific, desirable element in the song."
Positive,When the synth drops,The exclamation indicates excitement and enjoyment of the musical element.
Positive,All time I just watching the lyrics 😂😂,The use of ' 😂😂' indicates amusement and enjoyment of the music video.
Positive,Sabrina is the reqson why Preppy vibes still live,The comment expresses a positive sentiment about 'Sabrina' and the 'Preppy vibes' associated with her.
Positive,Summer vibes 📅😊,The use of 'Summer vibes' and the smiley emoji clearly indicate a positive sentiment.
Positive,Why this song is very vibee ❤,The use of 'vibee' and the heart emoji clearly indicates a positive emotional response to the music video.
Positive,Cute like the vibe soo much,The comment expresses a positive feeling about the video's aesthetic and overall vibe.
Neutral,"She's trying so hard to be Dua Lipa. Breathy Voice, Disco Pop Funk. Meaningless lyrics. Catchy though.","The comment expresses mixed feelings, acknowledging a resemblance to Dua Lipa while also criticizing the lyrics, leading to a balanced assessment."
Positive,"❤this song, such a summer vibe! Keep up the grind Sabrina. She's so adorable!",The comment expresses enthusiastic support and positive feelings about the song and the artist.
Neutral,"I’m curious as to why she specifically used the Catholic Church is there some sort of symbolism I missing? Could not have filmed this at a Christian church. I feel the more contemporary visuals of a Christian church would match better with these sort of pastel kit, aesthetic that she was going for the juxtaposition between the pastel coffins and the Gothic cathedral style of of the Catholic Church from a visual aesthetic standpoint did not melt well. That’s why I’m asking if there’s some sort of symbolism that I’m missing?","The comment expresses curiosity and a thoughtful critique, but doesn't convey explicit positive or negative emotion regarding the video's choice of setting."
Positive,Cool vibrant vibey song,"The use of words like 'cool,' 'vibrant,' and 'vibey' clearly indicates a positive reaction to the song."
Negative,This shit sounds so generic,The use of 'shit' and the description of the music as 'generic' indicates a negative opinion of the video's sound.
Positive,"woooow I love the music, the rhythm of this roal, I love Sabrina 💝","The commenter expresses enthusiastic love for the music and the artist, indicating a positive sentiment."
Positive,I’m edging to this beat,The use of 'edging' in this context indicates a positive enjoyment and attraction to the music's rhythm.
Positive,Vibes back when the coke was pure,"The comment expresses a nostalgic and pleasurable feeling associated with 'pure coke,' indicating a positive sentiment."
Positive,"I like to think based purely on the lyrics that she is not using the boy, but genuinely finds his loyality cute and loves him",The comment expresses a positive sentiment regarding the artist's feelings and admiration for the subject of the song.
Positive,"SO DANG CATCHYYYYYYYYYY IM GOING CRAZYYYYYYYY! Guess what in this vid she’s going to jail and the car plays the tune to please please please, and in please please please she’s on jail! Who knew 👇🏾👇🏾","The user expresses enthusiastic excitement and enjoyment of the song's catchiness, indicating a positive sentiment."
Negative,"Beat is awesome, she is cringe af","While acknowledging the 'awesome' beat, the phrase 'cringe af' expresses strong disapproval and negative sentiment."
Positive,The effects of the video were very nice 🤎,The use of the smiley face emoji and the positive adjective 'nice' clearly indicate a positive sentiment towards the video's effects.
Positive,"Hot and not vulgar, and pretty chill catchy sound, nice.","The commenter uses positive adjectives like 'chill,' 'catchy,' and 'nice' to express their enjoyment of the music video."
Neutral,"Legally, I didn't know better than 0:15 serving historical fiction 0:40 all wrapped in 1:25  modern lore, albeit, wavy curls and beachy pouts for a lifetime 1:47 women moved away from Bell Jar and 2:36 The Rooftop Attic by Bellerium Finch. #LAvibes #SAlowdown","The comment primarily describes elements of the music video and references other works, lacking explicit emotional expression."
Positive,Im getting a summer C.K vibes💯💥💣,The use of emojis and the reference to 'C.K vibes' suggests a positive association with the music video.
Positive,It is give SLAY VIBES!!!❤,The exclamation of 'SLAY VIBES!!!' and the heart emoji clearly express enthusiastic approval.
Positive,"this is how u do it pop stars, take notes",The comment expresses enthusiastic approval of the artist's performance.
Positive,"The Beatles songs ""HELP!"" And ""From me to you"" are definitely my top picks!",The commenter expresses enthusiastic approval by stating the songs are their 'top picks'.
Positive,This is the best of sabrinas lyrics shes good,The comment expresses strong approval and praise for the artist's lyrics.
Positive,sabrina its beatiful,The commenter expresses approval by describing the music video as 'beautiful'.
Positive,This song gives the vibe of barbies and ken❤,The use of 'barbies and ken' and the heart emoji indicates a positive association with the song.
Positive,Next level vibe,The phrase 'next level vibe' expresses enthusiastic approval and admiration for the music video.
Neutral,YEAH I...I PUSHED THE WHOLE TEAM ACT LIKE 3 (SOME RANDOM LYRICS) OH THIRD PARTY 1 13 SOMEONE COME GET ESPRESSO,"The comment appears to be a series of disjointed reactions and phrases, lacking clear positive or negative sentiment."
Positive,It has that old pretty girls vibe. She's like Monroe 😮,"The comment expresses a positive opinion, comparing the artist to a classic and admired figure, accompanied by an emoji indicating excitement."
Negative,No music...no catchy tune... Just show off... Disappointed,"The comment expresses disappointment and criticism of the music video, indicating a negative sentiment."
Positive,"It's giving ""stars are blind"" vibes...",The comment expresses a positive association by referencing a well-regarded song and comparing the music video's aesthetic to it.
Positive,This song is so satisfying in summ and its gives summer vibes,"The commenter expresses pleasure and positive association with the song and its effect, using words like 'satisfying' and 'vibes'."
Positive,im just tryna catch a vibe,"The comment expresses a desire to enjoy music and a positive feeling, indicating enjoyment."
Positive,Expertly crafted song. I am fascinated by how it came about. Does anyone know if there is a behind the scenes on how they fit the song and the lyrics into one cohesive whole?,The commenter expresses fascination and admiration for the song's creation and execution.
Positive,Mad Beatz Mad Jamz Thank you ❤❤,The use of heart emojis clearly indicates a positive feeling towards the music video.
Positive,Beat song I’ve heard In 2024 except for rap god,The comment expresses a positive opinion by comparing the beat favorably to a respected artist (
Neutral,Poor vocals but too catchy to pass up,"The comment expresses a mixed sentiment, acknowledging a negative aspect (poor vocals) while also admitting enjoyment of the song's catchiness."
Negative,One of the worst song considering toxic feminism 🤡🤡🫵,"The comment expresses strong disapproval and uses derogatory imagery (clown face, red hot face) indicating a negative sentiment towards the song and its perceived themes."
Negative,god this is awful 😂,The use of 'awful' and the laughing emoji clearly express a negative sentiment towards the music video.
Positive,Like the late 1960s vibe,The comment expresses a positive appreciation for the video's stylistic influence.
Positive,David Archuleta just released Crème Brulé and i think its very similar to this. Both have got sexy beats though,"The commenter expresses a positive opinion by noting the 'sexy beats' of both songs, indicating enjoyment."
Positive,80s vibe get me every time....omg,The exclamation and enthusiastic description of an '80s vibe indicate a positive reaction.
Negative,I like the beat it makes me happy at 3am which is when   I'm scared,"Despite expressing enjoyment of the beat, the phrase 'when I'm scared' indicates a negative emotional association."
Neutral,i dont like the song but the video clip is a very nice vibe,The commenter expresses a dislike for the song but acknowledges a positive quality (vibe) within the video itself.
Positive,0:16 my fave chorus,"The commenter expresses enthusiasm and affection for the chorus, indicating a positive sentiment."
Positive,"Such a vibe!. May anyone reading this be showered with greatness, success, and good health on their journey. Keep shining bright! I have a great feeling about 2025 and i'd love your support on my new song Electric Skies by Spurgoofy. Thank you for believing!","The comment expresses enthusiastic praise and well-wishes, indicating a positive sentiment."
Negative,Really why some one Sleeps aww N every one make's it worst,"The comment expresses frustration and annoyance with the situation, indicating a negative sentiment."
Negative,The most generic crap I've ever heard. Even her name is generic lmao,"The comment expresses strong disapproval and uses derogatory language ('generic crap', 'lmao') indicating a negative sentiment."
Positive,"Eii!! Jesus te Ama Muito ❤️Ele não vai desistir de Você 🥰Volta Para Ele !!!RESTA POUCO TEMPO!❤️✝️ ELE NÃO BUSCA PERFEITOS ADORADORES, MAS PECADORES ARREPENDIDOS E DE CORAÇÃO SINCERO QUERENDO MUDAR❤️","The comment expresses fervent love and encouragement to return to a relationship, indicating a positive emotional state."
Positive,"I still vibe with the ""we the Chinese #1""","The commenter expresses enjoyment and continued connection with the song, indicating a positive sentiment."
Positive,the song gives me summer vibes,"The comment expresses a positive feeling and association with the song, linking it to a desirable experience (summer vibes)."
Positive,"anyone else noticed that this dance, the whole vibe, and the hair, is very much like Hannah Montana the movie in first song best of both world? So maybe she created a real life hanna montana? 🤭","The commenter expresses a positive comparison to a beloved film, indicating enjoyment and a favorable impression."
Positive,The retro 90s vibe people crazy  miss the old Time golden era,"The comment expresses nostalgia and fondness for a 'golden era,' indicating a positive feeling about the music video's aesthetic."
Positive,This gives sweet vintage summer vibes Sabrina could restore life OMGGGG,"The enthusiastic use of 'sweet,' 'vintage,' and 'OMGGGG' clearly indicates a positive emotional response to the music video."
Positive,It’s giving like summer vibes,The phrase 'giving summer vibes' expresses a positive association with the music video.
Positive,I had no idea that was her playing  on the system at work. I figured one of the teenagers put it on but it was catchy. I had no idea what she was saying though lol.,The commenter expresses enjoyment of the song (
Positive,Getting a lot of watermelon sugar video vibes,"The comment expresses a positive comparison to a popular and well-received song, indicating a favorable opinion."
Negative,"Yikes. Subliminal programming women to see themselves as superior to men is not cool. Racemixing... What else can I find in this video? Ah yes, multiple partners, because that's what makes a person happy.","The comment expresses strong disapproval and criticism of the video's themes and content, indicating a negative sentiment."
Positive,"The most important part of this song for me  is beginning, because you can set as a ringtone",The commenter expresses a positive preference for a specific part of the song and suggests its suitability as a ringtone.
Positive,vibe only fan,The comment expresses enthusiasm and appreciation for the 'vibe' of the music video.
Positive,SUMMER VIBESS,"The comment expresses a feeling of happiness and enjoyment associated with summer, indicating a positive sentiment."
Negative,Bridge has 0 connection to the chorus,"The comment expresses dissatisfaction with the music video's structure, indicating a perceived flaw in the song's arrangement."
Positive,90210 vibes,The comment evokes a nostalgic and positive association with the popular TV show *90210*.
Positive,"My name is Derek Evan from Brooklyn, New York. Many people know by the way that I talk. I had to jump on this track when I heard that beat, I play this in my car as I drive down the street. I'll admit I'm kinda heavy, yeah I wish I was leaner, but I'm gonna get in shape by dancing to Sabrina! Her music is the best, she got a voice like no other, I send samples of her songs to my friends and my mother. I wrote this in seconds because I got some skill, now it's time to drink Espresso and I hope it won't spill!","The commenter expresses strong positive feelings about the music and artist, highlighting enjoyment and enthusiasm."
Positive,kylie vibes and I´m still here for it,The commenter expresses enthusiastic support (
Positive,Well the lyrics says someone got daddy issues 😍,"The use of 'daddy issues' is presented in a somewhat playful and relatable way, suggesting a positive connection with the song's theme."
Positive,"I Think Credit Goes to the Vocal Quality She Produces Light ,sweet and Beautiful❤❤","The commenter expresses admiration for the vocal quality, using positive adjectives and emojis."
Positive,"The vintage vibes are strong, and that little teaser has me hyped for what's next! Happy birthday, ""Espresso""—still on repeat a year later!","The commenter expresses excitement and fondness for the music video, indicating a positive emotional response."
Positive,We need doja cat on the remix she would eat this beat up fr,"The commenter expresses a desire for Doja Cat's involvement, indicating a positive reaction to the beat and its potential."
Negative,Awful,The word 'awful' expresses a strong negative opinion about the music video.
Positive,Que essa Vibe acalme os corações em Guerra!!! 🎵🎵🎵🎵🎵⭐⭐⭐⭐⭐🌻🌻🌻🌻🌻🌻🌻🌻🌻🌻🌻🌻🌻🌻🌻🌻🌻🌻🌻🌻🌻🌻🌻🌻🌻🌻🌻🌻🌻🌻🌻🌻🌻,The comment expresses enthusiastic enjoyment and positivity through emojis and a celebratory tone.
Positive,"Good song.  It feels like a fusion of Goldroom's ""sweetness alive"" & DoJo Cat's ""say so"".  Got a real chill psychedelic summer vibe.",The commenter expresses enjoyment and describes a positive association with the music’s sound and mood.
Positive,This song will never be forgotten for the vibes..😂,The use of 'vibes' and the laughing emoji indicate a positive and enjoyable reaction to the music video.
Positive,Song lyrics: mahi ve tu itna sona hai mera manmona hai tu mera hona hai... 😂,The use of '😂' (laughing emoji) indicates amusement and enjoyment of the lyrics.
Positive,"This whole vibe is so effortlessly cool, and that teaser has me counting down the seconds until the next release!",The commenter expresses enthusiastic excitement and admiration for the music video's atmosphere and anticipates future releases.
Positive,"The lyrics of this song makes no sense. Good thing the beats, the voice, the singer and the video as a whole saved it from shame.","Despite the nonsensical lyrics, the commenter expresses appreciation for the positive aspects of the music video."
Negative,"This is really generic, gonna pass","The comment expresses disappointment and criticism, using the word 'generic' which indicates a negative opinion of the music video."
Positive,Sabrina carpenter Love you too name is Edwin stone 30 love you too,"The user expresses affection and support for the artist, indicating a positive sentiment."
Neutral,This song is the most annoying thing I've ever heard. But somehow i like it.,"The comment expresses both strong dislike ('most annoying') and a surprising positive feeling ('somehow i like it'), indicating mixed sentiment."
Positive,Chill vibes!!,The exclamation point and phrase 'chill vibes' express a feeling of enjoyment and relaxation.
Neutral,ChatGTP Lyrics tho,This comment simply states a lyric reference and doesn't express a positive or negative opinion.
Positive,Ariana Grande's vibes,The comment expresses a positive appreciation for Ariana Grande's style and music.
Positive,Heard this at the gardens brothers circus. It’s very catchy n thanks to Siri for finding it 😂,"The commenter expresses enjoyment and gratitude, indicating a positive sentiment about the music video."
Positive,It’s giving summer vibes fully  bc of the beach❤,The comment expresses a positive feeling about the video's atmosphere and uses emojis to reinforce this sentiment.
Positive,I literally love Sabrina Carpenter!!! Her music is super catchy and her voice is so calming!,"The comment expresses enthusiastic praise for Sabrina Carpenter and her music, indicating a positive sentiment."
Negative,"But the lyrics should be ""Mi amore, espresso por favore""..... Is it the wrong song?","The comment expresses confusion and a critique of the song choice, indicating dissatisfaction."
Positive,"This vintage vibe is everything! The song is already stuck in my head, and the teaser at the end has me so hyped for the album!",The comment expresses enthusiastic excitement and a positive feeling about the song and upcoming album.
Positive,Shania Twain vibes?,"The comment expresses a positive comparison, associating the music video with a well-regarded artist (Shania Twain)."
