comment,user_name,date,likes
"I can’t help but read the lyrics and associate the words/stories to Ariana grande’s personal life. I know she’s over ppl doing that but it’s automatically happening. At least since it’s the 1st time I’m heading it so I’m really paying attention, but after this I’m just going to be vibin to the tracks I like for the sake of liking music",@itstonycia,2024-03-08T05:48:08Z,0
"ETERNAL CRYING"" for my part, SO MUCH TEARS SO EMOTIONAL I LOVE U. We missed your angel voice",@NourNasser-s1t,2024-03-08T06:59:42Z,0
This sounds like a Steven Universe song,@julienossola,2024-03-17T16:49:17Z,0
beautiful voice and melody,@daolsemusic,2025-03-16T11:01:22Z,0
"you use my voice and my mastering for the distributed version without responding to my hello on insta. You know only my friends can make money from my job but you ghost my hello and happy birthday after 6 years you ghost me you continue to hack my pc for robbed my voice and my mastering without hello and contract signed to do business. Please delete all my work on 7rings/stuck with you/34+35/positions/santa tell me/all tracks eternal sunshine Dj scrog remix to help you get back. now you and Mariah Carey are my enemy, you are not allowed to use my voice and my mastering for the buisness version because you never respond to my hello. you know I'm not interested by your money after 6 years, I help you for you  Mariah's feat and your musical arrangement. you are killing our love for no, hello now i hate you. you kill my love for you goodbye forever. eternal goodbye",@alien13or,2024-05-21T10:10:29Z,0
I get Mac vibes from this in a nice way. Like he would’ve had his own version of this or that he would’ve liked it. Something about the way she enters with an “mm” and the contemplative honesty.,@fluffyclouds555,2024-03-08T08:19:04Z,0
THE LYRICS THE MUSIC THE FEELS THE EMOTION IS ALL SO OVERWHELMING I M IN LOVEEEE😭❤️❤️❤️❤️❤️✨✨💎💎💎,@akshya.r9423,2024-03-08T17:33:48Z,0
Gives me old Disney vibes,@itsthicgravy,2024-10-29T17:43:19Z,0
"ariana do céu, que coisa mais linda! que vocal mais angelical, que vibe! 🥹🥹🥹",@amouretmiel,2024-03-08T09:18:06Z,0
Legendary!! The lyrics... omg!,@synonymrollll,2024-03-12T16:06:52Z,0
Thanks universe! Thanks Ari,@TeacherV1tor,2024-03-08T13:10:00Z,0
"wow her voice is so pretty here!!! I love the lyrics at the beginning too, cause man that's what I be thinking too!",@tionnewalzier1832,2024-03-08T05:16:21Z,0
Essa é a música que toca na minha cabeça toda vez que eu estou em um ambiente confortável e friozinho KSKSKSK muito vibe de lar,@thalinecristiana8409,2024-10-13T21:05:08Z,0
Emotion,@Jojoo_oficial,2024-03-08T05:47:23Z,0
"Listening to the chorus, I'm thinking so much everyone!!!",@TrungĐặng-k6v,2024-03-15T02:29:07Z,0
"omg, I'm really crying, after waiting so long, he feels emotional and his voice is so beautiful 💖",@InEternalSunshine_06,2024-03-08T05:33:08Z,0
"the letters, vocal, JUST EVERYTHING 😭💘",@edmundgf,2024-03-08T05:30:40Z,0
"""Wow, Ariana Grande never fails to amaze! Her latest song is an absolute masterpiece 🎶💫 Her vocals are simply stunning, and the melody is so catchy. She continues to raise the bar with each new release. Ariana, you're a true queen of pop! 👑💖""",@ViralTubeezeee,2024-03-08T05:30:28Z,0
"This is exactly the vibe that I wanted, simply amazing",@OhSnapItsAndie1,2024-03-08T05:19:44Z,0
"OH MY GOD THE LYRICS OF THIS SONG ARE LIKE THE ONES IN ""BEST MISTAKE""!!!!!",@agrat1386,2024-03-08T05:10:25Z,0
jhene aiko vibes and love it,@thebrissdiaries,2024-03-09T08:58:50Z,0
Ari youre the beat i love u soooo,@gladyscastellanos557,2024-03-08T05:04:17Z,0
Ariana never disappoint with her vocals or her songs 🔥,@natoriaannikey2,2024-03-08T05:03:11Z,0
0:53 all hail this chorus,@melizalopez6130,2024-03-10T11:38:43Z,0
the vocal of this girl omg 😩😩😩 she have the best voice,@edmundgf,2024-03-08T05:30:12Z,0
