comment,user_name,date,likes
"y'all i'm blessed, like the lyrics? the harmonies?? the melody? nah this sounds so damn good😭🫧 worth the wait, she never disappoints us",@eee023,2024-03-08T05:26:32Z,3288
"omg this is literally so fucking perfect the layering, the theme, the lyrics, the melody, the VIBEEE",@ukumax1,2024-03-08T05:23:47Z,1798
0:52 this verse…her voice is absolute PERFECTION i can’t stop replaying,@hanalei7177,2024-03-08T05:47:37Z,655
The more I listen back to this album the more deeply beautiful and layered I realize it is. Ariana’s talent ceases to amaze me.,@janahamilton3,2024-03-10T03:54:02Z,642
i absolutely adore this track - it has such a nostalgic and sweet feel to it. loved the strings. i wish it was longer because it’s my fav from the album 🥲,@alexanderjamierailton,2024-03-08T07:25:19Z,230
"She didn't disappoint ❤ This album is full of gorgeous vocals, stunning production, great lyrics and beautiful symbolism",@kerchelle95,2024-03-08T06:05:23Z,184
"The last lyrics gave me such chills.... It's definitely one of her strongest albums, the messages are all so powerful and sometimes very hard to admit to yourself. I'm so proud of you Ari, you've definitely come far. This is just the beginning, I can feel that this is a liberating era. I'll always be there to support you♥",@plipplop5747,2024-03-09T15:08:57Z,168
"this is definitely her BEST album she has ever released. her voice / her vocals on one of the rest of her songs is unmatched ! she can really sing her ass off. her voice is so very beautiful, powerful, heavenly, angelic & magical. she’s definitely the blueprint, the queen of pop, the standard in our generation !!! this album is gonna be my personality therapy for the rest of my whole entire life. she really put her whole entire heart & soul out on this beautiful & special & healing album. this is absolutely giving me sweetener, thank u, next & dangerous woman vibes all over again & how does she manage to keep improving her voice / vocals over the album. her voice / her vocals really has been improving so much throughout the years. this album was so very deep, so touching, so emotional, so special, so authentic, so real & so raw. her talent is really crazy & sick. when i was listening to this album, i was in my bedroom crying my eyes because this is absolutely her best album she has ever produced & released.",@staciaallen3330,2024-03-08T05:07:06Z,126
"The lyrics kind of overwhelmed me, and the ending left me hanging. It's so short, but too much GOOSEBUMPS ARI I LOVE YOU LOVE YOU LOVE YOUUUUUUUUU🥹✨",@sharpay20,2024-03-08T07:49:55Z,93
"This whole album feels like a diary.. the lyrics are so personal, the sound is very delicate, soft, ethereal.. Just what a beauty sounds like 🤍",@blueberrydreams2178,2024-03-08T09:54:08Z,36
"i just finished with the album and i just wanna say thank you, it was a rollercoaster of emotions– heartbreak and healing. anyone can relate to this body of work whether it be from a romantic, platonic or familiar point of view. genuinely your BEST and i love it so much, i cant express this journey was from seeing you on television as a child and now as an adult being able to appreciate you as a TRUE ARTIST.",@bluuchandesu,2024-03-08T19:11:40Z,22
*these lyrics are so real.*,@skyylovespace,2024-04-27T05:11:48Z,20
"i’ve missed this feeling so much, always saved me from the worst ✨☁️ 1:12",@m4d3lyn-ar4nd4,2024-03-08T05:44:49Z,13
"I love how soulful the melodies are throughout the album, eternal sunshine truly comes from eternal peace within ✨️ 🧡",@nostalgiaisaknife,2024-03-08T05:47:21Z,12
no matter how much of a vocaloid jpop fanatic ill be ariana grande will always have a special place in my heart,@kitsuneteto,2024-03-08T12:16:22Z,12
"“when u hear this special melody after a period of listening,u will be able to remember and start singing the amazing song as if it is stuck in your mind.u can't come out how wonderful this album is”",@merilortega,2024-03-09T06:02:13Z,10
wtf this just made me cry the music and vocals they're so powerful wtf,@m1mi.nunelse,2024-09-12T20:14:56Z,8
"“IF THE SUNNN REFUSED TO SHINE, BABY WOULD I STILL BE YOUR LOVER?!” - best lyrics I’ve actually ever heard",@MonaMae-vb4br,2024-04-02T22:57:31Z,6
"I’m in a school shuttle sobbing to this MASTERPIECE. This is the best intro ever! The first verse is insane, but emoting.😢",@Dyce-Emrys,2024-06-14T14:37:22Z,6
This song is too levitating the intro is epic its exotic and it's the sweetest melody ever😩🥺😭💖🫀i love u Ariana ❤❤,@Zioravebaby,2024-05-07T23:14:25Z,6
This is the best intro ever ❤ the melody. The gorgeous vocal ❤ the meaningful lyrics. Ugh. My top 3 right now ❤,@Loislaulife,2024-03-08T12:41:58Z,5
The worst part about this song is that it's only ONE MINUTE long. I wanted more! 😭,@jourdondynamo,2024-03-08T13:54:04Z,5
I literally know all the lyrics to this song because I listen to it so much!! ❤❤❤❤🤩🤩,@Bry6212,2024-04-29T10:09:00Z,4
Esse albun É tão relaxante e passa uma vibe de conforto ❤❤,@jaiane_carv,2024-03-08T12:29:52Z,4
"First time ever Ive listened whole album and Ive felt very emotional,excited.I cried .This album fire",@jaxongirsherbekov2290,2024-03-08T05:39:34Z,4
this song is so deep<3,@hedgingwell7718,2024-05-04T01:49:19Z,4
Ariana girl we need a full song of this! how can you let this nostalgic masterpiece be 1 minute long,@excus,2024-04-24T08:04:59Z,4
this song has its own vibes. i like this song,@aaiiuueeoow,2024-03-30T13:47:27Z,3
Gives me such nostalgic energy! 🥹,@ariana.dreams,2024-03-09T00:03:16Z,3
Please keep this album safe from tiktok music. The soft vocals in this album are serving GOOD,@pim0n,2024-03-08T07:53:08Z,3
Ariana is prolly the best vocalist of the generation❤❤❤,@Jamal-c3x,2024-12-16T22:17:49Z,3
I'm genuinely emotional like I am crying. This is her best album intro. Give her a grammy for real ❤🥹 I love this album so so much,@eternalsunsh,2024-03-08T05:01:44Z,3
"Why does this song make me feel sad like nostalgic, i just got here😩",@JESUSCHRIST-u9u,2025-03-13T23:37:17Z,3
This song is so emotional and I think this is gonna be her best album. It really shows her emotional side and how far she came. Perfect song to cry  to when your seperating from your loved ones in school.,@kaitlynsingh2415,2024-05-06T01:34:26Z,3
THE LYRICS ARE EATING RIGHT NOW,@essenceclo,2024-03-08T07:02:43Z,3
the intro is already emotional 😭 howww,@PereiraMatau,2024-03-08T05:51:30Z,3
emotional asf,@haradjik,2024-06-17T08:51:43Z,2
MANO ESSA MERECIA MAIS TEMPO!!!!!!!!!,@Desconhevido,2024-03-08T05:25:21Z,2
"Honestly I hate how good this song is yet they couldn't make it into at least 3 minutes with another verse, chorus and bridge, heck even outro. Like it's so disappointing. Didn't the producers know how golden this melody was and just decide to NOT extend it? Did the writers run out of words?? Ahhh Ariana whyyyy😭😭😭😭",@laura79613,2025-01-27T11:57:25Z,2
"Looove this song, this whole album is amazing!,  its absolutely delightful  the microseconds of samples, ( like this one, with a microsecond  of Björk's voice) or the interpolations in other tracks or the references to films, theater, pop culture, Madonna, Mc Miller, her fans, herself. This is her first album that make me think of her as a real artist more than a trending pop star. Thanks to everybody involved in this album, producers, art directors, master and mixing engineers, of course Ari, thank you for such a masterpiece!  ps. Hope to see you as headliner (again) at Coachella 2025 :D",@ramonriKo,2024-03-14T06:58:47Z,2
mampir kesini karena fyp ku lagu tiktok :V ini terus!! bagus bgt vibes nya,@ApidTan,2024-04-30T16:08:39Z,2
This masterpiece is giving me Moonlight vibes and both of them are track no.1 too ❤❤❤❤❤❤❤,@Koko_critic,2024-03-09T22:28:04Z,2
10/10 the vibe,@narinsakpromwongsanon8138,2024-03-08T11:26:12Z,2
I am in love with the whole Album its  has so many emotions ｡˚❀♡,@Ivy-peaches-,2024-03-15T19:38:37Z,2
The song is so good and the lyrics don’t sound like the lyrics,@sreypichsoun5169,2024-05-27T11:59:08Z,1
"She is  so talented, she put sooo much emotion in 1minuite and 32 seconds, Talk about Legend. This should be a crime LOL!!😅",@EstherYusuf-fp9cq,2024-03-31T12:29:57Z,1
Plss ariiii make a longer verse im always listening to it 🩷🩷,@J_Flowerzzz,2024-08-17T14:50:45Z,1
BEST SONG LYRICS EVER PUT TOGETHER,@babydriverkermit,2024-07-11T11:07:58Z,1
"How can she always deliver....the vocals,the music...im in awe...",@mckyee2002,2024-03-13T17:07:22Z,1
why why this thw most beautiful lyrics i heard,@PatrickAlexisNacar,2024-07-16T04:06:07Z,1
I STARTED CRYING DURING THIS 😭😭😭 Ariana this intro is BEATIFUL!,@saffiregoat6432,2024-03-08T05:53:37Z,1
The Melody is so Mac Miller coded 🥺🥺🥺,@stessi6532,2024-03-11T06:01:56Z,1
Jeromy Maurice Green Unlimited Stadiums full of all the money in the universe unlimited multiple times unlimited multiple times 💚💚💚🪄🪄🪄🪄🪄🪄🪄🪄 unlimited magic psychic future,@JeromyGreen-o9m,2024-08-30T20:52:36Z,1
My top song so far this year! Definitely could’ve been a full song!!! Those lyrics 😮‍💨,@meghan8582,2024-03-09T09:38:08Z,1
YAYYY!! Ari girl you blow me away every time im in love with this melody😭🩷,@emilylarimore,2024-03-08T05:04:06Z,1
ramadhan vibes,@FahriRamadhan-wm2hx,2024-11-23T02:47:30Z,1
Idk but it's giving xmas vibes. Who's with me?,@ViewLateAndMint,2024-03-08T16:30:36Z,1
Omg I'm gonna cry the lyrics are so sweet 😭😭😭,@NefarAphrodite,2025-02-03T07:37:37Z,1
the way the melody and her voice made me feel and smile... omg it's inexplicable,@muugiwaaraaa,2024-03-08T05:15:57Z,1
"Ari sings the song and Arianators feels the song, Ari raises her vocals and  arianators levitate in the vastness of vocals, Ari laughs and Arianators Smile and giggle, Ari joys and Arianators enjoys 🥹❤️ Ari this is amazing, thank u from my bottom of my heart 💋🌞☁️🫧",@Farhaan_Legion,2024-03-08T05:14:28Z,1
A lot of emotions in this songgg🥺😩,@janat4715,2024-03-14T18:15:27Z,1
"Is it just me, or does ""I still be your lover"" remind you of the melody of a famous song? Can you hear it too?",@viniciusbarboza5220,2025-01-19T16:38:50Z,1
"you use my voice and my mastering for the distributed version without responding to my hello on insta. You know only my friends can make money from my job but you ghost my hello and happy birthday after 6 years you ghost me you continue to hack my pc for robbed my voice and my mastering without hello and contract signed to do business. Please delete all my work on 7rings/stuck with you/34+35/positions/santa tell me/all tracks eternal sunshine Dj scrog remix to help you get back. now you and Mariah Carey are my enemy, you are not allowed to use my voice and my mastering for the buisness version because you never respond to my hello. you know I'm not interested by your money after 6 years, I help you for you  Mariah's feat and your musical arrangement. you are killing our love for no, hello now i hate you. you kill my love for you goodbye forever. eternal goodbye",@DjScrog,2024-05-21T11:18:54Z,1
"The tone, vibe and the meaning touched my heart. I don't know exactly what she wanted to share with the listener, but it can't get out of my mind.",@oannhung8903,2024-03-28T17:06:47Z,1
this song gave me Mac Miller vibes🥹,@KarinaRodriguez-wn4sb,2024-03-08T05:29:55Z,1
0:53 is the most beautiful lyrics,@SharinaDenisePedimonte-i1h,2025-02-15T03:07:19Z,1
The lyrics ❤❤❤,@Bhdp7406shd-yr2ji,2024-08-04T10:20:54Z,1
I'm a straight dude and good lord why isnt this longer. Her vocals and instrumentals are top tier as always.,@sansenemi,2024-07-31T02:27:05Z,1
WHAAAATT A MIN....🥺 wheres the rest of this song 😭 the vocals the harmonies are so POWERFUL here i need the rest immediately 😫,@brandonseay,2024-03-08T09:58:31Z,1
"i get inspired love,emotions like sadness,happiness,everything from you,Ari❤you are always beautiful both inside and outside. love from Japan🫶",@coffeemilk-f4p,2024-03-08T08:53:28Z,0
GUYS GIVE ME SONGS THAT HAVE THE SAME VIBES AS THIS ONE!!,@mxrielk,2025-03-31T13:35:31Z,0
"you use my voice and my mastering for the distributed version without responding to my hello on insta. You know only my friends can make money from my job but you ghost my hello and happy birthday after 6 years you ghost me you continue to hack my pc for robbed my voice and my mastering without hello and contract signed to do business. Please delete all my work on 7rings/stuck with you/34+35/positions/santa tell me/all tracks eternal sunshine Dj scrog remix to help you get back. now you and Mariah Carey are my enemy, you are not allowed to use my voice and my mastering for the buisness version because you never respond to my hello. you know I'm not interested by your money after 6 years, I help you for you  Mariah's feat and your musical arrangement. you are killing our love for no, hello now i hate you. you kill my love for you goodbye forever. eternal goodbye",@DjScrog,2024-05-21T11:17:51Z,0
"you use my voice and my mastering for the distributed version without responding to my hello on insta. You know only my friends can make money from my job but you ghost my hello and happy birthday after 6 years you ghost me you continue to hack my pc for robbed my voice and my mastering without hello and contract signed to do business. Please delete all my work on 7rings/stuck with you/34+35/positions/santa tell me/all tracks eternal sunshine Dj scrog remix to help you get back. now you and Mariah Carey are my enemy, you are not allowed to use my voice and my mastering for the buisness version because you never respond to my hello. you know I'm not interested by your money after 6 years, I help you for you  Mariah's feat and your musical arrangement. you are killing our love for no, hello now i hate you. you kill my love for you goodbye forever. eternal goodbye",@DjScrog,2024-05-21T11:18:43Z,0
One last time vibes with the lyrics,@eylulguvenc7775,2024-03-08T06:00:17Z,0
Worst song ever heard that,@NevsRain,2024-04-05T12:31:34Z,0
I have really missed this😭😭😭 I’m so emotional right now,@Sentlemolapoyt,2024-03-08T05:44:14Z,0
"THIS SHOULD BE LONGER THAN IT ISSSS!! however, gurl this album is unexpected, it got so many meaningful lyrics 😭 love it, thank you ari! We <3 you 🎀",@kekcawann,2024-03-09T06:55:19Z,0
"you use my voice and my mastering for the distributed version without responding to my hello on insta. You know only my friends can make money from my job but you ghost my hello and happy birthday after 6 years you ghost me you continue to hack my pc for robbed my voice and my mastering without hello and contract signed to do business. Please delete all my work on 7rings/stuck with you/34+35/positions/santa tell me/all tracks eternal sunshine Dj scrog remix to help you get back. now you and Mariah Carey are my enemy, you are not allowed to use my voice and my mastering for the buisness version because you never respond to my hello. you know I'm not interested by your money after 6 years, I help you for you  Mariah's feat and your musical arrangement. you are killing our love for no, hello now i hate you. you kill my love for you goodbye forever. eternal goodbye",@DjScrog,2024-05-21T11:18:32Z,0
moonlight vibe lowkey,@3ves,2024-03-08T09:45:06Z,0
Has old school ari vibes,@Pikelet12,2024-03-08T05:59:05Z,0
Lyrics plz!!!!,@Lovely.SilversTonE,2024-03-09T03:19:04Z,0
"you use my voice and my mastering for the distributed version without responding to my hello on insta. You know only my friends can make money from my job but you ghost my hello and happy birthday after 6 years you ghost me you continue to hack my pc for robbed my voice and my mastering without hello and contract signed to do business. Please delete all my work on 7rings/stuck with you/34+35/positions/santa tell me/all tracks eternal sunshine Dj scrog remix to help you get back. now you and Mariah Carey are my enemy, you are not allowed to use my voice and my mastering for the buisness version because you never respond to my hello. you know I'm not interested by your money after 6 years, I help you for you  Mariah's feat and your musical arrangement. you are killing our love for no, hello now i hate you. you kill my love for you goodbye forever. eternal goodbye",@DjScrog,2024-05-21T11:17:40Z,0
something about this intro reminds me of steven universe.,@abundancewithkiki,2024-03-10T15:55:41Z,0
Pluto Projector vibes.. 🌙 1:04,@generisme,2024-03-24T07:38:06Z,0
This song gives thank you next album vibes,@chairroofrat1572,2024-03-17T16:56:52Z,0
Omg her vocals gave me chills !!!!,@Miss_korneliaaa,2024-03-08T12:29:55Z,0
RAINDROPS YOU CAN GIVE THE CROWN OF BEAT INTRO TO END OF THE WORLD BYE😭😭♥️♥️,@nathanpyz,2024-03-08T08:30:36Z,0
"you use my voice and my mastering for the distributed version without responding to my hello on insta. You know only my friends can make money from my job but you ghost my hello and happy birthday after 6 years you ghost me you continue to hack my pc for robbed my voice and my mastering without hello and contract signed to do business. Please delete all my work on 7rings/stuck with you/34+35/positions/santa tell me/all tracks eternal sunshine Dj scrog remix to help you get back. now you and Mariah Carey are my enemy, you are not allowed to use my voice and my mastering for the buisness version because you never respond to my hello. you know I'm not interested by your money after 6 years, I help you for you  Mariah's feat and your musical arrangement. you are killing our love for no, hello now i hate you. you kill my love for you goodbye forever. eternal goodbye",@DjScrog,2024-05-21T11:18:05Z,0
The lyrics are too slow.......,@niko5347,2025-02-10T05:09:39Z,0
can’t get over how she sings the bridge of “if the sun refuse to shine” because it makes me so emotional abt the doubt and worries of not being enough for the person,@mirrorballtv,2024-03-29T20:43:13Z,0
Ouu this is so deep 😞❤️,@fncreations6286,2024-03-08T07:59:43Z,0
EMOTIONAL ALREADY ❤❤,@aurolexi,2024-03-08T05:08:30Z,0
"Just like thank you next, & positions, this album is gonna just as nostalgic to us in like 3-4 years. 😭❤",@kermitjewl,2024-03-08T15:59:39Z,0
Very beautiful vocals 😭❤️❤️❤️❤️❤️❤️❤️❤️❤️❤️❤️,@linnisvphiri9749,2024-03-08T08:12:53Z,0
THE MELODY😭😭😭😭😭😭😭😭😭😭✨✨✨✨✨✨✨,@Adventureswithsam333,2024-03-08T05:02:08Z,0
Anyone who this songs gives Tiana vibes??💗🫶🏻😭,@Stayverse,2024-05-11T18:04:38Z,0
This is so emotional 🥲,@norakodomsous5875,2024-03-08T05:04:52Z,0
Yours Truly VIBES! 💞❤️,@juanoliveira4736,2024-03-08T05:05:39Z,0
"I'm genuinely curious when exactly did music artists think that incorporating ""swear words"" into their lyrics somehow made it ""better?"" These little girls saying sh1t and fu@k and the like just sounds hilariously forced and juvenile as if a music manager woke up one morning and said ""by golly, the kids these days need you to sound 'gritty and 'street' so put on your lingerie and say ""sh!t"" and fu@k"" more often and that'll sell stuff!!!"" I grew up on Heavy Metal so it's not as if this sh!t is new but it's pathetic and transparently moronic. It's a true shame because Ariana has genuine talent, voice and looks but it's waisted by these imbeciles who run this business. You kids invented nothing.",@anthonyjames7532,2025-07-11T21:03:24Z,0
IM CRYING RIGHT NOW IM FEELING SO MANY EMOTIONS RIGHT NOW AND IT JUST THE BEGINNING,@FredySO14,2024-03-08T05:07:10Z,0
Why am I getting super emotional rn,@y_ourhaneul,2024-03-08T05:58:37Z,0
Linda perFEITA TE AMO MUITO ARIANA LINDA EU TE AMO DIVA ATEMPORAL,@deceasedweary,2024-03-08T05:11:20Z,0
how i love the vibes🤍,@ri.mmm770,2024-03-08T07:35:53Z,0
This melody and her voice.. Am i in heaven?,@mahnoorasif273,2024-03-08T05:23:41Z,0
Mac miller vibes,@Exploringwithjo,2024-03-09T18:50:59Z,0
WHAT IS THIS MELODY‼️🗣️,@anneboonchuy_,2024-03-10T12:59:08Z,0
"you use my voice and my mastering for the distributed version without responding to my hello on insta. You know only my friends can make money from my job but you ghost my hello and happy birthday after 6 years you ghost me you continue to hack my pc for robbed my voice and my mastering without hello and contract signed to do business. Please delete all my work on 7rings/stuck with you/34+35/positions/santa tell me/all tracks eternal sunshine Dj scrog remix to help you get back. now you and Mariah Carey are my enemy, you are not allowed to use my voice and my mastering for the buisness version because you never respond to my hello. you know I'm not interested by your money after 6 years, I help you for you  Mariah's feat and your musical arrangement. you are killing our love for no, hello now i hate you. you kill my love for you goodbye forever. eternal goodbye",@DjScrog,2024-05-21T11:17:25Z,0
Christians understanding revelation behind title and lyrics😶,@tanman8338,2024-03-12T19:02:55Z,0
THE LYRICS ARE SO POETIC IT’S INSANE,@dayeoniz,2024-03-08T07:38:16Z,0
"This girl is amazing , beautiful vocals ever , I lover her",@SiphoDamons,2024-03-10T11:13:59Z,0
The irony of the lyrics 😂 she know what she did thats why she feel guilty,@MichelleDelamatter,2024-03-17T16:28:52Z,0
"Ariana The song is really catchy, even though the song is almost 2 minutes long, it is very valuable to me, the most touching heartbreak song is someone's pleasure 🥺🥺",@mshafaaditya5912,2024-03-19T12:45:23Z,0
I love her voice and that melody,@F3RN4ND021,2024-03-08T08:39:04Z,0
"Love the intro for eternal sunshine, how the lyrics appear on the screen. 📝🤍 ♾️ ☀️ 🎶🎵👑⚜️💎🏆",@jazminratzlaff5357,2024-04-11T03:16:20Z,0
that nice nostalgic classicq ari,@rdctrinidad5018,2024-03-31T19:07:37Z,0
"Wonder if they know some people recognize the lyrics as Led Zeppelin's ""Thank You"" intro.",@cheyspencer,2024-05-16T13:47:01Z,0
The most beautiful vocals ever best intro I’ve ever heard,@Jennifer-zo5qj,2024-03-08T05:17:30Z,0
BEAUTIFUL ❤❤❤. Also gives me Thank You Next vibes😮‍💨,@christiandiorhoe,2024-03-08T07:37:14Z,0
thats remember a positions a little bit (worst behavior i guess),@gabriellysabrine,2024-03-08T05:46:41Z,0
We're here for the emotional intro. YASSSS,@AmariiTuckerrSPIICEE,2024-03-08T05:48:36Z,0
“Supernatural” was my fav off the album!  I just posted a cover it 🤭She has such pretty vocals!!,@lyubovkay,2024-03-10T05:08:36Z,0
christmas & chill's vibe,@cheapumpkin,2024-03-08T18:32:41Z,0
hello ! I created a small channel for lyric videos ! i made an even more extended version of this song cause i js love it so much !hope you can check it out and comment for any other ariana songs lyrics videos ! https://youtube.com/playlist?list=PLoL54QdQXhGMT9nmU6aibAinHF_WCAIX0&si=p-9s1VNRYpDoTl5Y,@MusicLyricsj6w,2025-04-09T09:23:54Z,0
Am I wrong but the intro and throughout this song I can hear some similar chords of ‘im tired’ by Labrinth,@blueberryxbugaboo6902,2024-03-17T14:03:37Z,0
"When i listen to this song, i feel the same vibe as i listen to Craig David's You don't miss your water.... the calmness absolu❤",@somitahe,2024-09-11T08:20:09Z,0
Wishing for the Extended version with another verse and bridge and there it is,@arrirerou,2024-03-26T05:45:09Z,0
"The lyrics are great, as predicted, and she's the best! 😍",@고은성g,2025-05-15T04:49:34Z,0
"one of the annoying things? yep, song under 2 minutes 😢",@riostevanushutasoit3341,2025-02-15T16:38:26Z,0
"you use my voice and my mastering for the distributed version without responding to my hello on insta. You know only my friends can make money from my job but you ghost my hello and happy birthday after 6 years you ghost me you continue to hack my pc for robbed my voice and my mastering without hello and contract signed to do business. Please delete all my work on 7rings/stuck with you/34+35/positions/santa tell me/all tracks eternal sunshine Dj scrog remix to help you get back. now you and Mariah Carey are my enemy, you are not allowed to use my voice and my mastering for the buisness version because you never respond to my hello. you know I'm not interested by your money after 6 years, I help you for you  Mariah's feat and your musical arrangement. you are killing our love for no, hello now i hate you. you kill my love for you goodbye forever. eternal goodbye",@DjScrog,2024-05-21T11:18:18Z,0
I GOT BEST MISTAKE VIBES OMG,@blink-tt2zp,2024-03-08T05:09:44Z,0
Are y’all even listening to the lyrics? Like she’s telling us the story and not enough people are talking about it!,@carriewambui98,2024-03-13T20:26:24Z,0
i feel like her vocals on here are the prettiest they’ve ever been on any of her songs. this song is definitely in my top of songs. also her voice on the baby loves interlude are gorgeous as well,@cutegirlie01,2024-04-04T07:42:07Z,0
"This gives such ""needy"" vibes",@nav_2709,2024-03-14T13:32:08Z,0
"Longer, Ari, Longer… add bridge and second verse please 😢",@gerry8381,2024-04-13T05:25:25Z,0
THE VOCALS,@samillagusmao4230,2024-03-08T14:56:48Z,0
OOOHH THE MELODY AND THE INSTRUMENTS AND TGE VOICE,@ghassan_18,2024-03-08T06:56:14Z,0
It has Moonlight vibes,@sarahab5639,2024-03-08T10:30:19Z,0
"I miss yayyoung, same vocal tune.",@JoshuaAuguis-ju1zn,2024-04-07T10:02:03Z,0
It’s beautiful!!!😭💓omg the lyrics It’s hitting me hard,@ryuk8879,2024-03-08T07:31:08Z,0
