classificacao,comentario,justificativa
Neutral,She sounds very similar in vocal style as Missing Person's Dale Bozzio.  That was a good band back in the days.,"Compares the artist's voice to another artist, offering a neutral observation."
Positive,I dig her vibe. Her energy makes me genuinely happy.,Expresses enjoyment and positive feelings about the artist's energy.
Positive,I’m getting Cindy Lauper vibes from her.,"Compares the artist to a respected pop icon, indicating positive appreciation."
Positive,"I thought the lyrics were ""hurry up, it's time to SUFFER"" instead of supper. And I was like, yes, that's accurate.",Acknowledges a darkly humorous and fitting lyric.
Positive,This is giving 2000's vibes,Evokes nostalgia and appreciation for a specific era.
Positive,Chappell is such a vibe❤️😍,Expresses strong positive feelings using emojis.
Positive,"I heard this on the radio at work , i love it , great pop tune , so catchy and full of fun",Expresses enjoyment and positive qualities of the song.
Negative,Seriously the absolutely worst I have ever seen,Expresses extreme dissatisfaction and negativity.
Positive,Catchy tune,Expresses enjoyment of the song's catchiness.
Positive,I love her vibe so much 🎉,Expresses strong positive feelings about the artist's style.
Neutral,Did they get the beat from McPixel? :P,Asks a question about potential source material without expressing a clear opinion.
Negative,Roan by the motorcycle in that little yellow number is giving me serious Dirty Pair vibes.,Compares the music video to a potentially negative and dated film.
Positive,GTA Vice City vibes from this ♥♥♥,Expresses fondness for the song’s similarity to the iconic game.
Negative,This is forgettable garbage that wouldn’t be a hit if the singer were straight and singing about a man.,Expresses strong disapproval and suggests bias against the artist.
Negative,Are lyrics kids appropriate?,Expresses concern about the suitability of the lyrics for children.
Neutral,Could have been a song from any year 1980 to 1987. Which is a good thing. Funny how all the kids think this is new. I love it but she's '80's synth pop all the way. And not at all controversial. Madonna caused more of a stir than Gaga or Roan ever did. Keep it up though and maybe someone will start making good rock and country again from your inspiration.,Expresses a nostalgic appreciation with a critical observation about the artist's style.
Neutral,Beatstar Season 46: Winter haze,A statement of fact – referencing a specific game season.
Negative,This is one of the worst song ive ever heard ....,Expresses strong disapproval and identifies the song as exceptionally bad.
Positive,"i swear does anyone get 80's vibes from this song? like the style, make, singging is giving me 80's vibes ya know?",Expresses enjoyment of the song's 80s-inspired style.
Positive,Idk what is happening but I like it! Very catchy!,Expresses enjoyment and highlights the song's catchiness.
Positive,2:48 those notes eeeeeeee,Expresses enthusiastic delight with repeated 'eeeeeee' indicating excitement.
Positive,80s vibes 🕺🏻🎶,Expresses enjoyment of the song's nostalgic 80s style.
Neutral,80's-90's beat,A simple statement of musical preference without emotional valence.
Negative,😂 History repeats itself. This one is awful 👀   grease lightning ⚡ yeah 😂🤭,Expresses strong disapproval and uses sarcastic emojis.
Negative,Boy. I could have done without these visuals.  Maybe a lyrics video next time? Yikes.,Expresses disappointment with the music video visuals.
Positive,"She reminds me Cindy Louper, her powerful voice, her style, her beauty😉😉👍👍👍",Expresses admiration and positive feelings towards the artist.
Neutral,"Growing up in a big city, i feel like i don't relate to a lot of the typical midwest high school experience, but one thing i sure do relate to is the football and cheerleader culture. I was in the school band, so i had to show up to games whether i wanted to or not, and usually i'd tried to find my friends in the stands or flirt with the football guys on the sidelines, but was easily spotted because we had to be in uniform. When all else failed i'd just mess with the drumline until they got fed up and beat me with their sticks and mallets. Unfortunately for them, my instrument was made from stainless steel and was bought second hand, already kinda broken, so i had zero qualms beating them back. Such times those were. Also loved to piss off the saxophones by playing careless whisper on the flute.","Shares a nostalgic, slightly humorous personal anecdote without strong positive or negative sentiment."
Neutral,I might be tripping but the 'bass' melody sounds a ton like the C64 SID chip. Very similar to the Lazy Jones soundtrack,Comparison to a retro sound chip without strong positive or negative emotion.
Neutral,BABY DO YOU LIKE THIS BEAT?,"A simple question seeking engagement, lacking strong sentiment."
Negative,"Gad...we had the music in the 70's.  I came here because there was a storry in the Washington Post about her.  I clicked on this video.  No talent, 2) vomit inducing lyrics and music.  Wow, this is what the younger generation thinks is talent?  We are done, if so...",Expresses strong disapproval and criticism of the artist and her music.
Positive,"I came here for the bop, stayed for Roan's infectious vibe 🎉",Expresses enjoyment and appreciation for the song's energy.
Neutral,"Not a great song. However, really catchy. Might be the eighties sound but, it feels very farmiliar!😅",Expresses a mixed opinion with both criticism and acknowledgment of catchiness.
Positive,This is bringing back 80s vibes,Expresses a nostalgic and positive association with 80s music.
Positive,Her vibe reminds me of this https://www.youtube.com/watch?v=96qBfrinajs,"Expresses a positive comparison, indicating enjoyment of the artist's style."
Positive,Damn this is catchy AF!!  I shouldn't like it but i really do!😂,Expresses strong enthusiasm and enjoyment of the song.
Neutral,Is it me or am I getting late 2010s vibe,Expresses a nostalgic feeling without strong positive or negative emotion.
Positive,I bit of a Lene Lovich vibe here. Love it.,Expresses enjoyment and appreciation for the song's style.
Positive,"Lyrics: Five, six, five , six, seven eight! I could be the one with the new addiction, it’s all in my head but I want a non-fiction. I don’t want the world but I’ll take this city! Who can blame a girl call me hot, not pretty.",Enthusiastic and playful repetition of the song title indicates enjoyment.
Positive,serious taylor swift  vibes in that one,Expresses a positive comparison to Taylor Swift.
Negative,This shit is awful,Uses highly offensive language to express strong dislike.
Positive,Love that Legend of Zelda temple theme synthesizer at the beginning.,Expresses appreciation for a specific musical element.
Positive,I like the way the music before the vocals start sounds off-kilter.,Expresses appreciation for the unusual sound before the vocals.
Negative,It actually sounds okay as a kind of retro '80s thing right up until 1:12 and it's just awful.,Expresses initial positive sentiment quickly turns to strong criticism at a specific point.
Negative,No thanks real trashy and kids listen to this cause of the up beat music.👎👎👎,Expresses strong disapproval and identifies the music as unsuitable for children.
Positive,80's vibes.,Expresses enjoyment of the song's nostalgic style.
Positive,"I grew up with 80’s music, thanks for bringing that vibe back in your creative way!",Expresses gratitude and appreciation for the nostalgic musical style.
Neutral,Where do i know this beat from the chorus,Expresses confusion and seeks origin of the beat.
Positive,so damn catchy! and I love that Weird Al covered this.,Expresses strong enjoyment of the song and appreciation for the cover.
Positive,Vocally she reminds me a ton of Kate Pierson and I looove Kate Pierson,"Compares favorably to a respected vocalist, expressing enjoyment."
Positive,This song hits a very specific part of my brain. Like literally. I can feel the song’s beats pulsating on my ONE SPECIFIC front tooth 😭,Expresses a unique and intense positive reaction to the music.
Positive,The Ting Tings + Toni Basil + 80s vibes=This song as cheerleader rock.,Expresses enthusiastic appreciation for the song's 80s inspired style.
Positive,Feels like 80s vibes,Expresses a nostalgic and positive association with the 1980s.
Positive,Cute af vibes,Expresses a positive and enthusiastic appreciation for the music's style.
Neutral,Who could blame a gal? ❤ to 0:56 call me hot not pretty! 👿 baby do u like dis beat? 😊,Mixed expressions of admiration and playful questioning.
Positive,Cindy lauper vibes. Icon!😊,"Compares the artist to a beloved icon, expressing admiration."
Negative,"This is cute but in my performance classes, they told us not to hit every fucking beat with a movement and she’s out here like doing 12 on them",Expresses annoyance and criticism of the performer's overly energetic movements.
Positive,I love her 80s 90s vibe ❤,Expresses affection for the artist's musical style.
Positive,I like this song 🎵 sounds so 80s! And I saw the comedy skit but they did it to this beat so funny 😁 I didn't know it was from this song!,Expresses enjoyment of the song and a positive reaction to a related skit.
Positive,As a white guy who usually listens to thrash metal this is oddly catchy and good for someone who doesn’t usually listen to this,Expresses surprising enjoyment and appreciation for the music.
Negative,Cool beat and this windbag ruins it.,Expresses dislike for the song due to a perceived flaw in the beat.
Positive,Idk this is too catchy,Expresses enjoyment of the song's catchiness.
Positive,Hayley Williams vibes 😎,Expresses admiration and positive association with Hayley Williams.
Negative,"Awful song, choreography, and production. Who is this copy of a singer?","Strongly criticizes the song, choreography, and production, implying a lack of originality."
Neutral,"0:28 not me do 5,6,5678 me thinking the beats bout to drop",A playful and slightly confused expression with no clear positive or negative sentiment.
Neutral,0:59 why does this melody sound familiar,Expresses a vague sense of recognition without strong positive or negative emotion.
Positive,This song has an 80’s vibe…just love it!,Expresses strong enjoyment and appreciation for the song’s 80s style.
Neutral,People keep saying this is a 80s vibe but to me it sounds more like 2010-2013 pop,Expresses a different musical interpretation compared to the common perception.
Neutral,I'm getting Cindy laupher vibes❤,"References another artist, but without expressing strong positive or negative feelings."
Positive,I practice swordfighting to this sick beat.,Expresses enjoyment and connection with the music.
Positive,Five six five six seven eight ♪ I can be your one are new Addition it's all in my head but I want nonfiction I dont want the world but I'll take this city who can blame a girl call me hot not pretty baby don't you like this beat I made it so you'll dance with me it's like an hundred ninithy nine degrees when ur doing with me doin it wit me hot to go clap ur hands and touch ur toes dance it out ur hot to go hot to go snap and clap and touch ur toes hot to go hot to go! You can take me hot to to hot to go you can take me hot to go!,Expresses enthusiastic enjoyment and excitement about the song.
Negative,Wow I’ve heard crap before but this is absolutely the worst wanted to stab my ears just to never hear this or anything like it ever again.,Expresses extreme displeasure and a desire to inflict harm due to the song's quality.
Positive,She seems so funny and fun to hang with. I like her spirit and vibe,Expresses enjoyment of the artist's personality and energy.
Neutral,Progressional paragon,The comment is a single word with no clear positive or negative sentiment.
Neutral,Does she give off B-52s vibes or is it just me?,"Compares the artist to the B-52s, a neutral comparison."
Positive,"I don't really know how much ""pure talent"" she has................but this song is catchy, and I LIKE it :)",Expresses enjoyment of the song despite uncertainty about the artist's talent.
Negative,"I keep seeing her name, but this is the first time hearing her.... This is some 1988 mush..... Very forgettable.",Expresses dislike and finds the song forgettable and overly sentimental.
Positive,"Go-Go's brought me here!!... They added This anthem to """"We got the Beat"" on their 2025 tour!🎉❤🎉",Expresses enthusiasm and appreciation for the artist and song.
Positive,Love how this has an 80's vibe.,Expresses fondness for the song's 80s-inspired style.
Neutral,It’s like a mashup of 80s synth pop Hey Mickey and 2000s pop punk Avril Lavigne and Paramore,Describes the music in terms of influences without expressing a clear positive or negative opinion.
Negative,i looked at her top 4 songs and legit they are the same 3 verese repeated 2-3-4 times to extend em for an entire 3 min song😂😂😂 absolute craziness she is popular… her lyrics are catchy sure but her music says NOTHING 😂😂😂 just fuckin party anthems that sound recycled from other people,Expresses strong criticism of repetitive lyrics and lack of originality.
Negative,"I never actually paid attention to the lyrics of this song but... if Chappell Roan is having trouble getting laid, there's no hope for the rest of us.",Uses a cynical and judgmental remark about the artist's personal life.
Negative,Only here to get this annoying earworm out of my head 😑😒🙄😐,Expresses frustration and annoyance with the song.
Positive,julie brown vibes!! love this,Expresses admiration and enjoyment of the music.
Positive,Killers vibe. I like it.,Expresses liking the song's style and vibe.
Positive,I love this 80s vibe,Expresses enthusiastic enjoyment of the song's 80s style.
Neutral,"I'm only here cause I saw the lil' homie Hot Dog Harv on GMA referencing this song, otherwise I would've never known about it. Kinda catchy.",Expresses mild curiosity and a tentative positive assessment.
Negative,......... awful,Expresses strong disapproval and negativity.
Neutral,idk why but this feels so 2000s. almost nostalgic,Expresses a feeling of outdatedness without strong positive or negative emotion.
Positive,"I feel the YMCA, Toni Basil's ""Mickey"" and the 80s beat and I'm here for it!",Expresses enthusiastic enjoyment of 80s music and sounds.
Neutral,"Catchy tune, but thank God for autotune.....",Expresses a positive opinion about the song while also subtly criticizing its reliance on autotune.
Positive,"As an older Gen x lifetime music critic but moreso fan, there are things about her that remind me of a breakout Blondie. While  certainly a giddy pop act she looks both backwards and forwards in creating these catchy little pop anthems. I'm talking far more about her philosophy than music. There's also a hint of the B - 52s in her sound. Enjoy it. Both Chapel and fans.❤",Expresses enjoyment and positive comparisons to influential artists.
Neutral,✏️ Describe the vibe,"A simple request for description, lacking any explicit sentiment."
Neutral,She fans herself way more often than she mentions the temperature.  And what hurts her feelings? Staring at the ceiling? Why do the catchiest songs make no damned sense?  But it really is impossibly catchy,Expresses bewildered amusement and mild criticism without strong positive or negative emotion.
Positive,Insanely catchy❤,Expresses strong positive sentiment with the use of 'insanely' and a heart emoji.
Positive,Hot To Go is like today’s Girl’s Just Wanna Have Fun. It’s got this fun 80s vibe.,"Compares the song positively to a classic, highlighting a desirable 80s vibe."
Neutral,This is so Harmony Korine,Reference to a director without expressing a clear opinion.
Positive,The lyrics are so relatable omg!,Expresses strong positive sentiment due to relatable lyrics.
Neutral,It's weird i cant stand the verses but i love the hook.  I've never reacted to a song like that before.,Expresses conflicting feelings – dislike of verses and love of the hook – with a surprised reaction.
Neutral,Seems weird to have her parents? Grandparents?  Included given the lyrics,Expresses mild confusion and observation about the video's production.
Positive,Listen to the lyrics...men are the prize 😊,Expresses a positive sentiment towards the song's lyrics.
Positive,Very Catchy Song🙂,Expresses enjoyment with the use of an emoji.
Neutral,Aggressive happiness is my new default emotion,A paradoxical statement expressing a feeling without clear positive or negative connotations.
Positive,This has such a 80s vibe to it I like it 💛,Expresses enjoyment and appreciation of the song’s nostalgic 80s style.
Neutral,Where is the Reverb?,A simple question expressing a minor technical criticism.
Positive,Her least annoying song,"Expresses a preference for the song, implying enjoyment."
Positive,These dance numbers with the ever so subtle punk rock undertones (maybe it’s more Avril? Either way I find CR far better than most) really hits hard.,Expresses strong enjoyment of the music and favorably compares it to Avril Lavigne.
Neutral,"It’s very catchy, but I don’t like the weird mutant she dances with.",Expresses enjoyment of the song while critiquing a specific visual element.
Positive,I get such Cyndi Lauper vibes from her. I love it!,Expresses strong positive feelings and identifies a positive influence.
Positive,My 8year old turned me on to this song. It has enough 90s vibes and I really enjoy this song. Fun. Clean and innocent,Expresses enjoyment and positive associations with the song.
Positive,"she reminds me of a more active or in the camera Florence + the machine, both great, love her vibes",Compares the artist favorably to Florence + the Machine.
Positive,I'm aroace but I love this song! Lesbians are so powerful <3,Expresses support and affection for the song and the LGBTQ+ community.
Neutral,"I think people are forgetting the sound Katy Perry used for her albums. She was very colorful, pop music and mainstream. Chappell Roan is this decade’s Katy, just more indie off beat fashion.","Compares Chappell Roan to Katy Perry, noting similarities but emphasizing a different indie style."
Negative,"Its just ripping off Boy Harsher - Autonomy's bassline hook but with worse, more shallow lyrics lol",Criticizes the song for being a derivative and poorly written copy of another artist's work.
Positive,This is weirdly catchy,"Expresses a positive, albeit slightly perplexed, enjoyment of the song."
Positive,I love this catchy song,Expresses strong enjoyment of the song.
Positive,This is like hotty vibes😊😊😊 forever,Expresses enthusiastic enjoyment with positive emojis.
Positive,Such Cyndi Lauper vibes from this. Absolute bop.,Expresses strong enjoyment and comparison to a positive artist.
Neutral,*sigh*…. There seems to be this trend where in the official music videos for songs there’s always a 30-60 second intro without music and it’s a shame because it really throws off the vibe of a playlist if you want to just “spam skip” the ads and just keep on jamming 3:,Expresses a minor annoyance about music video intro lengths.
Negative,Saddest upbeat song,Expresses sadness despite the song's upbeat nature.
Negative,"This is literally the worst song I’ve ever heard. Nice try, Chappell Roan, but you’ll never suceed. You suck 😡",Expresses strong dissatisfaction and insults the artist.
Neutral,Prefer the song’s verses instead of the chorus.,Expresses a preference for one part of the song over another without strong positive or negative emotion.
Positive,I played this song on Beatstar and ive been obsessed with it ever since,Expresses strong enjoyment and fixation with the song after experiencing it on Beatstar.
Negative,This is the worst song I’ve ever heard,Expresses extreme dissatisfaction and condemnation of the song.
Negative,This song is awful why do I keep hearing it,Expresses strong dislike and frustration with the song.
Negative,I don’t understand why people enjoy listening to lyrics like this someone please explain like I genuinely want to know because to me it’s just weird openly talking about sex especially in front of your grandparents. Talking about your sexuality is not what I’m saying that is healthy and good to do but talking about actual sex is just so odd to me,Expresses strong disapproval and discomfort with the explicit lyrics.
Positive,"I will say it again, this beat is absolute fire. Keyboards are literally the best ever!",Expresses enthusiastic praise for the song's beat and keyboards.
Neutral,"Nothing wrong with a fun beat or sexual empowerment, it just seems the music landscape today is saturated with hypersexualization. That's what is marketable.",Expresses a concern about over-sexualization without strong positive or negative judgment.
Neutral,I discovered this song from beatstar,Simple statement of discovery with no expressed opinion.
Positive,Nice voice of vocal,Expresses appreciation for the singer's voice.
Positive,"There's a real GoGos, Missing Persons vibe in this song.","Compares the song favorably to classic bands, indicating a positive appreciation."
Positive,Why is the melody so GOOD?,Expresses strong positive reaction to the melody.
Positive,This gives me such 80s vibes. Love it!,Expresses strong positive feelings and enjoyment of the song's nostalgic style.
Neutral,"This gives me ""Oh Mikey You're So Fine"" vibes.","References a specific song, indicating a similarity without strong positive or negative judgment."
Neutral,The only reasons I knew this wasn’t 80’s when I first heard it was because I’d never heard it and the vocals sound a little more polished like a modern studio will do even though the effects are going for that retro sound. Funny how history tends to repeat itself with things like music and fashion. Not sure we’ll ever have the talent and depth of mainstream music like pre 80’s again given there’s no incentive to create such artistically deep music anymore as the modern audience doesn’t have the patience and wants the short instant payoff with everything but that fits well with 80’s style so here’s to hoping we can get more 80’s sounding music in the mainstream. I couldn’t care less what the lyrics are about.,Offers a nostalgic perspective and commentary on music trends without strong positive or negative emotion.
Positive,It's a very fun❤ catchy song,Expresses enjoyment and describes the song as fun and catchy.
Positive,"First time i heard this, i thought it was kinda dumb. Now, i almost memorized the lyrics. Plus, it is so catchy!",The comment expresses initial skepticism evolving into strong enjoyment and appreciation.
Positive,Why is that super simple synth bass line so dang good? It's only 6 total notes including the transposition.,Expresses strong positive appreciation for a musical element.
Neutral,Robin Sparkles vibe,References a nostalgic pop icon without expressing positive or negative emotion.
Neutral,YMCA vibes,References a well-known song with a nostalgic and generally positive association.
Negative,"Well here comes another 1 catchy hit, where we don’t even hear from this artist again",Expresses disappointment and suggests the artist will disappear again.
Positive,"songs that give flashback are the best, it's new but give you the retro vibe . . .",Expresses enjoyment of the song's nostalgic and retro feel.
Neutral,Comments are a lil weird lol but I’m here for the 80s vibe,"Expresses a mild, non-committal observation about the comments."
Positive,Gives an 80's vibe with that beat,Expresses enjoyment of the song's nostalgic 80s influence.
Neutral,If you really listen to it you can hear some vocals from Olivia Rodrigo,Identifies a potential similarity without expressing a strong opinion.
Positive,getting Marina (formerly Marina and the Diamonds) vibes from the singer's voice.,Compares the singer's voice positively to Marina and the Diamonds.
Positive,Not sure why but the beat of this gives me a drive down a California freeway in a convertible with the top down vibe,Describes a pleasant and exciting feeling associated with the music.
Neutral,What vibes does this give me??,Asks a question seeking a subjective impression.
Positive,The song and music video give serious '80s vibes.,Expresses enjoyment of the nostalgic '80s style.
Negative,This is the worst thing I have ever seen and heard. EVER 😂,Expresses extreme disapproval and disgust.
Positive,Giving me 80s vibe :),Expresses enjoyment of the song's nostalgic 80s influence.
Positive,This sounded to me like something from the 80's and made me feel nostalgic. Like a Toni Basil or Missing Persons song,Expresses a positive nostalgic feeling and comparison to well-regarded 80s artists.
Positive,"when i heard this song on a spotify radio i genuinely thought this was from the 80s, i don't know what it is but it genuinely hits you with that kind of nostalgia. Might be the beat",Expresses a strong positive feeling and nostalgic reaction to the song.
Neutral,"Great catchy song, but I don’t like the lyrics. 6/10.","Expresses a mixed opinion – positive about the music but negative about the lyrics, with a numerical rating."
Neutral,I wish the bridge at 2:35 was after the first chorus as well.... its such a good part,"Expresses a specific, minor critique without overall positive or negative sentiment."
Negative,Awful Tragedy Nasty,Uses strong negative descriptors to express dislike.
Positive,I got some Cyndi Lauper vibes from this.,"Compares the music to a well-regarded artist, indicating a positive impression."
