classificacao,comentario,justificativa
Negative,The music video of course can use some work. But great song and great voice. Just makes me uncomfortable that a little girl told me about her music with lyrics like this. WTH,Expresses discomfort with the lyrics and suggests a problem with the artist's appeal.
Neutral,I hate this song but it is catchy.,Expresses dislike but acknowledges a catchy quality.
Neutral,this gives me Degrassi vibes❤,"References a TV show, indicating a nostalgic or stylistic association without strong positive or negative emotion."
Positive,"i love how she has fun while making music, its not really s3xy or anytihng just fun vibes and i love how she was teaching her grandparents. Chappell Roan is my new favorite! I love the outfits, hair everything!!!",Expresses strong enjoyment and appreciation for the artist's playful approach and the video's content.
Positive,Feels like 90's vibe pop snyth,"Expresses enjoyment of a nostalgic, 90s-inspired pop sound."
Positive,Modern Cyndi Lauper vibes fs,Evokes a nostalgic and positive association with the artist Cyndi Lauper.
Positive,keep hearing this catchy song on the R.A.D.I.O its time to get your pom poms out like Toni Basil 80s sweatbands 🟪🟦,Expresses enjoyment and nostalgia associated with the song and 80s pop culture.
