classificacao,comentario,justificativa
Positive,80s synth pop. This was high school for me. She captures that era in which I think was the best in music history. 80-95 was sensational with sounds from all over the world,Expresses nostalgic fondness for the music's era and style.
Positive,"This girl’s got it all. Vocals, drama, smarts and beauty.  So creative and innovative. Very 80s energy and spunk but with 2025 content. Love her!",Expresses strong admiration and enjoyment of the artist's work.
Neutral,Alternate interpretation of the lyrics: My five year old son thinks that Chappell is singing about her love of takeout pizza.  🍕🍕🍕  I think he's on to something.,"Expresses a child’s interpretation alongside a thoughtful observation, lacking strong emotional tone."
Positive,"This song is pure joy – it's impossible not to smile and dance along, no matter who you are or what you usually listen to! She's creating a whole universe of unapologetic fun, and I'm so here for it. Seriously addictive, thanks for the bop Chappell!",Expresses enthusiastic enjoyment and describes the song as 'seriously addictive'.
Positive,2:47 I love the way she fluctuates her notes at the end. Both times!,Expresses admiration for a specific vocal technique.
Positive,As a 58 year old it's so nice to hear a new catchy pop song where I can actually understand the words!,Expresses satisfaction with the song's clarity and catchiness.
Positive,"The energy in this video is contagious! Chappell Roan is bringing back the joy and unapologetic fun that pop music desperately needs. Between the killer dance moves and the infectious beat, this song is going straight to my summer playlist.",Expresses enthusiastic enjoyment and identifies the song as a welcome addition to summer playlists.
Positive,"Even as a metalhead, I can't help but like this because of how catchy it is.",Acknowledges enjoyment despite not being a typical metal fan.
Positive,As a bisexual ive been so afraid to tell several people but ur music and speech just called out to me loudly i love ur vibe 😍❤,Expresses strong positive feelings and appreciation for the artist's 'vibe'.
Positive,Cindy Lauper vibes,Evokes a positive association with the iconic Cindy Lauper.
Positive,"I love how every costume change makes her look like a completely different person in all of her videos, and she always looks amazing! Love the fun vibe she brings to everything, and getting her grandparents involved is wonderful and so different to other artists ❤️ thanks for brightening my day with this tune!",Expresses strong enjoyment and appreciation for the artist's visual style and positive impact.
Positive,This has 80s vibes,Expresses appreciation for the nostalgic 80s influence.
Positive,"Chappell Roan is bringing so much joy and unabashed fun back into pop music, and it's incredibly refreshing to see an artist truly thriving in their own unique space. The 80s vibes are strong, but the genuine talent and charisma make it totally her own.",Expresses strong positive feelings and admiration for the artist's originality and charisma.
Positive,"This Song is VERY Catchy, I like Chappell's Style, She's freaking Awesome!!!",Expresses strong enjoyment and admiration for the artist.
Negative,This has such Hey Mickey! vibes.,Compares the song negatively to the nostalgic 'Hey Mickey!'
Positive,"As an accursed centuries old bog-witch, this is some catchy music",Expresses enjoyment of the music despite a slightly unusual and evocative description.
Neutral,"This song confused me emotionally when I first heard it. I didn't know whether I loved it, hated it, was annoyed by it, or drawn into it. It tripped me out, so I decided to love it",Expresses a state of ambivalence and confusion regarding the song's emotional impact.
Positive,Reminds me of 80’s vibe….dancey and bouncy..fun,Expresses enjoyment and positive association with the music’s style.
Positive,"I was at a Kansas City Comets game (indoor arena soccer) this past Friday night, and in the intermission between Q1 and Q2, a local dance troupe danced to this song - tweens and early teens. I has just gone to get nachos and a beer, and about 30 seconds later, I hear the FIRST of SEVERAL GROWN ASS MEN coming to the councourse to do the same, singing this song at the top of their lungs! Some even did the dance! I had no idea until I watched this video and saw the giant fork (which is in Springfield, MO - I have posed with it!) , that she was from MO! I LOVE her and how fun and catchy this song is. And I LOVED her acceptance speech at the MTV Music awards!  Keep it going, kiddo!","Expresses enthusiastic enjoyment of the song and artist, alongside a humorous anecdote."
Negative,This song is annoying! This era is so sex driven and perverted,Expresses strong dislike and accuses the era of being overly sexualized.
Negative,This is flat out one of the worst songs I've ever heard produced by our species.,Strongly condemns the song as exceptionally bad.
Positive,"This is the most fun I've had watching a music video in ages – Chappell's energy is infectious, and the 80s vibes are immaculate! Adding this straight to my feel-good playlist; can't wait to see what she does next.",Expresses enthusiastic enjoyment and anticipation for future work.
Positive,"I’m a straight, white 6’4” 270lb dude. I love this damn song. Also, that Honda Valkyrie in this video is super cool too! Greg vibe, great vid! Great song!",Expresses enthusiastic enjoyment of the song and video.
Positive,The Freakier Friday trailer brought me here 😊 this song is so catchy! ❤,Expresses enjoyment and uses positive emojis.
Positive,All of your Music Chappell is sensational in every single way possible!! You gotta luv how catchy her music actually is?!!! 🥰🥰❤❤❤,Expresses strong positive feelings and enthusiasm for the music.
Positive,"im a staunch metalhead, but damn this tune is catchy",Acknowledges catchiness despite a preference for metal.
Positive,Your immaculate Chappell!! Just being yourself!! I’m sooo here for it!!😍😍😍 I’m here for everything you stand for gurl!! Luv your music sooo much angelic sound and pitch!! You could not do anything to improve your music surely Chappell!! Your style and music is sooo creative gurl!!😍😍😍❤❤❤,Expresses enthusiastic support and admiration for the artist's work and style.
Positive,"Chappell you don’t know how much your music has supported me and helped me feel comfortable in my own body as a transfem, it might just seem like a catchy cunty radio station pop song but this has profoundly helped me and I thank you so much for it, keep going you’re so talented.",Expresses deep gratitude and appreciation for the artist's impact.
Positive,I am absolutely a big fan. Gets me going on a good vibe no matter how i feel,Expresses strong enthusiasm and positive feelings about the music.
Positive,"Im straight, I am a male but this song is catchy and I dig it",Expresses enjoyment of the song regardless of personal identity.
Positive,I could be going through the worst thing in my life and play this song and I’d feel better😍,Expresses a strong feeling of comfort and positivity derived from listening to the song.
Positive,Okay I loved this as my first song I’ve heard by her😭🤍it’s so catchy,Expresses strong enjoyment and excitement as a first exposure to the artist's music.
Positive,This gave me some massive 80s vibes pretty rad song!,Expresses enthusiastic enjoyment and references a desirable 80s influence.
Positive,i don’t listen to her but i say she actually has talent! her vibe is a lil 80’s n i love that,Expresses appreciation for the artist's style and talent.
Positive,I love this song but once for a powderpuff game the football players had to do a cheer to this song and a mom picked the song for the beat I don’t think she knows what it meant lol,Expresses enjoyment of the song despite a somewhat awkward circumstance.
Positive,"This song gives me vibes of ABBA’s 1980 album, “Super Trouper”.","Compares favorably to a well-regarded ABBA album, indicating enjoyment."
Positive,Heard this in the radio and it got stuck in my head all day. So catchy!,Expresses enjoyment and describes the song as catchy.
Negative,This song is so nostalgic. It takes me back to the time I met my exes' parents for the first time. This song was playing in the car with him and his father. Back when Chappell was rising to fame. Fuck I miss him so much 😕,"Expresses sadness and longing, indicating a painful memory."
Negative,I’m a 49 year old dude that is a huge music snob and think every pop song since the beginning of time is garbage. But GOD DAMN this song is as catchy as my ex wife’s herpes. (Apparently she was also HOT TO GO),"Uses strong, vulgar language to express dislike and dismisses the song's quality."
Positive,Cool vocal riffs + everything else was awesome!!!,Expresses enthusiastic approval of the vocal performance and the song overall.
Positive,I’m getting Madonna and retro vibes. LOVE IT,Expresses strong positive feelings and association with a beloved artist.
Negative,"As a mid 30s straight guy, I have asked that the chorus gets played on loop as my coffin gets wheeled off behind the curtain at the crematorium.","Dark, morbid humor expressing extreme dislike."
Neutral,"Why can I see this song being in heartstopper somewhere?! Like it kinda matches the vibe of the show, atleast according to me 😅",Expresses a personal opinion about a potential connection with a popular show.
Negative,All this buzz and hype up for this letdown music the vocal preset of the 80s omg im so bored,Expresses disappointment and boredom with the music.
Negative,Easily the worst song I've heard since the 2010s,Expresses strong dissatisfaction and ranks the song as exceptionally bad.
Positive,The vibe of the song is a mix between the 80's and early 2000's. Cyndi Lauper and Le Tigre,Evokes nostalgia and positive associations with classic artists.
Positive,IDK why but this song makes me so happy. It’s an up beat song,Expresses a feeling of happiness associated with the song.
Positive,This is THEE JAM! SO damn catchy!,Expresses enthusiastic enjoyment of the song.
Negative,Her voice so annoying,Expresses strong dislike for the singer's voice.
Positive,1:25 H O T T O G O  you can take me Hot To Go (2x) Well I woke up alone starring at my ceiling. i try not to care but it hurts my feelings. u don't have to stare come here get with it. No one's touched me there in a damn hot miniute! and baby don't you like this beat? i made it so u'd sleep with me. it's like a 199 degrees when you're doing it with me doing it with me.,Expresses enthusiastic enjoyment and desire to engage with the song's energy.
Positive,This song is just a MF fun vibe,Expresses enthusiastic enjoyment of the song.
Positive,I love the vibes of all of Chappell's songs 😭 she's so unique,Expresses strong positive feelings and appreciation for the artist's uniqueness.
Positive,Just soooo catchy,Expresses strong positive feelings about the song's catchiness.
Positive,I HAVE TO ADMIT SOMETHING: I used to find this song a little annoying but now that I’ve watched the video all I can picture is her grandparents dancing to it and now it’s a WHOLE vibe,The commenter's perception of the song has shifted positively due to watching the video.
Positive,Actually like this song due to its apparent influence from contemporary 80s pop music 🎧,Expresses enjoyment of the song’s 80s pop influence.
Positive,I love the 80s vibe it’s so cute ❤,Expresses fondness and positive emotion through emojis.
Positive,Shes giving modern tiffany vibes,Compares the artist to a positive and fashionable icon.
Negative,"I came to find this video to just say what an annoying, horrendous song this is. Brain rot music.",Expresses strong dislike and calls the song 'brain rot'.
Negative,Worst song of the year,Expresses strong disapproval and designates the song as the worst of the year.
Positive,Getting real Cindy Lauper vibes here,"Compares the song to a beloved artist, indicating a positive feeling."
Negative,This is the worst shit I’ve ever herd,Expresses extreme dissatisfaction and disgust with the music.
Positive,The vibe of this song is 🥵🥵🥵,The use of the hot face emoji indicates strong positive feelings.
Negative,Not people at my swim team chanting this song AND doing this dance like a bible verse 😂,Expresses strong disapproval and mockery of the behavior associated with the song.
Negative,annoying af,Uses a highly negative and informal descriptor.
Negative,"It's so deeply hard to love someone that you can't be with. Even as someone who isn't currently in a queer relationship, the longing is still there. It's hard when you know that someone loves you back, uou truly know, but they can't let themselves give in and be happy. For us, it isn't a matter of coming out but. There is so much love and longing. I've been with people who have said they wanted me, people that lied and with him. Its always been a different. When I'm with him, every love song makes sense. He makes me feel undeniably beautiful, like he never had a doubt. To have someone stop what they were doing to come across the table and kiss you... and you can see from the look it's because they just can't wait a second longer to kiss you. You know that there's more there than can even be said. And to not be with him. It's an aching pain that I'm not willing to let go of yet.",Expresses profound sadness and pain associated with unrequited love.
Negative,This is so awful 😂. Wow music is dead,Expresses strong disapproval and declares music is 'dead'.
Positive,I am getting Cindy Pauper meets B52s vibes.,"The comment expresses a positive comparison, associating the song with beloved artists and a distinct sound."
Positive,love the 80s vibe sm,Expresses strong liking for the 80s musical style.
Positive,Anybody else thinks this could be a song on stranger things. Like the  first episode of the new season always starts with old upbeat music and this beat would go so hard in stranger things,Expresses excitement and a desire to see the song featured in a popular show.
Positive,"30 year old black guy from Chicago, that beat... Fire",Expresses enthusiastic approval of the beat.
Positive,Although this song has broken thru into the billboard charts …there is a much deeper message woven thru this song.  It’s still under rated .  She’s literally a musical genius,Expresses admiration for the artist's genius and the song's deeper message.
Positive,i thought this song was cyndi lauper when i first heard it. they played it again at a work party. i love the retro vibes.,Expresses fondness for the song's retro style.
Negative,"This is probably the worst song I've heard in a long while, it just has nothing in common with the term music",Expresses strong disapproval and considers it non-musical.
Positive,A lot of repetitive hand waving but an excellent creative jingle flick non the less.,Acknowledges positive aspects despite some repetition.
Negative,This phony dram queen sucks.  Too much autotune.,Expresses strong disapproval and criticism of the artist.
Neutral,Here in March 2025 after the release of the giver and I can hear tinges of country in her vocals it seems like. Could be my imagination.,Speculation about a slight country influence with no strong positive or negative assessment.
Positive,"Giving me a ""YMCA"" vibe. Also, I'm really pumped for ""Freakier Friday"".",Expresses excitement and positive association with the song's style.
Negative,"Lyrics: ""Use me as a temporary sex toy""",Explicit and disturbing lyrics create a highly negative sentiment.
Positive,"Have no idea why I like this,  not even music I like but in a World of over produced no ass K-pop synth hype and over-sexualised Tylers I think this natural fun innocence is exactly what the World needs, come as you are.",Expresses appreciation for a seemingly simple and genuine song.
Negative,let me be honest this is the worst song i have EVER listened to like how can someone make a song this bad!!!!!! -1000000/10,Expresses extreme dissatisfaction and negativity towards the song.
Positive,I discovered Chappall only about 5 hrs ago n havent stopped listening to all her songs. Love her lyrics n catchy tunes. Spotify got her in my library n love Feminomenon n Red Wine Supernova,Expresses strong enjoyment and frequent listening of the artist's music.
Positive,this song give paramore vibes js,Compares the song positively to Paramore.
Positive,The beat of the song is 10/10 on its own.,Expresses high praise for the song's beat.
Positive,"Why have I not seen this before - it is such fun! The fact that she got her grandparents to do the dance, and they've got much more rhythm than I do 🤣",Expresses enthusiastic enjoyment and amusement.
Neutral,1:55 DONT. YOU LIKE THIS BEATTT,"A simple, declarative statement with no clear positive or negative sentiment."
Negative,"*squints at closed captions in first verse* how has no one commented on/corrected the omission of ""dance with me"" in the closed captions? (It says sleep with me)😅",Expresses annoyance and highlights an obvious error.
Positive,Alrighty fellas I was going through my Madden 26 playlist narrowing down the songs I want to keep (there's a lot). This made the playlist it's way too catchy IDC 😂,Expresses enjoyment and amusement with the song's catchiness.
Positive,Gives off 80s vibes.,Expresses a positive association with a nostalgic musical era.
Positive,i like her between the lines angst. it’s not super obvious but it’s def there. she’s a punk singer in an alternate universe,Expresses appreciation for a specific aspect of the artist's style.
Positive,This was played right before Cyndi Lauper came on stage in Austin. It was so catchy and many were doing this. I'm glad I figured out who sang it. 👍,Expresses enjoyment and recognition of a catchy song.
Positive,Luv to see that Chappell has such a close connection and bond towards her grandparents!!! Her vocals are truly inspiring!! Her vocals hit those high notes on point!! Pitch perfect gurl!!🎵🎵😍😍❤❤ Pitch perfection gurl!! Her vocals are insane!!❤❤❤❤,Expresses strong positive feelings and admiration for the artist's vocals.
Positive,Literally giving me modern hey micky vibes love her!,"Compares the song to a well-regarded track, expressing fondness."
Neutral,As a Bisexual i could give a Fk Less about what the video shows and alot more about the lyrics,Expresses a dismissive attitude towards the visuals but remains open to the lyrics.
Negative,god when will people stop making talentless skanks famous?  bitch can barely even sing her song about being a whore.  If you read the lyrics the song is literally about being an ignorant ho.,Strongly criticizes the artist and her song using derogatory language.
Positive,Super talented and the multi verse agrees. This is a straight banger.,Expresses strong enthusiasm and calls the song a
Positive,"this song was probably the first one with good luck babe that got me into Chappell Roan and her art. the song is one for the books. sounds amazing, the vocals and the lyrics are great as always, and the mv looks stunning. Chappell, this is incredible! good job.",Expresses strong appreciation and praise for the song and music video.
Positive,Gives me cheer leader vibes,Evokes feelings of happiness and positivity associated with cheerleaders.
Positive,"Seriously, I love the Cyndi Lauper vibes she gives off. It would be awesome if she could do a cover of girls just want to have fun.",Expresses fondness for the artist's style reminiscent of Cyndi Lauper.
Positive,This song is so freaking catchy 😁,Expresses enthusiastic enjoyment of the song with an emoji.
Positive,Her grandparent are such a vibe dude🥰,"Expresses fondness and appreciation with a casual, positive tone."
Positive,This beat hits harder than my shin finding the coffee table at 2am! 💜💜,Expresses enthusiastic enjoyment with strong positive imagery.
Positive,This gives me 80s Cyndi Lauper vibes.,Evokes a nostalgic and positive association with a beloved artist and era.
Positive,"There's a Toni Basil vibe, I like it.",Compares the music to a positive and well-regarded artist.
Positive,there is just something with the 80s beats that is so catchy. makes anyone really listen to the song.,Expresses enjoyment of the song's 80s-inspired beats.
Positive,i love the concept of music like this. all inclusive and its honestly js such a fun song with such fun lyrics. it just feels right. like the type of song we all needed.,Expresses strong enjoyment and a sense of fulfillment from the music.
Positive,It’s giving cheerleader vibesssss❤❤❤❤,Expresses enthusiastic enjoyment of a particular aesthetic.
Positive,This song is a vibe 💥,Expresses enthusiastic enjoyment of the song.
Positive,Came to listen to this catchy song after SNL Domingo!,Expresses enjoyment of the song after listening on SNL.
Positive,Me faz lembrar muito o jeito e a vibe da querida Cindy Lauper nos anos 80. ❤,Expresses nostalgic fondness for Cindy Lauper's 80s style.
Neutral,Still want to unlock this song on BeatStar,"Expresses a desire to access a feature, without strong positive or negative sentiment."
Positive,She gives me Cyndi Lauper vibes,Compares the artist to a beloved and respected musician.
Negative,I dont get the appeal.  She's not all that. Dumb lyrics.,Expresses dislike and criticism of the artist and her music.
Positive,"Thank you Kayleigh for making my Wisconsin Winter a little less cold!!! I love your little made face when you sing the part about making this beat so that ""I"", (someone)... would sleep with you!!! lol ;D",Expresses delight and affection for the song and artist.
Positive,As a transfemme pansexual I vibe w/ this so much 😩🙏🏻,Expresses strong positive connection and enthusiasm.
Neutral,The song’s too catchy tho,Expresses a simple observation without strong positive or negative emotion.
Positive,"This has such a fun, upbeat 80s vibe to it you can't help but like it!",Expresses enthusiastic enjoyment of the song's 80s style.
Positive,"This song is like crack omg, can't get enough of it. It's been my alarm tone for months and I'm still not sick of it",Expresses intense and obsessive enjoyment of the song.
Negative,Wow. This is awful. Music for 12 yr olds.,Expresses strong disapproval and labels the music as inappropriate.
Negative,She a one hit wonder and this ain’t it. Plus she is kinda a jerk because colorful reasons. Lots of people in that community think it’s ok to be rude and awful to people just because of who they are or think they are.,Expresses strong criticism and negative judgment of the artist.
Negative,The back ground vocals/the chorus sounds like THE GOGOS.,"Compares the vocals unfavourably to a specific group, implying a poor imitation."
Negative,Like her but i sure wish these people could remember children are chanting their overtly sexual lyrics. That part is just not okay,Expresses disapproval of sexually explicit lyrics directed at children.
Positive,H-O-T-T-O-G-O SNAP AND CLAP AND TOUCH YOUR TOES (continue lyrics) 👇,Expresses enthusiastic enjoyment and excitement.
Positive,"I will say it again, this beat is absolute fire. Keyboards are literally the best ever!",Expresses strong enthusiasm and praise for the music's quality.
Negative,"This sounds like it was made by a focus group. No emotion, ugly production, just terrible.",Strongly criticizes the song's lack of emotion and poor production.
Positive,"I built up my vibe with my friends as butch who listens to exclusively 70s and 80s music, this is an absolute banger and been on repeat for about an hour but not Spotify because we all have air buds",Expresses strong enjoyment and repeated listening of the song.
Positive,Finally a comment section on a old video that doesn't have somebody saying who is here in 2024 it's getting soo annoying,Expresses relief and satisfaction about the comment section's current state.
Positive,omg the song is so catchy,Expresses strong enthusiasm and enjoyment of the song's catchiness.
Neutral,why is the beat just zelda,"A simple comparison to the 'Zelda' soundtrack, without explicit positive or negative feelings."
Negative,There is nothing bi about the lyrics in this song,Expresses disapproval and criticism of the song's lyrics.
Positive,What is it about this song?  It’s addictive! I was teaching my sister the lyrics and we were singing and doing the cheer over and over. My husband thinks it’s crazy because his Mama was joining in and doing it with us .  But he was laughing about it too. He thinks it’s funny..  🤪🤪🤪 Making awesome memories… the power of music. 🎼🎵🎶,Expresses joy and positive memories associated with the music.
Positive,Cool very 80's vibe.,Expresses enjoyment of the song's nostalgic 80s style.
Positive,Giving me Cyndi Lauper  vibes my daughter was playing this full blast in the car,"Compares the music to a well-regarded artist, indicating a positive association."
Negative,the caption lyrics are wrong at 1:02 anyone else catch this???,"Points out an error in the video's caption, indicating dissatisfaction."
Negative,"Okay i love this video, but there not being a stich of pink hardly anywhere is driving my brain crazy. I thought this video would have been a campy barbie bubblegum stripper fantasy vibe 😅",Expresses disappointment and frustration about the lack of a desired aesthetic.
Positive,Giving 80’s vibe,Expresses a nostalgic and positive association with the 80s music era.
Negative,This is awful,Directly states the song is 'awful'.
Positive,Adorei a música. Tem uma vibe muito legal.🪻❤️👏🏼🎉🥳🥳🥳🥳,Expresses strong fondness and excitement for the song.
