classificacao,comentario,justificativa
Positive,This entire video is so nostalgic. To be able to capture so much of the black community and our childhood in 2 minutes and 45 seconds is legendary.,Expresses strong admiration and appreciation for the video's content and impact.
Positive,"As someone who is mostly heavy metal and punk all day long, im a miami boy first and foremost that grew up listening to a lot of hip hop and freestyle classics in the 90s and he rep'd both Compton and Miami with this one. That beat goes so damn hard, love the appreciation for debbie deb on this",Expresses strong enjoyment and appreciation for the music.
Positive,THIS SONG TAKES ME BACK TO A VIBE THAT I THOUGHT COULD NEVER BE REPEATED....,Expresses a nostalgic and positive emotional response to the song.
Positive,This song got the 80s rhythm😤,Expresses enjoyment of the song's 80s-inspired rhythm.
Positive,Am I the only white middle aged woman here after the Super Bowl and love the vibes? 😂,Expresses enjoyment and affirmation of liking the music.
Positive,"Kendrick is the best rapper not only for his lyrics but for his impact on the industry. On top of that the humbleness and love he shows, he is truly one of a kind in his own lane. 💯",Expresses strong admiration for Kendrick Lamar's talent and impact.
Positive,"That first Woman set the tone for the whole video, hit that perfect",Expresses enthusiastic approval of the initial performance.
Neutral,Did they change the video n lyrics or am I tweaking?,Expresses confusion and uncertainty about the changes.
Positive,This guy is a genius from the beat to the bars to videos. Man we needed him. Much love Kendrick keep doing what u doing.,Expresses strong admiration and support for the artist.
Positive,This beat is so damn 🔥🔥🔥,Expresses intense enthusiasm and excitement with the use of fire emoji.
Positive,"Only kendrick could pump out a music video, thats visually super deep, of a cover to his own original song. Legend",Expresses admiration and praise for Kendrick Lamar's artistry and the music video's depth.
Positive,The beat 🔥,Expresses enthusiastic appreciation for the song's beat.
Positive,The new NATIONAL ANTHEM when the revolution is televised! I second that emotion!,Expresses strong support and enthusiasm for the song.
Neutral,Ngl i feel like everyone in the back us dancing to their own vibe 😭 ♥️,"Expresses a relatable feeling with emojis, lacking strong positive or negative emotion."
Positive,These old beats go hard af.,Expresses strong approval and excitement about the music's quality.
Positive,"Listen to GNX in reverse, or from the bottom up. It's astounding just listening in order but it feels chronologically, almost complete listening from Gloria to Wacced out Murals.  KDot on some next level type mission.",Expresses admiration and appreciation for KDot's complex and impressive work.
Positive,"Finally HIP HOP is back and about time to clear out all the drakes and mumble rapping autotuners of the world.  this is real dope ass hip hop, true to the 90s",Expresses strong approval and nostalgia for classic hip-hop.
Positive,One of the hardest verses ever 🔥🔥🔥on some GOAT SHIT ! 🌷,Expresses enthusiastic admiration and superlatives.
Positive,wanna hear this piece of beat on Gta6 radios💯😉,Expresses enthusiastic approval and desire to hear the song.
Negative,It's awful he has zero talent!  Never heard such awful music in my life,Strongly condemns the music as lacking talent and being awful.
Positive,This beat got me in my feelings,Expresses a strong positive emotional response to the music.
Positive,"Even if you don't want to dance, it's inevitable to ignore with this rhythm and flow",Expresses enjoyment and a feeling of being compelled to listen.
Positive,The beat is crazy yow🔥🔥🔥🔥🔥🔥🔥🔥🔥🇯🇲🚀🚀🚀🚀🚀🚀🚀,Expresses enthusiastic excitement with multiple fire emojis.
Positive,The Vibe is Insane,Expresses strong positive feelings about the song's atmosphere.
Negative,Bro is basically moaning on a beat. Song sounds like shit.,Expresses strong disapproval and describes the song as poorly produced.
Negative,This beat is bouncier than my ex’s large silicone boobies.,Uses a crude and insulting comparison to express dislike.
Negative,"did anyone notice the diff lyrics in the second verse before ""thonk thonk"" compare to the actual song?","Points out a discrepancy in the lyrics, indicating a potential issue with the recording or production."
Positive,Real good vibe,Expresses a positive feeling about the song's atmosphere.
Negative,This has such a nigga vibe to it.,Contains a highly offensive and derogatory racial slur.
Positive,THE BEAT SICK AF❤,Expresses strong affection and enthusiasm.
Positive,He did too good on this damn beat I can't get it out my head,Expresses strong enjoyment and inability to remove the song from one's mind.
Negative,Wow this is trash🗑im sorry but you cant take god damn freestyle dance club music song beat in try to make gangster hip-hop rap out of it in general dude is garbage he definitely not no god all gen z on this guys dick think he the best of all time stop playing yourself the new york rappers where it all started at definitely dont respect him or like his music foh no hate at all facts cant stand Westcoast rap music i only fw underground eastcoast rap where it all started Kendrick plz stop rappin your voice is not it!💯,Expresses strong disapproval and insults the artist and his music.
Positive,That beat and base 🔥🔥🔥,Expresses strong enthusiasm for the song's rhythm and bass.
Positive,This beat slaps,Expresses enthusiastic enjoyment of the song's rhythm.
Negative,50 deep but it ain't deep enough.,Expresses dissatisfaction with the song's lack of depth.
Positive,Am I the only one that’s extremely impressed at how he cleans up the lyrics so flawlessly. I know I would’ve let some curses go 😂,Expresses admiration for the artist's skillful lyric editing.
Positive,This beat sick af,Expresses enthusiastic approval of the music's rhythm.
Positive,The girl with the white skirt is a whole vibe❤,Expresses enthusiastic appreciation for a specific element.
Neutral,"He changed some lyrics in the HOLD UP... part, what's that",Expresses a simple observation about a change in the song lyrics.
Negative,"This dude really convinced an entire generation of black people and gullible white liberals that he creates deep ""music.""",Expresses skepticism and dismisses the artist's perceived influence and artistic merit.
Negative,Probably one of the worst songs ive ever heard.,Expresses strong disapproval and claims it's a terrible song.
Neutral,Tobe Nwigwe would be fire on this beat with Kendrick on a remix,Expresses a suggestion for a remix without stating a definitive opinion on the original song.
Positive,Beat crazyy,Expresses enthusiastic appreciation for the song's rhythm.
Negative,WORST HALFTIME SHOW IN HISTORTY!,Expresses extreme dissatisfaction and condemnation of the halftime show.
Neutral,I wish Kendrick would spit over “The Mesaage” beat.,"Expresses a desire for a different track, without strong positive or negative emotion."
Negative,This shit is trash. Tone deaf generation fr.,Strongly criticizes the music as 'trash' and attributes it to a 'tone-deaf generation'.
Positive,This BEAT SO SICK,Expresses enthusiastic enjoyment of the song's beat.
Negative,This gotta be the worst shit I’ve heard in my life,Expresses extreme dissatisfaction and disgust with the music.
Neutral,#WORSTHALFTIMESHOWEVERRR!,"Expresses a conflicted, slightly sarcastic reaction - neither strongly positive nor negative."
Neutral,idk if peekaboo or this is more annoying,Expresses mild frustration and confusion without clear positive or negative sentiment.
Positive,"64 soon 65 Feb 24...gonna smooth dance to this like Kendrick..THEY NOT LIKE US❤❤ From the beat to the Lyrics ❤❤❤  ain't heard a diss like this since Pac and I love me some Tupac period. Kendrick got me dancing. He dance like us😂❤ well Drake shoulda could woulda....but didn't choose the right battle next time bruh😂 what were ya thinking Dra.... Then the whole Grammy audience hit the, ""A Minor""❤❤",Expresses enthusiastic enjoyment of the music and references iconic artists.
Positive,"Squabble Up"" is a vibe! Hard-hitting beats and bold lyrics—this track fuels the hustle. 🔥💪",Expresses enthusiastic enjoyment and positive associations with the song.
Positive,I just can’t get enough of this beat and lyrics,Expresses enthusiastic enjoyment of the song's beat and lyrics.
Negative,Why did it look like he messed up his own lyrics in that scene where he crouched by the candles? 😁,Expresses concern and critique regarding a perceived mistake in the music video.
Positive,"When you have 70k backup vocals, Crips and Bloodz as backup dancer, won 5 grammys, made it to Superbowl, and made the world crip walking for a diss track is fcking crazy. Absolute legend! KDot definitely destroyed Drake. There is no coming back!",Expresses enthusiastic admiration and praise for the artist's achievements and impact.
Positive,Double vibe song of the year,Expresses enthusiastic enjoyment and a superlative assessment.
Negative,Ts so ass. Not like us was the only good song kendrick only talks to the beat. Drake was better tbh. ❤,Uses offensive language and expresses negative opinions about the artist and compares unfavorably to Drake.
Positive,I’m loving Kendrick’s vibe❤😊,Expresses fondness and positive emotion towards the artist.
Positive,The Final Verse of this song is lowkey insane,"'Lowkey insane' suggests a strong, positive reaction to the verse."
Positive,"1:51 is fucking gold, ive made that face when I forget lyrics too bro lmao",Expresses enjoyment and shares a relatable experience.
Positive,Funky ahh beat. I fucking love it.,Expresses strong enthusiasm and enjoyment of the song's beat.
Negative,They change the lyrics?,Expresses disapproval and frustration about lyrical alterations.
Negative,Wow! Officially the worst ever halftime show. My mothers nursing home entertainment is definitely better. WTF was that,Expresses strong disapproval and ridicule of the halftime show.
Positive,W vibe,‘W vibe’ is a common and positive slang expression.
Negative,U beat on ur wife,Contains a violent and abusive statement.
Negative,Bro changed the lyrics lmaooo,Expresses disbelief and criticism regarding a lyrical alteration.
Neutral,Vibes,Simple expression of feeling without specific positive or negative connotation.
Neutral,Yo you considered doing some deep bars with T pain on some of your new stuff you're writing,A suggestion is offered without expressing a clear positive or negative opinion.
Positive,Peace All Cali Vibez Video.,Expresses enjoyment of the video.
Positive,This is lyrically the most intelligent song ever…. Wow. He speaks about all types of different hip hop using album names and songs names as lyrics of actual songs and albums,Expresses strong admiration for the song's lyrical intelligence.
Positive,"Mustard on the beat, gyat damn!! 🎉🎉🎉🎉",Expresses enthusiastic approval and excitement.
Neutral,why is the verse different? at 1:27,Asks a question about a specific detail of the song.
Negative,50 deep but he aint deep enough ✊🏿.,Expresses dissatisfaction and criticism of the artist's depth.
Negative,"That performance was absolutely horrible. Kendrick’s mic was too low, he forgot lyrics and had way too many male dancers on stage smh. Lil Wayne would’ve been wayyyyy better",Strongly criticizes the performance with multiple negative observations.
Neutral,"Does anyone else find the melodic rhythm reminiscent of the soundtrack to the movie ""Killer Bean Forever""?","Comparison to another song, without explicit positive or negative judgment."
Positive,"Kendrick, don’t listen to the haters they say that you are the worst halftime ever but you were the best",Expresses strong support for Kendrick and refutes negative opinions.
Negative,you are the worst rapper in the whole entire universe,Strongly insulting and derogatory language.
Positive,K dot I know you're an album guy mainly but pls drop more singles lyrics concepts timeless themes pain tones production instrumentals lyrics tones concepts microphones don't kill my vibe money trees swimming pools get up n wipe Ur ass these Ur best songs more like these pls vibey Ty big fan from day akhi,Expresses strong enthusiasm and desire for more music from the artist.
Positive,The beat❤❤❤,Expresses enthusiastic positive feelings about the music.
Negative,He has no emotions,Expresses a negative judgment about the artist's lack of feeling.
Negative,I can't barely get through the intro and first verse without rewinding it smh,Expresses frustration and dissatisfaction with the song's initial sections.
Neutral,"god knows, i am reincarnated i was stargazin life goes on i need all my babies. Gyah gyah woke up lookin for the broccli high key keep a horn on me that kamasi ip the owner ship the blueprint is by me. mr get of i get off mop my feet.  2nd verse (sample debbie deb when i hear music)(when i hear music it makes me dance u got the music now means yo chance. a yee nigga couldnt try me in the tri state body pass going on some splash till he hydrated bounce out like a spook town eyes dilated i got the money in my bag eyes gylatin.","Contains a mix of nonsensical phrases and seemingly random comments, lacking clear sentiment."
Positive,"Kendrick Lamar is the Boss, he did that. His lyrics are on point, with a cold beat.",Expresses admiration for Kendrick Lamar's lyrics and music.
Neutral,"Yo,did no-one hear that some of the lyrics are changed?",Expresses a question about potential lyrical alterations without strong emotion.
Positive,Lyrics are so on point tho,Expresses approval of the lyrics.
Negative,His voice is so annoying and this song is so cringe,Expresses strong dislike for the singer's voice and the song itself.
Positive,"I love the chorus, the old school flow her smile and she looks like she having fun. 🎉",Expresses enjoyment of various aspects of the music video.
Neutral,"Okay, this is an absolute BANGER. HOWEVER, this is 100000000% a Drake type flow and beat.",Acknowledges a positive aspect but identifies a similarity to another artist.
Negative,50 deep..but they ain't deep enuff,Expresses dissatisfaction and a lack of depth.
Positive,"This beat right here is the one ... On another note, can we get this on beatsaber too? I'm living for those Kendrick drops 🤣😁♥️","Expresses strong enjoyment and excitement about the beat, with a hopeful request and emojis."
Neutral,I really like the flow and the style but the sound the pitch something doesn’t feel right.,Expresses some positive aspects alongside a critical observation about the sound.
Negative,His voice is really annoying,Expresses a negative opinion about the singer's voice.
Neutral,01:29 lyrics changed up. anyone transcribe it ?,Asks a question about lyrics without expressing a positive or negative opinion.
Negative,I really dont see what everyone else sees in this guy i find his music annoying like hes trying to rap the way nicki minaj and all the other female rappers rap. To me it sucks,Expresses strong dislike and comparison to other artists negatively.
Negative,Cod infintite warfare vibes,The phrase 'infinite warfare' suggests a bleak and unsettling theme.
Neutral,"Kendrick, if I make my own music will you put one of my verses in your song?",A hopeful question with no inherent positive or negative sentiment.
Positive,god I love this beat so fucking much,Expresses intense enjoyment of the music's beat.
Negative,This song is trash so annoying the beat every only Kendrick long ears is listen able,Expresses strong dislike and finds the song irritating.
Positive,Song been stuck in my head for weeks! The video and the song!!!!! Drake take notes.,Expresses repeated enjoyment and admiration for the song and video.
Positive,Can’t get this beat out of my head!,Expresses strong positive feelings about the song's repetitive and memorable nature.
Positive,Been  watching music videos since before MTVdid not allow black artists. Started out watching black and white music videos before they were called music videos . I’ve seen them all. This is the BEST music video ever produced.  Hands down. Used to sneak in the clubs in Brooklyn and see Debbie Deb crush it with this beat. Two turntables and a microphone.,Expresses enthusiastic praise for the music video and references a positive historical connection.
Positive,"I just noticed all the small references on the sides from soul train to the cholos y cholas, black panthers, soul train etc etc.... I F****** LOVE THIS VIDEO. AND THE FACT THAT HE WENT OLD SCHOOL, LATIN FREESTYLE MUSIC AND M*********** PLAYED SOME DEBBIE DEB SAMPLE FIRE.THIS BEAT FIRE FIRE FIRE FIRE",Expresses enthusiastic enjoyment and appreciation for the video's elements.
Positive,KENDRICK IS THA ONLY ARTIST IN THIS ERA WHO GIVES ME THAT OLD SCHOOL RAP VIBES🙌😁❤❤,Expresses strong admiration and positive feelings towards Kendrick Lamar.
Negative,"Most overrated, corny, off beat, uncoordinated puppet. Only famous because of Mustard.",Strongly criticizes the artist as unskilled and reliant on a producer.
Neutral,That west coast beats.,A simple observation about the musical style without expressing positive or negative feelings.
Negative,Worst halftime show not even lying i love u kendrick but this was WEAK,Expresses strong disapproval and criticism of the halftime show.
Negative,"Why does this sound so much like Big Dawgs from Hanuman kind... The starting beat is the exact same, is this an interpolation? And did he get permission to do so lol",Expresses concern about copyright infringement and similarity to another song.
Positive,Dude really got them smooth low key moves.. cannot deny boy got rhythm,Expresses admiration for the artist's movement and rhythm.
Negative,Diss idea talk about how Drake stole lyrics from songs,Expresses strong disapproval and accuses Drake of plagiarism.
Neutral,I miss the old days when someone used to write the whole lyrics as a comment and it would be the highest liked comment on the music video!,Expresses nostalgia without strong positive or negative emotion.
Negative,Only way Drake getting over this is to beat up Kendrick Lamar in the ring,Expresses a violent and aggressive desire for Drake to defeat Kendrick Lamar.
Positive,Has to be my fav Kendrick song ever...this is a throwback to the 80s... love the sound and modern flow..the video is artistic master piece...We need more 80s beats with a modern twist like this,Expresses strong enjoyment and appreciation for the song's style and video.
Negative,The only thing carring this is the beat,"Expresses disappointment with the song, focusing on a single positive aspect."
Neutral,I forgot the MV lyrics were a lil different,States a factual observation without expressing a positive or negative opinion.
Positive,K.Lamar he's been laying low for years because he's different 2Pac Vibes,"Compares the artist to the revered 2Pac, expressing admiration."
Positive,The vibe is crazy it makes u dance🤷,Expresses enjoyment and a desire to dance.
Negative,top ten worst songs ever,Expresses strong disapproval and ranks the song negatively.
Positive,Catchy,The word 'catchy' indicates a positive and enjoyable quality of the music.
Positive,Such a dope vibe,Expresses enthusiasm and appreciation for the song's atmosphere.
Positive,The diverse sounds made this one 🔥🔥🔥,Expresses enthusiastic approval with fire emojis.
Neutral,Why are the lyrics different on the music video? Did anyone else notice that?,Expresses a simple observation and question without strong positive or negative feelings.
Negative,"Hey Doc can I get a drop? I'm like Nigga, Naw... . This verse  kills me every time! 😮😂😂😂😂😭😭😭",Contains offensive language and expresses negative emotion.
Positive,Homie with the braids dancing and looking back is a vibe,Expresses appreciation for a particular aesthetic and movement.
Negative,Worst song,Expresses a strong negative opinion about the song.
Neutral,1:28 bro forgot the lyrics,"A simple observation about forgetting the lyrics, lacking any strong sentiment."
Negative,My god this zhit is awful,Expresses strong disapproval and uses a derogatory term.
Positive,I like the beat for real 💃🏻😂,Expresses enjoyment of the song's beat.
Positive,It sounds like hanumankind and the dance looks like hanumankind ❤ 90s vibes as well ❤,Expresses fondness for the song and its aesthetic.
Positive,"😃🎵🎶 "" DANCE W-ME "" 😄🎵🎶✨🌟👑💃💙💙💙💙💙❤️❤️❤️❤️❤️🏋🏽‍♂️👑🌟✨💙❤️🔔👏🌎🙏🕯️😇🥰💃🏃🏽‍♂️😎🎵🎶💃💃⛹🏽‍♂️🔔🔔🔔🔔🔔💃💃🏋🏽‍♂️😃👏 "" VIBES UP""👏👏👏👏👏💞 &🕯️👍💯",Expresses enthusiastic enjoyment and positive sentiment through emojis and repeated positive phrases.
Neutral,What are the notes,A simple question with no expressed opinion.
Negative,"Kendrick Kendrick Kendrick why are black people on the street, Sacramento is the Capitol and still there aint no love.🐥 Stockton is 15 minutes away, your people are all over the country. Lyrics all over the world but the hate still in them, aint no revolution just an attempt at asking for a dollar.🐥",Expresses frustration and cynicism about societal issues and lack of change.
Negative,50 cent deep but he not deep enough wow,Expresses disbelief and criticism of 50 Cent's perceived lack of depth.
Negative,"I’ve heard this song sampled so much, this ain’t even close to the best beat. Kendrick carried on it tho",Criticizes the song’s beat and suggests it’s not impressive.
Positive,Dr Dres anthem when he boxing with his ex’s. The real BEATS by Dre.,Expresses enthusiastic appreciation for Dr. Dre's music.
Negative,Is this a mix? 1:30 makes no sense and completely skipped the bridge and maybe verse 2??,Expresses confusion and criticism regarding the song's structure.
Neutral,"He reversed the lyrics around 1:28 to 1:46, I noticed it today.",Points out a specific detail without expressing a strong opinion.
Negative,"Kendrick Lamar? Man, you're the only rapper who can make a song sound deep while still being as confusing as a Google Translate version of the Bible. You’re so introspective, I’m surprised you haven’t written an entire album about how long it takes to find your car keys.",Uses sarcasm and criticism to suggest Kendrick Lamar's music is overly complex and lacking clarity.
Neutral,Ayo the lyrics are different,Expresses a simple observation about the lyrics without positive or negative judgment.
Neutral,"Ok Money and the fame may cause problems being me in believer form my Have me dling more than stargazing , Far away I'm still saying Hi and Waiting on A Educated Leader to Bring me in deeper of the Game of Wisdom and Life away from The system,",Expresses mixed thoughts about fame and leadership without strong positive or negative emotion.
Positive,Man I❤ this beat see soon  😂,Expresses strong positive feelings with an emoji.
Positive,This beat is addictive.,Expresses strong enjoyment and describes the beat as 'addictive'.
Negative,"People only care about the lyrics, other than that the music is ass so is his voice",Expresses strong dissatisfaction with both the lyrics and the vocalist's performance.
Negative,""" why the fuck you rap if its ficitonal"". That hot deep. Rap isnt the same and i hope he revives the authentic nature of it. Rap was to educate, inspire and bring awareness to the struggle. Now its fuck bitches, kill someone and do drugs. Lil Wayne ruined rap fr fr",Strongly criticizes modern rap and Lil Wayne's influence.
Positive,This beat....,Expresses enjoyment of the music's rhythm.
Negative,"This song sounds like family matters a lot, which is sorta a problem Drake needs to figure out about his sound. It's not diverse enough. Sometimes less is more, how about a shorter album? 12 to 15 better composed songs?",Criticizes Drake's music for lacking diversity and suggesting an overly long album.
Neutral,The vibe,"Short, open-ended comment lacking specific sentiment."
Positive,Thank you superbowl for introducing me to this beat!,Expresses gratitude and positive reaction to discovering the music.
Neutral,😮 who’s beating this,Expresses surprise and a simple question without clear sentiment.
Positive,Good Vibes right here 💚🔥,Expresses enthusiasm and excitement using emojis.
Positive,W vibe,'W vibe' expresses a positive and energetic feeling.
Positive,bro never runs out of good music cuz the beat💀,Expresses enthusiastic enjoyment of the music's quality.
Neutral,"Where is subtitles? Am learning English with Kendrick's music but am not understanding anything, just liking the rhythm",Expresses frustration about lack of subtitles and focuses on musical rhythm.
Neutral,They changed the beat,Expresses a simple observation about a change in the music.
Neutral,Nice belt buckle ... artsy vibe ...,A simple observation with no expressed opinion.
Negative,kendrick lamar fans after hearing the worst shit ever played,Expresses disbelief and criticism of Kendrick Lamar fans' reaction.
Neutral,did anyone notice the lyrics change on 1:28 or i'm hallucinating  ?,Expresses a specific observation about a lyric change without strong positive or negative judgment.
Positive,"i get a real ""stop making sense"" feel from the set decoration and camera work. simple, arty, humorous, deep. i need to see the BTS of @2:12 that must have been absolutely bonkers to film",Expresses appreciation for the artistic and creative elements of the video.
