classificacao,comentario,justificativa
Neutral,It wild that he is in the scenes but he is not really there for most of them. The power of static shots and after effects and great editing!😮,Observes technical aspects of the video with a neutral tone.
Negative,the nigga kendrick lyrics are prophetic (tell me why you niggas FED if you criminal) drake suing in the fed . kendrk got foresight,Contains derogatory language and expresses negative opinions about Kendrick Lamar and his music.
Neutral,The vibe of the video is “Dywtfm (Do you want to fight me)”,"References a meme, indicating a playful and potentially ironic observation."
Neutral,✏️ Describe the vibe,"A simple request for description, lacking sentiment."
Negative,Most annoying fuckin song.,Expresses extreme annoyance and negativity towards the song.
Positive,His delivery I don’t feel but the beat  nice and his lyrics are dope🤷🏽‍♂️,Expresses enjoyment of the beat and lyrics.
Positive,"Kendrick second verse ""what the f### I got hits I got bucks I got new paper cuts,I got freinds I got foes but they all sitting ducks,hit his terf and get parked like a deluxe"" was just straight 🔥 FIRE",Expresses strong enthusiasm and approval.
Neutral,lolololol have the lyrics always been different why did i just notice ahahah,Expresses amused confusion and observation without strong emotional judgment.
Positive,Whoever made this beat deserves an award as well. Absolutely nasty,Expresses high praise for the beatmaker's work.
Negative,"Shit giving me "" the roots ""the next movement "" vibes. Not the song but the video. Lol",Compares the video negatively to the song
Positive,😊 great vibe!!!,Expresses positive feelings with an emoji.
Neutral,Has anyone broke down the new bridge lyrics?,"Asks a question about the lyrics, expressing curiosity without a clear positive or negative opinion."
Neutral,Hey this man used album cover name for lyrics look it it word,A simple observation with no clear positive or negative sentiment.
Neutral,Did he change the lyrics? 😮,Expresses surprise and questions a potential change.
Negative,biggest piece of trash Kendrick lamar is the worst rapper in history,Strongly denigrates Kendrick Lamar as the worst rapper.
Neutral,"Wait the ""hol uppp"" part is different than original lyrics 😮",Expresses surprise and observation about a lyrical difference.
Negative,Iam ugly white man and i say it was the worst half time show ever 🤡,Expresses strong disapproval of the halftime show with a derogatory emoji.
Neutral,Who is with 2025 vibes only,Expresses a preference for a specific aesthetic without strong emotional content.
Positive,Who else came here after hearing this song with the Sabrina Carpenter Expresso beat??😅,Expresses shared enjoyment and connection related to the song.
Positive,Such a vibe,Expresses a positive feeling about the music's atmosphere.
Negative,"This that cookie cutter, lowest common denominator shit. No amount of imagery of pseudo-intellectualism can change the fact Kdot has now beaten Drake in his own game, and is now dominating the commercial angle. Sad to see Kendrick go down this route but he seems to be enjoying the attention.",Criticizes Kendrick Lamar's music as lacking depth and prioritizing commercial success.
Positive,Drake is about to remix this beat and chorus.,Expresses anticipation and positive expectation for a Drake remix.
Positive,Kendrick is absolutely killing the scene with the old school vibe !! Every OG's would be proud of him,Expresses strong praise for Kendrick’s style and evokes a positive association with established artists.
Neutral,Why did the lyrics change from original release?,"Asks a question about a change, lacking explicit positive or negative sentiment."
Positive,I love the beat,Expresses clear enjoyment of the music's rhythm.
Negative,Had to ruin the beat with his rap,Expresses annoyance and disapproval of the rap section.
Negative,This new stuff is just awful. I can’t… like what?,Expresses strong dislike and confusion about the new music.
Neutral,All these lyrics are song titles! Crazy,Observes a stylistic element without expressing a positive or negative opinion.
Neutral,Vibe,"Short, ambiguous word with no clear positive or negative connotation."
Neutral,I don’t think anyone notices but when he steps it usually on beat,A simple observation without strong positive or negative sentiment.
Positive,I love how no one is talking about the where the beat came from (When I Hear Music - - Debbie Deb),Expresses appreciation for a specific song.
Neutral,his voice sounds dumb ash but its so damn catchy lmao,Mixed feelings – acknowledges a negative voice quality but praises catchiness.
Neutral,The nonficticous lyrics tho!,Expresses a simple observation without strong positive or negative sentiment.
Neutral,I’m I tripping or he change the lyrics?,Expresses confusion and asks a question about a potential lyric change.
Negative,Shout out all the street venders the drug the tortillas on basketball court beating old street venders..im scared thanks to tekashi 😮,Expresses fear and negativity related to street vendors and criminal activity.
Neutral,No tombstones,The comment is a simple statement with no expressed emotion.
Neutral,On one hand..... I love the video. Looks like they had fun making it. But I bet if I look up the lyrics I'll find something upsetting.,Expresses a mix of enjoyment and apprehension.
Positive,This music video is honestly insane I don't even understand it on a full level but it's amazing layered with intelligence and deep meaning fucking crazy,Expresses enthusiastic admiration and appreciation for the video's complexity and artistry.
Negative,I need my Dre beats for this noise cancellation,Expresses dissatisfaction with the music as 'noise'.
Neutral,01:30 CHANGED THE LYRICS,"A simple statement of a change, lacking emotional tone."
Negative,Ngl this songs beat is horrible,Expresses negative opinion about the song’s beat.
Negative,Trashing a good band and song by sampling them 😢. #worstrapper along with DRAKE 😂,Expresses strong disapproval and insults the artist and their music.
Neutral,Why they change the lyrics,Expresses confusion and questioning about a change.
Positive,Gotta love the flow on this one and the lyrics are primo as always,Expresses strong approval of the song's flow and lyrics.
Positive,Hope Pretty Tony butler made  some money off this tune  .   Miami all day on that beat !!!,Expresses enthusiasm and enjoyment of the music.
Negative,This guy sucks.he can't even come up with his own original beats,Directly insults the artist's musical ability.
Positive,He trash this beat and I'm not even a fan but that was bars at their best,Expresses high praise for the song's quality (
Positive,He flow immaculate on any beat,Expresses high praise for the artist's flow.
Positive,Kendrick cold this track killed Drake alone … this was deep reaching in the soul psychological sh!t,Expresses strong admiration and appreciation for the song.
Negative,"Sounds like a black nursery rhyme 😂.    I get the woke people like his activism, but nobody can argue the music is good..  nasally voice and klunky beats..   if his message was different you would see how gooofy this is..",Expresses disdain for the music and criticizes the artist's voice and style.
Negative,"Even after reading the lyrics; why do I only hear ""get the fuck out my thighs, look good but she don't got no ties, I walk in walked out with the sides, Mando let me know what the plies""",Contains vulgar language and expresses strong dissatisfaction with the song's content.
Positive,Bro vibes 🎉🎉🎉,Expresses enthusiastic excitement and joy.
Positive,Man nice with his lyrics! 💯 😊,Expresses enthusiastic approval with emojis.
Positive,Mad ❤ arse … Beat x voice x sound x words fire,Uses enthusiastic and positive language expressing strong approval.
Negative,So sad NotSexy red is so fucking awfull... fuckinf L choise ....,Expresses strong disapproval and frustration with the color choice.
Negative,this video is so random and his voice annoying lol,Expresses dislike for the video and the singer's voice.
Neutral,Was some of the lyrics change?,Asks a question about potential lyrical alterations.
Neutral,"Did the lyrics change on the bridge in the video? Where he says hold up, where you from? Side ways…at the 1.30 mark",Asks a specific question about the song lyrics.
Neutral,Lyrics are meh. 😆,"Expresses a mild, unimpressed opinion about the lyrics."
Neutral,Why did he change the lyrics?,Expresses a simple question without indicating positive or negative feelings.
Positive,Made this song brand new all over again by releasing the video 3 months later. Aint eem mad. This song still a big vibe. Thank you Kandlelight Kenny. You heard it here first.  (Nickname must be reserved for slow songs).,Expresses positive feelings about the song and acknowledges its continued popularity.
Negative,Had to come back here to get the awful sound of that new PND/drake album out of my ears.,Expresses strong dissatisfaction and annoyance with the album.
Negative,Old beat 😢 https://youtu.be/408dLNLWU-U?si=JeYdzF4aqJiL1DFI,Expresses disappointment and sadness due to the song's outdated rhythm.
Positive,"I just realized that I have heard this melody before in the film ""Ma"" What a genius 🔥",Expresses excitement and appreciation for the song's connection to a film.
Neutral,"Just checking out the samples they used for this…besides the Debbie Deb, the funk sounds like Bay Area type beat.","Describes the samples used, offering observational details without strong emotional assessment."
Negative,1:29 did they change the lyrics wtf? It wasn’t like this when it dropped 💀,Expresses confusion and disappointment regarding a lyrical change.
Positive,man he had way too much creativity in the first verse,Expresses admiration for the artist's creative input.
Negative,This uperbowl half time show was the worst i have ever seen,Expresses strong dissatisfaction with the halftime show.
Negative,Tempo is too slow would have been a much better song if it was sped up . Come on Kendrick how did u not see that? Oh cuz your not a great and don’t have that great EAR,Expresses disappointment and criticism regarding the song's tempo and the artist's perceived lack of musical understanding.
Negative,The beat switch upped this from manslaughter to first degree murder.,Uses violent imagery to express strong dislike of the song.
Positive,I love the music video is so diverse,Expresses appreciation for the diversity in the music video.
Neutral,"I'm not gonna bash her, she just needs to find the love for it, she got catchy song, but we all want a classic",Offers a gentle critique alongside a positive observation.
Negative,Kendrick should have invited Debbie Deb to the Super bowl for some freestyle vibes! Serena was a lame choice !,"Criticizes Serena Williams' performance and suggests a different, arguably more skilled, artist."
Negative,Everyone gonna act like wayne verse wasnt mid?,Expresses strong disapproval of a specific song verse.
Neutral,Anybody notice the lyrics changed,Raises a question about a change in the lyrics without expressing a clear positive or negative opinion.
Negative,Worst rap song I have ever heard....and that is on JJ 🧊,Expresses strong disapproval and criticism of the song.
Neutral,Can i get the lyrics man,"A simple request for lyrics, lacking any emotional content."
Positive,❤❤❤❤❤❤ outstanding lyrics amazing impact thanks again for sharing,Expresses strong positive feelings and gratitude.
Positive,1:42 Ayo. That's deep bruh!,Expresses enthusiastic appreciation and recognition of a profound element.
Positive,"“Kendrick walks the same poetic path as Nas and Rakim — truth-telling with rhythm. That’s the path I walk too, speaking on South Central life through poetic bars. Salute.”",Expresses strong admiration and alignment with Kendrick's artistic approach.
Negative,It’s me Aubrey Villalobos that’s me Anthony I like her like everybody places that are like that in one area I do it through and I know you’re ready gangster gangster gang gang gang gang gangster spoke to Larry is crazy scary spooky lyrics I do a little robot,"Contains nonsensical and erratic statements, suggesting frustration and possibly ridicule."
Positive,Low rider beat sounds dirty ❤,Expresses positive emotion with a heart emoji.
Neutral,Kung Fu Kenny I need to know whats going on at 1:30 with lyrics. I been trying to figure this out for 8 months.. I've tried everything. I feel like Jim Carrey on 23..,"Expresses a specific, detailed problem without a clear positive or negative judgment."
Neutral,Kendricks songs would be so much better with a Drake hook. Maybe even a beat Drake would use.,Suggests a hypothetical improvement without expressing strong positive or negative feelings.
Neutral,This beat belongs to Tyler now🤷🏾‍♀️,Expresses a simple observation without positive or negative emotion.
Positive,Nobody can beat this sh!t 😂😂😂😂😂😂😂😂😂😂😂😂😮‍💨😮‍💨😮‍💨😮‍💨😮‍💨😮‍💨😮‍💨,Expresses enthusiastic enjoyment and approval with excessive laughter emojis.
Positive,Bro be dropping beats since 2009,Expresses admiration and appreciation for the artist's longevity.
Negative,All his songs have the same beat wtf,Expresses frustration and criticism regarding repetitive song structure.
Negative,Only the beats are hard. This guy does really suck…so does drake,Expresses strong dislike for the artist and the song's quality.
Neutral,What happened to the chorus mid song bruh,"Expresses a specific, neutral observation about the song."
Negative,Wayne verse = 🚮,Uses an emoji to express strong disapproval of Wayne's verse.
Positive,This beat is so fire,Uses enthusiastic language ('fire') to express strong enjoyment.
Negative,"I don't like this crap. Some things are not for us Latine/Hispanic folks. Have some respect for Black folks culture, slang, etc. Some of the lyrics shouldn't even be said by us. Im tired of y'all mfs.",Expresses strong disapproval and insults directed at the artist and listeners.
Negative,dudes off beat,Critically points out a rhythmic error.
Negative,Beat is so lame. Lots of words saying nothing. Annoying voice. Well produced video but boring concept,"Expresses dislike of the beat, lyrics, and overall concept."
Neutral,1:29 WHY THIS VERSE SOUND DIFFERENT THAN THE ORIGINAL,Asks a question about a specific aspect of the song.
Neutral,Last verse is in the wrong spot,Expresses a simple observation without positive or negative emotion.
Neutral,I’m a 64 y.o. white woman.  I love this beat but I wish I understood the lyrics.  It sucks getting old😪,Expresses a preference with a slight expression of frustration.
Positive,Love that he sampled Debbie Deb and When I Hear Music. Gives the song an old school vibe.,Expresses appreciation for the song's nostalgic sampling.
Neutral,Beat go Hard but that’s it 😂,"Expresses a simple, mildly positive assessment with a dismissive tone."
Positive,I will always be amazed at how much rhythm black people have!!! Fun as hell to watch ! I love the step ol boy has in the gray and black striped shirt. Been trying to figure that step😊,Expresses enthusiastic enjoyment and admiration for the music video.
Neutral,This is probably the worst Kendrick album and it’s still the best piece of art created so far in the 2020s besides Mr morale,Expresses a mixed opinion – both criticizing and acknowledging artistic value.
Neutral,Anybody notice at 1:28 the lyrics changed a little bit now?,Points out a specific detail and raises a question without expressing a strong opinion.
Positive,"If I was on acid and I watched this, I would think this was some sort of alien race from deep within the blossoming nebulas of the universe","The comment expresses awe and fascination, indicating a positive experience."
Neutral,This makes me think of kinda like a funk vibe but with rap that you can understand,Describes the song's style with a somewhat ambiguous and observational tone.
Neutral,Bust that on the beat,"Short, informal expression of opinion – neither positive nor negative."
Positive,The BEAT💯,Expresses enthusiastic appreciation for the song.
Positive,Bro has me feeling 90s vibe all mf day 💯❤️,Expresses strong positive feelings and nostalgia.
Neutral,The vibe is giving,Expresses a subjective observation about the song's atmosphere without strong positive or negative connotations.
Negative,dookie type beat,"The term 'dookie' is generally considered vulgar and unpleasant, indicating a negative opinion of the song's rhythm."
Positive,Now there’s a blue print of being violent with your lyrics without actually being violent STRICTLY DOPE!!!🤜🏾🤛🏾,Expresses enthusiastic approval of the song's lyrical content.
Positive,I told you all 3 years ago he was under rated he bring the west coast beat back ❤❤❤❤❤❤❤❤,Expresses strong support and affection for the artist.
Negative,Is it just me... this video feels like a bad trip...it stirs up a lot of disturbing emotion,Expresses discomfort and unsettling feelings associated with the video.
Negative,THE BEAT IS OVER MAX,Expresses dissatisfaction with the song's rhythm.
Neutral,✏️describe the vibe,"A simple request for description, lacking sentiment."
Neutral,I like the beat of the song but I don't understand what he's saying/rapping...subtitles please 🙏,Expresses a preference for the beat while indicating confusion about the lyrics.
Positive,Jesus Saves Gangsters Too!  Keep up the grind with the lyrics Kendrick!,Expresses support and admiration for Kendrick Lamar's work.
Negative,I'm glad DaBaby killed this beat it disserves bars and this original shit is not it.,Expresses strong disapproval of the song's quality and originality.
Negative,"I just realized that when he does the chant where he repeats himself, they are completely different lyrics than his album squabble up",Expresses confusion and criticism regarding inconsistent lyrics.
Neutral,Anyone know why the background vocals wasn’t in on that one section?,Asks a question about a technical aspect of the song.
Negative,I'll give em every weapon I got in my arsenal to make it a fair squabble . The Universe will just give me more cause she don't like these thieve nature haters no more than I do,Expresses anger and disdain for the artist and their views.
Negative,Do you know how stupid this glazing is with Kendrick Lamar. He won 5 Grammys off a diss track. Backwards as f***. Nothing influential about a diss track. I can name a lot of records that should have got those awards. Only reason this happened was to try to make Drake obsolete. Keep trying. You can only beat Drake with Drake. Canadian r&b rapper has got the industry on lock and everyone is mad because they can’t beat him. Bunch of crybabies if you ask me. What happened to competition. Keep up,Expresses strong disapproval and criticism of Kendrick Lamar's achievement and the situation surrounding it.
Positive,I feel dance in th car and beating some one at the same time😂😂,Expresses joyful excitement and a desire for energetic activity.
Positive,Infinite warfare zombies vibes lmao,"References a popular and well-regarded song, indicating enjoyment."
Neutral,Why does the beat kinda sound like Pako 😭,"Compares the song's beat to another song, indicating a similarity but not necessarily a positive or negative judgment."
Neutral,"He looks numb and jaded. Really weird tone to the music video, I like it.",Expresses a subjective opinion about the music video's tone.
Neutral,Did yall peep the lyrics switch at about 1:28 👀,Expresses curiosity about a specific lyrical change without indicating positive or negative feelings.
Neutral,Men Kenrick and Kyrie had the same vibe..,Observes a similarity between two artists without expressing strong positive or negative feelings.
Negative,Straight trash! And that chick is WAY off beat while he stands there trying to look tough. Even HE isnt interested in this song that's playing. Fool should be wearing a jesters crown and a red nose. He CLOWNED himself!,"Strongly criticizes the song and the performer with harsh, insulting language."
Negative,Who he steal this beat from Mannie Fresh…Gelo sound like he tryin out for the new Big Tymerz album,Expresses suspicion of plagiarism and criticizes the artist's sound.
Positive,Definitely that old school caddie beat ❤❤❤❤,Expresses strong positive feelings using heart emojis.
Neutral,https://youtu.be/q24o6ljQYPc?si=HXUmXpehBRFbWDSw. Jairo Beatbox. Maybe Link?,"Provides a link to a video and a simple descriptor, lacking strong sentiment."
Negative,This is trash bro. Kendrick could take a literal shit on a beat and y'all would eat it right up.,Strongly criticizes the music as low quality and insulting.
Negative,Poo 💩 vibe,Uses offensive and derogatory language to express a negative feeling.
Positive,Love how the beat switched up Hyphy for the Bay Area representation part of the vid 😮‍💨🔥🔥🔥,Expresses enthusiastic enjoyment of a specific musical change.
Neutral,Does anyone know what he says on the verse starting at the 1:28 mark? The lyrics are different from the album version but I haven't see anyone discuss.,"Asks a question about the lyrics, expressing curiosity without expressing a positive or negative opinion."
Positive,Never heard this verse and been a fan since 2005 11 yo,Expresses long-term appreciation and enthusiasm for the artist.
Positive,invader zim ahh beat 🥶🥶,Expresses enthusiastic enjoyment of the song.
Negative,"Kendrick told Half a Dollar  "" hit his turf, get it cracking,  double back like a deluxe, 50 deep, but he ain't deep enough ""!!",Uses aggressive and dismissive language to criticize Kendrick Lamar.
Positive,Props to showing Rhythm and Gangster Nate Dogg rip,Expresses respect and remembrance for Nate Dogg.
Neutral,Anyone else notice that the song lyrics from 1:30 to 1:47 is different from the the Spotify version? 🤔🧐,"Raises a question about a discrepancy in the lyrics, without expressing a strong positive or negative opinion."
Neutral,Why did I never notice at 01:28 that the words are completely different than from the actual lyrics.....hmmm,Points out a factual error without expressing an opinion.
Negative,"The verse part starting at 1:30 is distorted, everything means something, Kendricks trying to tell us something but what!?",Expresses confusion and criticism of the song's production and lyrics.
